Searched,Title,Authors,Published,Type,Include?,Exclusion code,Database,Source
12/02/2018,Multivariate Output-Associative RVM for Multi-Dimensional Affect Predictions,Achut Manandhar,2016-01-01,article,,,Zenodo,https://zenodo.org/record/1111901
12/02/2018,"Annual Reports of Education, Health and Sport 9781329876002","Radzimińska, Agnieszka et al.",2013-01-31,book,,,Zenodo,https://zenodo.org/record/45472
12/02/2018,Bored in the USA: Experience sampling and boredom in everyday life.,"Chin, Alycia",2017-01-01,article,,,Zenodo,https://zenodo.org/record/894578
12/02/2018,Figure 7. Neural Network model-Classification of Human Emotion from Deap EEG Signal Using Hybrid Improved Neural Networks with Cuckoo Search,M. Sreeshakthy,2015-12-01,figure,,,Zenodo,https://zenodo.org/record/1163839
12/02/2018,Predicting the Three Major Dimensions of the Learner-s Emotions from Brainwaves,Alicia Heraz,2007-07-23,article,,,Zenodo,https://zenodo.org/record/1076762
12/02/2018,"Annual Reports of Education, Health and Sport 9781329899971","Meshcheryakova, A. V. et al.",2013-09-30,book,,,Zenodo,https://zenodo.org/record/46021
12/02/2018,A method for Music Classification Based On Perceived Mood Detection for Indian Bollywood Music,Vallabha Hampiholi,2012-12-25,article,,,Zenodo,https://zenodo.org/record/1084718
12/02/2018,"Annual Reports of Education, Health and Sport 9781329876262","Mikolajewska, Emilia at al.",2013-01-31,book,,,Zenodo,https://zenodo.org/record/45634
12/02/2018,"Annual Reports of Education, Health and Sport 9781329900554","Starenkyi, Victor et al.",2014-01-31,book,,,Zenodo,https://zenodo.org/record/46139
12/02/2018,"Intelligent emotions stabilization system using standarized images, breath sensor and biofeedback – preliminary findings - short communication","Sokolov, Oleksandr",2015-02-28,article,,,Zenodo,https://zenodo.org/record/16251
12/02/2018,Violent Videogame Playing and Its Relations to Antisocial Behaviors,Martin Jelínek,2016-05-03,article,,,Zenodo,https://zenodo.org/record/1124889
12/02/2018,Identification of Arousal and Relaxation by using SVM-Based Fusion of PPG Features,Chi Jung Kim,2011-11-27,article,,,Zenodo,https://zenodo.org/record/1076014
12/02/2018,Modulation of Total Sleep Time by Transcranial Direct Current Stimulation (tDCS),Frase L,2016-04-11,article,,,Zenodo,https://zenodo.org/record/439501
12/02/2018,Authoring Tactile Gestures: Case Study for Emotion Stimulation,Rodrigo Lentini,2016-10-02,article,,,Zenodo,https://zenodo.org/record/1127422
12/02/2018,The Functional Magnetic Resonance Imaging and the Consumer Behaviour: Reviewing Recent Research,Mikel Alonso López,2016-02-01,article,,,Zenodo,https://zenodo.org/record/1123729
12/02/2018,"Capitalizing on the success of romantic partners: A laboratory investigation on subjective, facial, and physiological emotional processing.",Michał Kosakowski,2014-04-23,article,,,Zenodo,https://zenodo.org/record/260085
12/02/2018,Figure 5. Process flow of PSO-Classification of Human Emotion from Deap EEG Signal Using Hybrid Improved Neural Networks with Cuckoo Search,M. Sreeshakthy,2015-12-01,figure,,,Zenodo,https://zenodo.org/record/1163833
12/02/2018,The relationship between acute stress disorder and posttraumatic stress disorder in severely injured trauma survivors,"Creamer, Mark",2004-04-01,article,,,Zenodo,https://zenodo.org/record/918339
12/02/2018,"EXAMINING THE RELATIONSHIP BETWEEN EMOTIONS, CUSTOMER SATISFACTION AND FUTURE BEHAVIOURAL INTENTIONS IN AGROTOURISM","Chatzigeorgiou, Chryssoula",2009-03-15,article,,,Zenodo,https://zenodo.org/record/375533
12/02/2018,Browsing Abstract Art by Appearance,"Padilla, Stefano",2012-04-01,section,,,Zenodo,https://zenodo.org/record/811662
12/02/2018,Analysis of the Long-term Effect of Office Lighting Environment on Human Reponses,D.Y. Su,2012-07-25,article,,,Zenodo,https://zenodo.org/record/1085696
12/02/2018,OPEN_EmoRec_II- A Multimodal Corpus of Human-Computer Interaction,Stefanie Rukavina,2015-05-04,article,,,Zenodo,https://zenodo.org/record/1105961
12/02/2018,OPEN_EmoRec_II- A Multimodal Corpus of Human-Computer Interaction,Stefanie Rukavina,2015-05-04,article,,,Zenodo,https://zenodo.org/record/1105977
12/02/2018,The Impact of Video Games in Children-s Learning of Mathematics,Muhammad Ridhuan Tony Lim Abdullah,2012-04-28,article,,,Zenodo,https://zenodo.org/record/1056970
12/02/2018,The Consumer Responses toward the Offensive Product Advertising,Chin Tangtarntana,2017-05-01,article,,,Zenodo,https://zenodo.org/record/1131021
12/02/2018,A Psychophysiological Evaluation of an Effective Recognition Technique Using Interactive Dynamic Virtual Environments,Mohammadhossein Moghimi,2017-04-03,article,,,Zenodo,https://zenodo.org/record/1130437
12/02/2018,"Employee Aggression, Labeling and Emotional Intelligence",Martin Popescu D. Dana Maria,2014-06-01,article,,,Zenodo,https://zenodo.org/record/1093766
12/02/2018,Information Theoretical Analysis of Neural Spiking Activity with Temperature Modulation,Young-Seok Choi,2015-05-04,article,,,Zenodo,https://zenodo.org/record/1105939
12/02/2018,"Annual Reports of Education, Health and Sport 9781329900516","Podgorna, V. V. et al.",2013-10-31,book,,,Zenodo,https://zenodo.org/record/46027
12/02/2018,Correlated Neural Activity in Cortex and Thalamus Following Brain Injury,Young-Seok Choi,2015-09-04,article,,,Zenodo,https://zenodo.org/record/1109299
12/02/2018,Differential Analysis: Crew Resource Management and Profiles on the Balanced Inventory of Desirable Responding,Charalambos C. Cleanthous,2017-03-05,article,,,Zenodo,https://zenodo.org/record/1129930
12/02/2018,Gender Differences with Different Emotions for Brain Functional Connectivity analysis,Sushil Chandra,2016-05-03,article,,,Zenodo,https://zenodo.org/record/59511
12/02/2018,Digital Narrative as a Change Agent to Teach Reading to Media-Centric Students,Robert F. Kenny,2007-11-27,article,,,Zenodo,https://zenodo.org/record/1062132
12/02/2018,Legal Theories Underpinning Access to Justice for Victims of Sexual Violence in Refugee Camps in Africa,O. E. Eberechi,2016-06-02,article,,,Zenodo,https://zenodo.org/record/1125671
12/02/2018,Neurobiological Findings in Youth with Borderline Personality Disorder,"Brunner, Romuald",2014-11-30,article,,,Zenodo,https://zenodo.org/record/1119311
