searched,title,authors,published,database,source
12/02/2018,How much does emotional valence of action outcomes affect temporal binding?,Moreton J,2017,PubMed,https://www.ncbi.nlm.nih.gov/pubmed/28107726
12/02/2018,Do Neurocognitive SCAT3 Baseline Test Scores Differ Between Footballers (Soccer) Living With and Without Disability? A Cross-Sectional Study.,Weiler R,2018,PubMed,https://www.ncbi.nlm.nih.gov/pubmed/28107219
12/02/2018,Machiavellian emotion regulation in a cognitive reappraisal task: An fMRI study.,Deak A,2017,PubMed,https://www.ncbi.nlm.nih.gov/pubmed/28105532
12/02/2018,Dynamic Interaction between Reinforcement Learning and Attention in Multidimensional Environments.,Leong YC,2017,PubMed,https://www.ncbi.nlm.nih.gov/pubmed/28103483
12/02/2018,Modulation of Fast Narrowband Oscillations in the Mouse Retina and dLGN According to Background Light Intensity.,Storchi R,2017,PubMed,https://www.ncbi.nlm.nih.gov/pubmed/28103478
12/02/2018,A multimodal approach to estimating vigilance using EEG and forehead EOG.,Zheng WL,2017,PubMed,https://www.ncbi.nlm.nih.gov/pubmed/28102833
12/02/2018,Does the Superior Colliculus Control Perceptual Sensitivity or Choice Bias during Attention? Evidence from a Multialternative Decision Framework.,Sridharan D,2017,PubMed,https://www.ncbi.nlm.nih.gov/pubmed/28100734
12/02/2018,The effects of breakfast on short-term cognitive function among Chinese white-collar workers: protocol for a three-phase crossover study.,Tang Z,2017,PubMed,https://www.ncbi.nlm.nih.gov/pubmed/28100212
12/02/2018,Quality of Memories in Women Abused by Their Intimate Partner: Analysis of Traumatic and Nontraumatic Narratives.,Fernández-Lansac V,2017,PubMed,https://www.ncbi.nlm.nih.gov/pubmed/28099757
12/02/2018,"The Functional Significance of Affect Recognition, Neurocognition, and Clinical Symptoms in Schizophrenia.",Huang CL,2017,PubMed,https://www.ncbi.nlm.nih.gov/pubmed/28099444
12/02/2018,Paradoxical Emergence: Administration of Subanesthetic Ketamine during Isoflurane Anesthesia Induces Burst Suppression but Accelerates Recovery.,Hambrecht-Wiedbusch VS,2017,PubMed,https://www.ncbi.nlm.nih.gov/pubmed/28099246
12/02/2018,Treatment of Functional Impairment in Patients with Bipolar Disorder.,Sanchez-Moreno J,2017,PubMed,https://www.ncbi.nlm.nih.gov/pubmed/28097635
12/02/2018,Identifying stimuli that cue multiple responses triggers the congruency sequence effect independent of response conflict.,Weissman DH,2017,PubMed,https://www.ncbi.nlm.nih.gov/pubmed/28095005
12/02/2018,Monitoring Dopamine Responses to Potassium Ion and Nomifensine by in Vivo Microdialysis with Online Liquid Chromatography at One-Minute Resolution.,Ngo KT,2017,PubMed,https://www.ncbi.nlm.nih.gov/pubmed/28094974
12/02/2018,Paired Stimulation for Spike-Timing-Dependent Plasticity in Primate Sensorimotor Cortex.,Seeman SC,2017,PubMed,https://www.ncbi.nlm.nih.gov/pubmed/28093479
12/02/2018,Tracking Dynamic Interactions Between Structural and Functional Connectivity: A TMS/EEG-dMRI Study.,Amico E,2017,PubMed,https://www.ncbi.nlm.nih.gov/pubmed/28092972
12/02/2018,A Passive EEG-BCI for Single-Trial Detection of Changes in Mental State.,Myrden A,2017,PubMed,https://www.ncbi.nlm.nih.gov/pubmed/28092565
12/02/2018,Does Emotional Arousal Influence Swearing Fluency?,Stephens R,2017,PubMed,https://www.ncbi.nlm.nih.gov/pubmed/28091853
12/02/2018,Herbal Extracts That Reduce Ocular Oxidative Stress May Enhance Attentive Performance in Humans.,Cho H,2016,PubMed,https://www.ncbi.nlm.nih.gov/pubmed/28090203
12/02/2018,Gender's role in misperceptions of peers' sexual motives.,Wesche R,2016,PubMed,https://www.ncbi.nlm.nih.gov/pubmed/28090170
12/02/2018,The impact of intelligence on memory and executive functions of children with temporal lobe epilepsy: Methodological concerns with clinical relevance.,Rzezak P,2017,PubMed,https://www.ncbi.nlm.nih.gov/pubmed/28089585
12/02/2018,Maintenance effects of working memory intervention (Cogmed) in children with symptomatic epilepsy.,Fuentes A,2017,PubMed,https://www.ncbi.nlm.nih.gov/pubmed/28088681
12/02/2018,Towards solving the hard problem of consciousness: The varieties of brain resonances and the conscious experiences that they support.,Grossberg S,2017,PubMed,https://www.ncbi.nlm.nih.gov/pubmed/28088645
12/02/2018,Online recruitment and testing of infants with Mechanical Turk.,Tran M,2017,PubMed,https://www.ncbi.nlm.nih.gov/pubmed/28088051
12/02/2018,Attention deficits in children with epilepsy: Preliminary findings.,Gascoigne MB,2017,PubMed,https://www.ncbi.nlm.nih.gov/pubmed/28086190
12/02/2018,Coordinated Control of Acoustical Field of View and Flight in Three-Dimensional Space for Consecutive Capture by Echolocating Bats during Natural Foraging.,Sumiya M,2017,PubMed,https://www.ncbi.nlm.nih.gov/pubmed/28085936
12/02/2018,Task-Difficulty Homeostasis in Car Following Models: Experimental Validation Using Self-Paced Visual Occlusion.,Pekkanen J,2017,PubMed,https://www.ncbi.nlm.nih.gov/pubmed/28085901
12/02/2018,Pupillary correlates of covert shifts of attention during working memory maintenance.,Unsworth N,2017,PubMed,https://www.ncbi.nlm.nih.gov/pubmed/28083772
12/02/2018,Reboxetine Improves Auditory Attention and Increases Norepinephrine Levels in the Auditory Cortex of Chronically Stressed Rats.,Pérez-Valenzuela C,2016,PubMed,https://www.ncbi.nlm.nih.gov/pubmed/28082872
12/02/2018,Respiratory modulation of startle eye blink: a new approach to assess afferent signals from the respiratory system.,Schulz A,2016,PubMed,https://www.ncbi.nlm.nih.gov/pubmed/28080976
12/02/2018,Neural correlates of heart-focused interoception: a functional magnetic resonance imaging meta-analysis.,Schulz SM,2016,PubMed,https://www.ncbi.nlm.nih.gov/pubmed/28080975
12/02/2018,Differentiating attention styles and regulatory aspects of self-reported interoceptive sensibility.,Mehling W,2016,PubMed,https://www.ncbi.nlm.nih.gov/pubmed/28080970
12/02/2018,Are you early or late?: Temporal error monitoring.,Akdoğan B,2017,PubMed,https://www.ncbi.nlm.nih.gov/pubmed/28080127
12/02/2018,Perceptual salience does not influence emotional arousal's impairing effects on top-down attention.,Sutherland MR,2017,PubMed,https://www.ncbi.nlm.nih.gov/pubmed/28080087
12/02/2018,Attentional capture by taboo words: A functional view of auditory distraction.,Röer JP,2017,PubMed,https://www.ncbi.nlm.nih.gov/pubmed/28080086
12/02/2018,Processing of Intraoral Olfactory and Gustatory Signals in the Gustatory Cortex of Awake Rats.,Samuelsen CL,2017,PubMed,https://www.ncbi.nlm.nih.gov/pubmed/28077705
12/02/2018,Preparatory α-band oscillations reflect spatial gating independently of predictions regarding target identity.,Wildegger T,2017,PubMed,https://www.ncbi.nlm.nih.gov/pubmed/28077669
12/02/2018,"In monkeys making value-based decisions, amygdala neurons are sensitive to cue value as distinct from cue salience.",Leathers ML,2017,PubMed,https://www.ncbi.nlm.nih.gov/pubmed/28077664
12/02/2018,"Influence of focus of attention, reinvestment and fall history on elderly gait stability.",de Melker Worms JL,2017,PubMed,https://www.ncbi.nlm.nih.gov/pubmed/28077603
12/02/2018,Cortical thickness increases after simultaneous interpretation training.,Hervais-Adelman A,2017,PubMed,https://www.ncbi.nlm.nih.gov/pubmed/28077311
12/02/2018,Oscillatory EEG activity induced by conditioning stimuli during fear conditioning reflects Salience and Valence of these stimuli more than Expectancy.,Chien JH,2017,PubMed,https://www.ncbi.nlm.nih.gov/pubmed/28077278
12/02/2018,Disgust-Related Olfactory Processing: The Role of Gender and Trait Disgust.,Schienle A,2017,PubMed,https://www.ncbi.nlm.nih.gov/pubmed/28077013
12/02/2018,Temporal Dependency and the Structure of Early Looking.,Messinger DS,2017,PubMed,https://www.ncbi.nlm.nih.gov/pubmed/28076362
12/02/2018,Examining Cognitive Processes and Drinking Urge in PTSD.,Read JP,2017,PubMed,https://www.ncbi.nlm.nih.gov/pubmed/28073047
12/02/2018,Theory of Visual Attention (TVA) applied to mice in the 5-choice serial reaction time task.,Fitzpatrick CM,2017,PubMed,https://www.ncbi.nlm.nih.gov/pubmed/28070619
12/02/2018,Association between smoking-related attentional bias and craving measured in the clinic and in the natural environment.,Begh R,2016,PubMed,https://www.ncbi.nlm.nih.gov/pubmed/28068112
12/02/2018,Continuous Cognitive Task Promotes Greater Postural Stability than an Internal or External Focus of Attention in Older Adults.,Richer N,2017,PubMed,https://www.ncbi.nlm.nih.gov/pubmed/28067608
12/02/2018,"Visual Working Memory Resources Are Best Characterized as Dynamic, Quantifiable Mnemonic Traces.",Veksler BZ,2017,PubMed,https://www.ncbi.nlm.nih.gov/pubmed/28067469
12/02/2018,"Extreme sensory processing patterns show a complex association with depression, and impulsivity, alexithymia, and hopelessness.",Serafini G,2017,PubMed,https://www.ncbi.nlm.nih.gov/pubmed/28064114
12/02/2018,Cortisol awakening response is blunted and pain perception is increased during menses in cyclic women.,Ozgocer T,2017,PubMed,https://www.ncbi.nlm.nih.gov/pubmed/28064085
12/02/2018,"The influence of offspring, parity, and oxytocin on cognitive flexibility during the postpartum period.",Albin-Brooks C,2017,PubMed,https://www.ncbi.nlm.nih.gov/pubmed/28062230
12/02/2018,Visual orienting and attention deficits in 5- and 10-month-old preterm infants.,Ross-Sheehy S,2017,PubMed,https://www.ncbi.nlm.nih.gov/pubmed/28061376
12/02/2018,The Older Adult Positivity Effect in Evaluations of Trustworthiness: Emotion Regulation or Cognitive Capacity?,Zebrowitz LA,2017,PubMed,https://www.ncbi.nlm.nih.gov/pubmed/28060919
12/02/2018,The Rodent Psychomotor Vigilance Test (rPVT): A Method for Assessing Neurobehavioral Performance in Rats and Mice.,Davis CM,2016,PubMed,https://www.ncbi.nlm.nih.gov/pubmed/28060276
12/02/2018,"Intraoperative ""Micro Breaks"" With Targeted Stretching Enhance Surgeon Physical Function and Mental Focus: A Multicenter Cohort Study.",Park AE,2017,PubMed,https://www.ncbi.nlm.nih.gov/pubmed/28059962
12/02/2018,Visual Event-Related Potentials to Novel Objects Predict Rapid Word Learning Ability in 20-Month-Olds.,Borgström K,2016,PubMed,https://www.ncbi.nlm.nih.gov/pubmed/28059564
12/02/2018,Synchrony Detection of Linguistic Stimuli in the Presence of Faces: Neuropsychological Implications for Language Development in ASD.,Patten E,2016,PubMed,https://www.ncbi.nlm.nih.gov/pubmed/28059555
12/02/2018,"When Sufficiently Processed, Semantically Related Distractor Pictures Hamper Picture Naming.",Matushanskaya A,2016,PubMed,https://www.ncbi.nlm.nih.gov/pubmed/28059032
12/02/2018,Volitional and Real-Time Control Cursor Based on Eye Movement Decoding Using a Linear Decoding Model.,Zhang J,2016,PubMed,https://www.ncbi.nlm.nih.gov/pubmed/28058044
12/02/2018,The effect of beat frequency on eye movements during free viewing.,Maróti E,2017,PubMed,https://www.ncbi.nlm.nih.gov/pubmed/28057578
12/02/2018,Stimulating cognition in schizophrenia: A controlled pilot study of the effects of prefrontal transcranial direct current stimulation upon memory and learning.,Orlov ND,2017,PubMed,https://www.ncbi.nlm.nih.gov/pubmed/28057452
12/02/2018,Correlations between physical activity and neurocognitive domain functions in patients with schizophrenia: a cross-sectional study.,Kurebayashi Y,2017,PubMed,https://www.ncbi.nlm.nih.gov/pubmed/28056892
12/02/2018,Entrainment to an auditory signal: Is attention involved?,Kunert R,2017,PubMed,https://www.ncbi.nlm.nih.gov/pubmed/28054814
12/02/2018,"Who ""believes"" in the Gambler's Fallacy and why?",Farmer GD,2017,PubMed,https://www.ncbi.nlm.nih.gov/pubmed/28054813
12/02/2018,"Overdistribution illusions: Categorical judgments produce them, confidence ratings reduce them.",Brainerd CJ,2017,PubMed,https://www.ncbi.nlm.nih.gov/pubmed/28054811
12/02/2018,Effects of Physical-Cognitive Dual Task Training on Executive Function and Gait Performance in Older Adults: A Randomized Controlled Trial.,Falbo S,2016,PubMed,https://www.ncbi.nlm.nih.gov/pubmed/28053985
12/02/2018,Melanin-concentrating hormone in peripheral circulation in the human.,Naufahu J,2017,PubMed,https://www.ncbi.nlm.nih.gov/pubmed/28053003
12/02/2018,Frontoparietal activation during visual conjunction search: Effects of bottom-up guidance and adult age.,Madden DJ,2017,PubMed,https://www.ncbi.nlm.nih.gov/pubmed/28052456
12/02/2018,Neural Mechanisms of Selective Visual Attention.,Moore T,2017,PubMed,https://www.ncbi.nlm.nih.gov/pubmed/28051934
12/02/2018,The Five-Choice Continuous Performance Task (5C-CPT): A Cross-Species Relevant Paradigm for Assessment of Vigilance and Response Inhibition in Rodents.,Cope ZA,2017,PubMed,https://www.ncbi.nlm.nih.gov/pubmed/28046200
12/02/2018,On the dependence of response inhibition processes on sensory modality.,Bodmer B,2017,PubMed,https://www.ncbi.nlm.nih.gov/pubmed/28045223
12/02/2018,Is predictability salient? A study of attentional capture by auditory patterns.,Southwell R,2017,PubMed,https://www.ncbi.nlm.nih.gov/pubmed/28044016
12/02/2018,Changes in room acoustics elicit a Mismatch Negativity in the absence of overall interaural intensity differences.,Frey JD,2017,PubMed,https://www.ncbi.nlm.nih.gov/pubmed/28043833
12/02/2018,"Oxidative stress biomarkers, cholinesterase activity and biotransformation enzymes in the liver of dice snake (Natrix tessellata Laurenti) during pre-hibernation and post-hibernation: A possible correlation with heavy metals in the environment.",Gavrić J,2017,PubMed,https://www.ncbi.nlm.nih.gov/pubmed/28043034
12/02/2018,"Developmental Relations Among Behavioral Inhibition, Anxiety, and Attention Biases to Threat and Positive Information.",White LK,2017,PubMed,https://www.ncbi.nlm.nih.gov/pubmed/28042902
12/02/2018,"Predicting drowsy driving in real-time situations: Using an advanced driving simulator, accelerated failure time model, and virtual location-based services.",Wang J,2017,PubMed,https://www.ncbi.nlm.nih.gov/pubmed/28038346
12/02/2018,Identification of Suvorexant in Urine Using Liquid Chromatography-Quadrupole/Time-of-Flight Mass Spectrometry (LC-Q/TOF-MS).,Sullinger S,2017,PubMed,https://www.ncbi.nlm.nih.gov/pubmed/28035034
12/02/2018,Covert spatial attention is functionally intact in amblyopic human adults.,Roberts M,2016,PubMed,https://www.ncbi.nlm.nih.gov/pubmed/28033433
12/02/2018,Hippocampal gamma-band Synchrony and pupillary responses index memory during visual search.,Montefusco-Siegmund R,2017,PubMed,https://www.ncbi.nlm.nih.gov/pubmed/28032676
12/02/2018,Attention training for infants at familial risk of ADHD (INTERSTAARS): study protocol for a randomised controlled trial.,Goodwin A,2016,PubMed,https://www.ncbi.nlm.nih.gov/pubmed/28031039
12/02/2018,Spatial attention is necessary for object-based attention: Evidence from temporal-order judgments.,Donovan I,2017,PubMed,https://www.ncbi.nlm.nih.gov/pubmed/28028777
12/02/2018,Idiosyncratic Patterns of Representational Similarity in Prefrontal Cortex Predict Attentional Performance.,Lee J,2017,PubMed,https://www.ncbi.nlm.nih.gov/pubmed/28028199
12/02/2018,Limited Cognitive Resources Explain a Trade-Off between Perceptual and Metacognitive Vigilance.,Maniscalco B,2017,PubMed,https://www.ncbi.nlm.nih.gov/pubmed/28028197
12/02/2018,Examining the short term effects of emotion under an Adaptation Level Theory model of tinnitus perception.,Durai M,2017,PubMed,https://www.ncbi.nlm.nih.gov/pubmed/28027920
12/02/2018,"Unresolved loss, a risk factor for offspring, predicts event-related potential responses to death-related imagery.",Bahm NI,2017,PubMed,https://www.ncbi.nlm.nih.gov/pubmed/28026196
12/02/2018,"Phenomenology, Structure, and Dynamic of Psychedelic States.",Preller KH,2016,PubMed,https://www.ncbi.nlm.nih.gov/pubmed/28025814
12/02/2018,Holding visual attention for 400millionyears: A model of tectum and torus longitudinalis in teleost fishes.,Northmore DP,2017,PubMed,https://www.ncbi.nlm.nih.gov/pubmed/28025052
12/02/2018,Switching between internally and externally focused attention in obsessive-compulsive disorder: Abnormal visual cortex activation and connectivity.,Stern ER,2017,PubMed,https://www.ncbi.nlm.nih.gov/pubmed/28024845
12/02/2018,"Detection, Prevention, and Management of Delirium in the Critically Ill Cardiac Patient and Patients Who Undergo Cardiac Procedures.",Arora RC,2017,PubMed,https://www.ncbi.nlm.nih.gov/pubmed/28024558
12/02/2018,Spatial Distribution of Attentional Modulation at Columnar Resolution in Macaque Area V4.,Tanigawa H,2016,PubMed,https://www.ncbi.nlm.nih.gov/pubmed/28018181
12/02/2018,Attention bias towards negative emotional information and its relationship with daily worry in the context of acute stress: An eye-tracking study.,Macatee RJ,2017,PubMed,https://www.ncbi.nlm.nih.gov/pubmed/28013055
12/02/2018,Anxious anticipation and pain: the influence of instructed vs conditioned threat on pain.,Reicherts P,2017,PubMed,https://www.ncbi.nlm.nih.gov/pubmed/28008077
12/02/2018,Medial orbitofrontal cortex modulates associative learning between environmental cues and reward probability.,Hall-McMaster S,2017,PubMed,https://www.ncbi.nlm.nih.gov/pubmed/28004955
12/02/2018,Differences in attentional functioning between preterm and full-term children underline the importance of new neuropsychological detection techniques.,Giordano V,2017,PubMed,https://www.ncbi.nlm.nih.gov/pubmed/28004417
12/02/2018,Perceptual similarity in visual search for multiple targets.,Gorbunova ES,2017,PubMed,https://www.ncbi.nlm.nih.gov/pubmed/28002721
12/02/2018,Activation in Bipolar Disorders: A Systematic Review.,Scott J,2017,PubMed,https://www.ncbi.nlm.nih.gov/pubmed/28002572
12/02/2018,"Hey Mister Tambourine Man, Play a Drug for Me: Music as Medication.",Howland RH,2016,PubMed,https://www.ncbi.nlm.nih.gov/pubmed/28001283
12/02/2018,Assessing the internal consistency of the event-related potential: An example analysis.,Thigpen NN,2017,PubMed,https://www.ncbi.nlm.nih.gov/pubmed/28000264
12/02/2018,Sexual Problems Predict PTSD and Depression Symptom Change Among Male OEF/OIF Veterans Completing Exposure Therapy.,Badour CL,2016,PubMed,https://www.ncbi.nlm.nih.gov/pubmed/27997327
12/02/2018,Disparity in neural and subjective responses to food images in women with obesity and normal-weight women.,Carbine KA,2017,PubMed,https://www.ncbi.nlm.nih.gov/pubmed/27996208
12/02/2018,Detection of auditory signals in quiet and noisy backgrounds while performing a visuo-spatial task.,Rawool VW,2016,PubMed,https://www.ncbi.nlm.nih.gov/pubmed/27991458
12/02/2018,Timing in Predictive Coding: The Roles of Task Relevance and Global Probability.,Sherwell C,2017,PubMed,https://www.ncbi.nlm.nih.gov/pubmed/27991186
12/02/2018,Salience Network Connectivity Modulates Skin Conductance Responses in Predicting Arousal Experience.,Xia C,2017,PubMed,https://www.ncbi.nlm.nih.gov/pubmed/27991182
12/02/2018,The Pivotal Role of the Right Parietal Lobe in Temporal Attention.,Agosta S,2017,PubMed,https://www.ncbi.nlm.nih.gov/pubmed/27991181
12/02/2018,Sensory-specific satiety: Added insights from autonomic nervous system responses and facial expressions.,He W,2017,PubMed,https://www.ncbi.nlm.nih.gov/pubmed/27988247
12/02/2018,Gaze Following in Children with Autism: Do High Interest Objects Boost Performance?,Thorup E,2017,PubMed,https://www.ncbi.nlm.nih.gov/pubmed/27987062
12/02/2018,Co-occurring aggression and suicide attempt among veterans entering residential treatment for PTSD: The role of PTSD symptom clusters and alcohol misuse.,Watkins LE,2017,PubMed,https://www.ncbi.nlm.nih.gov/pubmed/27984702
12/02/2018,Increased experience amplifies the activation of task-irrelevant category representations.,Wu R,2017,PubMed,https://www.ncbi.nlm.nih.gov/pubmed/27981522
12/02/2018,Pupil Sizes Scale with Attentional Load and Task Experience in a Multiple Object Tracking Task.,Wahn B,2016,PubMed,https://www.ncbi.nlm.nih.gov/pubmed/27977762
12/02/2018,An Extended Normalization Model of Attention Accounts for Feature-Based Attentional Enhancement of Both Response and Coherence Gain.,Schwedhelm P,2016,PubMed,https://www.ncbi.nlm.nih.gov/pubmed/27977679
12/02/2018,Relationship between obstructive sleep apnoea syndrome and sleep bruxism: a systematic review.,Jokubauskas L,2017,PubMed,https://www.ncbi.nlm.nih.gov/pubmed/27977045
12/02/2018,Neural mechanisms of attention become more specialised during infancy: Insights from combined eye tracking and EEG.,Kulke L,2017,PubMed,https://www.ncbi.nlm.nih.gov/pubmed/27976814
12/02/2018,50 Years of Cognitive Aging Theory.,Anderson ND,2017,PubMed,https://www.ncbi.nlm.nih.gov/pubmed/27974471
12/02/2018,"Pupil-size asymmetry is a physiologic trait related to gender, attentional function, and personality.",Poynter WD,2017,PubMed,https://www.ncbi.nlm.nih.gov/pubmed/27973982
12/02/2018,"Clarifying the role of target similarity, task relevance and feature-based suppression during sustained inattentional blindness.",Drew T,2016,PubMed,https://www.ncbi.nlm.nih.gov/pubmed/27973645
12/02/2018,Delirium: a guide for the general physician.,Todd OM,2016,PubMed,https://www.ncbi.nlm.nih.gov/pubmed/27956448
12/02/2018,Prefronto-cerebellar tDCS enhances neurocognition in euthymic bipolar patients. Findings from a placebo-controlled neuropsychological and psychophysiological investigation.,Bersani FS,2017,PubMed,https://www.ncbi.nlm.nih.gov/pubmed/27951511
12/02/2018,A cortical-hippocampal-cortical loop of information processing during memory consolidation.,Rothschild G,2017,PubMed,https://www.ncbi.nlm.nih.gov/pubmed/27941790
12/02/2018,The role of nociceptive input and tissue injury on stress regulation in borderline personality disorder.,Willis F,2017,PubMed,https://www.ncbi.nlm.nih.gov/pubmed/27941497
12/02/2018,Behavioural measures of child's eating temperament and their link with BMI.,Godefroy V,2017,PubMed,https://www.ncbi.nlm.nih.gov/pubmed/27940311
12/02/2018,Neural correlates of the affective properties of spontaneous and volitional laughter types.,Lavan N,2017,PubMed,https://www.ncbi.nlm.nih.gov/pubmed/27940151
12/02/2018,Method for testing sustained attention in touchscreen operant chambers in rats.,Wicks B,2017,PubMed,https://www.ncbi.nlm.nih.gov/pubmed/27939962
12/02/2018,Acoustic Measures of Voice and Physiologic Measures of Autonomic Arousal during Speech as a Function of Cognitive Load.,MacPherson MK,2017,PubMed,https://www.ncbi.nlm.nih.gov/pubmed/27939119
12/02/2018,"Sexual Sensation Seeking, Sexual Compulsivity, and Gender Identity and Its Relationship With Sexual Functioning in a Population Sample of Men and Women.",Burri A,2017,PubMed,https://www.ncbi.nlm.nih.gov/pubmed/27938992
12/02/2018,Normative values of polysomnographic parameters in Chinese children and adolescents: a cross-sectional study.,Wang G,2016,PubMed,https://www.ncbi.nlm.nih.gov/pubmed/27938919
12/02/2018,Honing Theory: A Complex Systems Framework for Creativity.,Gabora L,2017,PubMed,https://www.ncbi.nlm.nih.gov/pubmed/27938525
12/02/2018,Evaluating probe techniques and a situated theory of situation awareness.,Chiappe D,2016,PubMed,https://www.ncbi.nlm.nih.gov/pubmed/27936855
12/02/2018,Conflicting effects of context in change detection and visual search: A dual process account.,LaPointe MR,2017,PubMed,https://www.ncbi.nlm.nih.gov/pubmed/27936836
12/02/2018,Cognitive Costs of Reappraisal Depend on Both Emotional Stimulus Intensity and Individual Differences in Habitual Reappraisal.,Ortner CN,2016,PubMed,https://www.ncbi.nlm.nih.gov/pubmed/27936022
12/02/2018,Exposure to justice diminishes moral perception.,Gantman AP,2016,PubMed,https://www.ncbi.nlm.nih.gov/pubmed/27935734
12/02/2018,Prediction of subjective ratings of emotional pictures by EEG features.,McFarland DJ,2017,PubMed,https://www.ncbi.nlm.nih.gov/pubmed/27934776
12/02/2018,Single neuron activity and theta modulation in the posterior parietal cortex in a visuospatial attention task.,Yang FC,2017,PubMed,https://www.ncbi.nlm.nih.gov/pubmed/27933672
12/02/2018,Using Robust Normative Data to Investigate the Neuropsychology of Cognitive Aging.,Harrington KD,2017,PubMed,https://www.ncbi.nlm.nih.gov/pubmed/27932344
12/02/2018,Validation of the Bangla Mindful Attention Awareness Scale.,Islam MA,2016,PubMed,https://www.ncbi.nlm.nih.gov/pubmed/27931889
12/02/2018,Why Does Sleep Slow-Wave Activity Increase After Extended Wake? Assessing the Effects of Increased Cortical Firing During Wake and Sleep.,Rodriguez AV,2016,PubMed,https://www.ncbi.nlm.nih.gov/pubmed/27927960
12/02/2018,Infants' Looking to Surprising Events: When Eye-Tracking Reveals More than Looking Time.,Yeung HH,2016,PubMed,https://www.ncbi.nlm.nih.gov/pubmed/27926920
12/02/2018,Bindings in working memory: The role of object-based attention.,Gao Z,2017,PubMed,https://www.ncbi.nlm.nih.gov/pubmed/27924444
12/02/2018,Spanish norms for completion of restricted length word stems.,Soler MJ,2017,PubMed,https://www.ncbi.nlm.nih.gov/pubmed/27924442
12/02/2018,The effect of cerebral asymmetries and eye scanning on pseudoneglect for a visual search task.,Nicholls ME,2017,PubMed,https://www.ncbi.nlm.nih.gov/pubmed/27923149
12/02/2018,The Effects of a Genital Vibratory Stimulation Device on Sexual Function and Genital Sensation.,Guess MK,2017,PubMed,https://www.ncbi.nlm.nih.gov/pubmed/27918337
12/02/2018,Neurophysiological Characterization of Attentional Performance Dysfunction in Schizophrenia Patients in a Reverse-Translated Task.,Young JW,2017,PubMed,https://www.ncbi.nlm.nih.gov/pubmed/27917869
12/02/2018,Threat-Detection and Attentional Bias to Threat in Women Recovered from Anorexia Nervosa: Neural Alterations in Extrastriate and Medial Prefrontal Cortices.,Bang L,2017,PubMed,https://www.ncbi.nlm.nih.gov/pubmed/27917578
