searched,title,authors,published,database,source
29/01/2018,Smart information systems,Not available,2017,IEEE - Crossref,http://xplorestaging.ieee.org/ielx7/8167962/8188595/08188683.pdf?arnumber=8188683
29/01/2018,Smart power systems and electrical drives,Not available,2017,IEEE - Crossref,http://xplorestaging.ieee.org/ielx7/8167962/8188595/08188715.pdf?arnumber=8188715
29/01/2018,Modelling and analysis of smart systems,Not available,2017,IEEE - Crossref,http://xplorestaging.ieee.org/ielx7/8167962/8188595/08188661.pdf?arnumber=8188661
29/01/2018,Smart energy II,Not available,2017,IEEE - Crossref,http://xplorestaging.ieee.org/ielx7/8167962/8188595/08188673.pdf?arnumber=8188673
29/01/2018,Smart educational systems,Not available,2017,IEEE - Crossref,http://xplorestaging.ieee.org/ielx7/8167962/8188595/08188709.pdf?arnumber=8188709
29/01/2018,Smart Grid - a reliability perspective,"Kumar,Ranjit, Moslehi,Khosrow, ",2010,IEEE - Crossref,http://xplorestaging.ieee.org/ielx5/5428221/5434721/05434765.pdf?arnumber=5434765
29/01/2018,Applications of adaptive CKF algorithm in short-term load forecasting of smart grid,"Zhang,Weidong, He,Xing, Li,Yao, ",2014,IEEE - Crossref,http://xplorestaging.ieee.org/ielx7/6882077/6895198/06896364.pdf?arnumber=6896364
29/01/2018,A distributed gaussian-means clustering algorithm for forecasting domestic energy usage,"Wlodarczyk,Tomasz Wiktor, Evensen,Pal, Rong,Chunming, Chakravorty,Antorweep, ",2015,IEEE - Crossref,http://xplorestaging.ieee.org/ielx7/7031549/7043829/07043863.pdf?arnumber=7043863
29/01/2018,Comparison of day-ahead price forecasting in energy market using Neural Network and Genetic Algorithm,"Bapiraju,V., Sarada,K., ",2017,IEEE - Crossref,http://xplorestaging.ieee.org/ielx7/6996692/7005386/07005607.pdf?arnumber=7005607
29/01/2018,Short-term load forecasting algorithm and optimization in smart grid operations and planning,"Tungpimolrut,Kanokvate, Lewlomphaisarl,Udom, Skolthanarat,Siriya, ",2015,IEEE - Crossref,http://xplorestaging.ieee.org/ielx7/7038626/7046205/07046238.pdf?arnumber=7046238
29/01/2018,A Novel Pavement Performance Prediction Framework in Smart City Based on Tensor Decomposition,"Zhao,Junfeng, Wang,YiBo, Yang,Kai, Bao,Lixia, ",2017,IEEE - Crossref,http://xplorestaging.ieee.org/ielx7/7814735/7816796/07816967.pdf?arnumber=7816967
29/01/2018,Behaviour Analysis in Smart Spaces,"Novais,Paulo, Matos,Paulo, Oliveira,Pedro, ",2017,IEEE - Crossref,http://xplorestaging.ieee.org/ielx7/7814735/7816796/07816935.pdf?arnumber=7816935
29/01/2018,"Information Privacy Management in Smart Home Environments: Modeling, Verification, and Implementation","Babbitt,Ryan, ",2006,IEEE - Crossref,http://xplorestaging.ieee.org/ielx5/4020030/4020118/04020191.pdf?arnumber=4020191
29/01/2018,TagFree: Identifying users without tags in smart home environments,Not available,2008,IEEE - Crossref,http://xplorestaging.ieee.org/ielx5/4413560/4413561/04413826.pdf?arnumber=4413826
29/01/2018,Localization based object recognition for smart home environments,"Kuhnel,Christine, Nischt,Michael, Swaminathan,Rahul, ",2008,IEEE - Crossref,http://xplorestaging.ieee.org/ielx5/4599583/4607348/04607586.pdf?arnumber=4607586
29/01/2018,Behavioural Pattern Identification in a Smart Home Using Binary Similarity and Dissimilarity Measures,"Langensiepen,Caroline, Lotfi,Ahmad, Mahmoud,Sawsan M., ",2011,IEEE - Crossref,http://xplorestaging.ieee.org/ielx5/6062619/6063345/06063365.pdf?arnumber=6063365
29/01/2018,Projection-Based User Interface for Smart Home Environments,"Lin,Yi-Bin, Lin,Chin-Yang, ",2013,IEEE - Crossref,http://xplorestaging.ieee.org/ielx7/6605718/6605724/06605848.pdf?arnumber=6605848
29/01/2018,Energy Efficient Sensor Network with Service Discovery for Smart Home Environments,"Vanhala,Jukka, Raula,Henrik, Pensas,Harri, ",2009,IEEE - Crossref,http://xplorestaging.ieee.org/ielx5/5210827/5210828/05210897.pdf?arnumber=5210897
29/01/2018,Agents based approach for smart eco-home environments,"Ma,Jianhua, Tamura,Toshihiro, Itou,Masahiro, Huang,Runhe, ",2010,IEEE - Crossref,http://xplorestaging.ieee.org/ielx5/5581822/5595732/05596583.pdf?arnumber=5596583
29/01/2018,IoT-Based Fall Detection for Smart Home Environments,"Carpenter,David, Thapliyal,Himanshu, Greene,Shalom, ",2017,IEEE - Crossref,http://xplorestaging.ieee.org/ielx7/7827705/7829498/07829515.pdf?arnumber=7829515
29/01/2018,Streaming audio classification in Smart Home environments,Not available,2014,IEEE - Crossref,http://xplorestaging.ieee.org/ielx5/6158722/6166526/06166676.pdf?arnumber=6166676
29/01/2018,Ubiquitous networks: Power line communication and Internet of things in smart home environments,"Vakilzadian,Hamid, Moller,Dietmar P. F., ",2014,IEEE - Crossref,http://xplorestaging.ieee.org/ielx7/6863137/6871745/06871832.pdf?arnumber=6871832
29/01/2018,Persona-Based Adaptation in a Smart Green Home,"Havinga,Paul, van Leeuwen,Henk, Teeuw,Wouter, Salomons,Etto, ",2012,IEEE - Crossref,http://xplorestaging.ieee.org/ielx5/6257545/6258493/06258551.pdf?arnumber=6258551
29/01/2018,Towards a semantically-enabled holistic vision for energy optimisation in smart home environments,"Piazza,Francesco, Nucci,Michele, Grassi,Marco, ",2011,IEEE - Crossref,http://xplorestaging.ieee.org/ielx5/5781738/5874867/05874943.pdf?arnumber=5874943
29/01/2018,Bridging the Gap between Smart Home and Agents,"Alexandersson,Jan, Frey,Jochen, Britz,Jochen, ",2014,IEEE - Crossref,http://xplorestaging.ieee.org/ielx7/6909333/6910409/06910423.pdf?arnumber=6910423
29/01/2018,Fault detection for binary sensors in smart home environments,"Dobson,Simon, Stevenson,Graeme, Ye,Juan, ",2015,IEEE - Crossref,http://xplorestaging.ieee.org/ielx7/7120793/7146496/07146505.pdf?arnumber=7146505
29/01/2018,Hardware implementation of a Test Lab for Smart Home environments,"Cocorullo,Giuseppe, Lanuzza,Marco, Felicetti,Carmelo, De Rose,Raffaele, Cordopatri,Antonio, ",2016,IEEE - Crossref,http://xplorestaging.ieee.org/ielx7/7400733/7415201/07415221.pdf?arnumber=7415221
29/01/2018,Preliminary Study of Adaptive Decision-Making System for Vocal Command in Smart Home,"Vacher,Michel, Portet,Francois, Brenon,Alexis, ",2016,IEEE - Crossref,http://xplorestaging.ieee.org/ielx7/7717031/7723453/07723502.pdf?arnumber=7723502
29/01/2018,An IoT-based user-centric ecosystem for heterogeneous Smart Home environments,"Patrono,Luigi, Mighali,Vincenzo, Mainetti,Luca, ",2015,IEEE - Crossref,http://xplorestaging.ieee.org/ielx7/7225357/7248285/07248404.pdf?arnumber=7248404
29/01/2018,Optimal water heater control in smart home environments,Not available,2016,IEEE - Crossref,http://xplorestaging.ieee.org/ielx7/7507294/7513868/07513964.pdf?arnumber=7513964
29/01/2018,Behavioral monitoring in smart-home environments for health-care applications,"Civitarese,Gabriele, ",2017,IEEE - Crossref,http://xplorestaging.ieee.org/ielx7/7911894/7917470/07917539.pdf?arnumber=7917539
29/01/2018,A Review on Vision Surveillance Techniques in Smart Home Environments,"Badica,Costin, Brezovan,Marius, ",2013,IEEE - Crossref,http://xplorestaging.ieee.org/ielx7/6568398/6569227/06569307.pdf?arnumber=6569307
29/01/2018,Construction of neural network-based prediction intervals for short-term electrical load forecasting,"Creighton,Doug, Nahavandi,Saeid, Khosravi,Abbas, Srinivasan,Dipti, Quan,Hao, ",2013,IEEE - Crossref,http://xplorestaging.ieee.org/ielx7/6595338/6611489/06611500.pdf?arnumber=6611500
29/01/2018,Identifying activity boundaries for activity recognition in smart environments,"Bandara,Ayomi, Fan,Zhong, Wang,Yi, ",2016,IEEE - Crossref,http://xplorestaging.ieee.org/ielx7/7502491/7510595/07510732.pdf?arnumber=7510732
29/01/2018,Activity-Aware Sensor Cycling for Human Activity Monitoring in Smart Homes,"Park,Taejoon, Won,Myounggyu, Hwang,Seokhyun, Park,Homin, ",2016,IEEE - Crossref,http://xplorestaging.ieee.org/ielx7/4234/7894297/07604087.pdf?arnumber=7604087
29/01/2018,Service-orientation vs. real-time: Integrating smart-homes into the smart-grid,"Kamara Esteban,Oihane, Pena,Aitor, Borges,Cruz E., Penya,Yoseba K., ",2014,IEEE - Crossref,http://xplorestaging.ieee.org/ielx7/6683943/6699103/06700077.pdf?arnumber=6700077
29/01/2018,Energy Management System proposal for efficient smart homes,"Matias,Ignacio R., Fernandez-Valdivielso,Carlos, Falcone,Francisco J., Nazabal,Juan A., ",2014,IEEE - Crossref,http://xplorestaging.ieee.org/ielx7/6698449/6708157/06708174.pdf?arnumber=6708174
29/01/2018,Energy communities in Smart Markets for optimisation of peer-to-peer interconnected Smart Homes,"Ruhrig,P., Trick,U., Steinheimer,M., ",2012,IEEE - Crossref,http://xplorestaging.ieee.org/ielx5/6273232/6292634/06292732.pdf?arnumber=6292732
29/01/2018,Privacy in the Age of Mobility and Smart Devices in Smart Homes,"El-Moussa,Fadi, Brown,Ian, Arabo,Abdullahi, ",2013,IEEE - Crossref,http://xplorestaging.ieee.org/ielx5/6403618/6406254/06406331.pdf?arnumber=6406331
29/01/2018,Time programmable smart devices for peak demand reduction of smart homes in a microgrid,"Ferreira,H. C., Ouahada,K., Rimer,S., Longe,O. M., ",2015,IEEE - Crossref,http://xplorestaging.ieee.org/ielx7/7056705/7068059/07068114.pdf?arnumber=7068114
29/01/2018,Smart homes and smart buildings,"Lima,C., Vieira,S., Silva,D., Lopes,Rui, Delgado-Gomes,V., Oliveira-Lima,J. A., Martins,J. F., ",2012,IEEE - Crossref,http://xplorestaging.ieee.org/ielx5/6362376/6376805/06376808.pdf?arnumber=6376808
29/01/2018,Advanced smart metering infrastructure for future smart homes,"Moreno-Munoz,Antonio, Guerrero,Josep M., Vasquez,Juan C., Savaghebi,Mehdi, Palacios-Garcia,Emilio J., Rodriguez-Diaz,Enrique, ",2016,IEEE - Crossref,http://xplorestaging.ieee.org/ielx7/7369493/7391194/07391260.pdf?arnumber=7391260
29/01/2018,An Application Conflict Detection and Resolution System for Smart Homes,"Honiden,Shinichi, Ishikawa,Fuyuki, Yagita,Miki, ",2015,IEEE - Crossref,http://xplorestaging.ieee.org/ielx7/7173534/7173927/07173941.pdf?arnumber=7173941
29/01/2018,Optimization of energy expenditure in smart homes under time-of-use pricing,"Ferreira,Hendrik C., Rimer,Suvendi, Ouahada,Khmaies, Longe,Omowunmi Mary, ",2016,IEEE - Crossref,http://xplorestaging.ieee.org/ielx7/7364573/7386954/07386988.pdf?arnumber=7386988
29/01/2018,Integration of electric vehicles in smart homes - an ICT-based solution for V2G scenarios,"Schmeck,Hartmut, Allerding,Florian, Multin,Marc, ",2012,IEEE - Crossref,http://xplorestaging.ieee.org/ielx5/6170475/6175527/06175624.pdf?arnumber=6175624
29/01/2018,Smart homes: A domestic demand response and demand side energy management system for future smart grids,"Paul,Babu Sena, Hoosain,Mohamed Sameer, ",2017,IEEE - Crossref,http://xplorestaging.ieee.org/ielx7/7927593/7931753/07931852.pdf?arnumber=7931852
29/01/2018,Smart Grid and Smart Homes: Key Players and Pilot Projects,"Hancke,Gerhard, Cecati,Carlo, Buccella,Concettina, Ergut,Salih, Kocak,Taskin, Sahin,Dilan, Gungor,Vehbi, ",2012,IEEE - Crossref,http://xplorestaging.ieee.org/ielx5/4154573/6378501/06378528.pdf?arnumber=6378528
29/01/2018,An improved WT and NN ensemble demand forecast model for PV integrated smart buildings,"Ekanayake,Chandima, Nadarajah,Mithulananthan, Raza,Muhammad Qamar, ",2016,IEEE - Crossref,http://xplorestaging.ieee.org/ielx7/7786610/7796342/07796484.pdf?arnumber=7796484
29/01/2018,Optimal Generation and Storage Scheduling in the Presence of Renewable Forecast Uncertainties,"Le Boudec,Jean-Yves, Tomozei,Dan-Cristian, Gast,Nicolas, ",2014,IEEE - Crossref,http://xplorestaging.ieee.org/ielx7/5165411/6800037/06797967.pdf?arnumber=6797967
29/01/2018,Forecast System Inertia Condition and Its Impact to Integrate More Renewables,"Matevosyan,Julia, Du,Pengwei, ",2017,IEEE - Crossref,http://xplorestaging.ieee.org/ielx7/5165411/5446437/07840031.pdf?arnumber=7840031
29/01/2018,Energy Management Considering Load Operations and Forecast Errors with Application to HVAC Systems,"Spanos,Costas J., Hu,Guoqiang, Ma,Kai, ",2016,IEEE - Crossref,http://xplorestaging.ieee.org/ielx7/5165411/5446437/07458899.pdf?arnumber=7458899
29/01/2018,Multi-modal Person Identification in a Smart Environment,"Stiefelhagen,Rainer, Jin,Qin, Fischer,Mika, Ekenel,Hazim Kemal, ",2007,IEEE - Crossref,http://xplorestaging.ieee.org/ielx5/4269955/4269956/04270386.pdf?arnumber=4270386
29/01/2018,Human detection using mobile embedded smart cameras,"Gursoy,M. Cenk, Velipasalar,Senem, Wang,Youlu, He,Li, ",2011,IEEE - Crossref,http://xplorestaging.ieee.org/ielx5/6030109/6042896/06042924.pdf?arnumber=6042924
29/01/2018,PhD Forum: Toward a Human-in-the-Loop Smart Ridesharing System with Self-Driving Technologies,"Yeung,San, ",2017,IEEE - Crossref,http://xplorestaging.ieee.org/ielx7/7943263/7946954/07947051.pdf?arnumber=7947051
29/01/2018,Correlation between real and simulated data of the activity of the elderly person living independently in a Health Smart Home,"Noury,N., Hadidi,T., ",2011,IEEE - Crossref,http://xplorestaging.ieee.org/ielx5/6019109/6026719/06026788.pdf?arnumber=6026788
29/01/2018,Model and Simulator of the activity of the elderly person in a Health Smart Home,"Noury,N., Hadidi,T., ",2010,IEEE - Crossref,http://xplorestaging.ieee.org/ielx5/5548928/5556525/05556531.pdf?arnumber=5556531
29/01/2018,A Profit Maximization Approach to Demand Response Management with Customers Behavior Learning in Smart Grid,"Zeng,Xiao-Jun, Meng,Fan-Lin, ",2015,IEEE - Crossref,http://xplorestaging.ieee.org/ielx7/5165411/7456360/7202876.pdf?arnumber=7202876
29/01/2018,Learning pairwise feature dissimilarities for person re-identification,"Piciarelli,Claudio, Micheloni,Christian, Martinel,Niki, ",2014,IEEE - Crossref,http://xplorestaging.ieee.org/ielx7/6766836/6778199/06778209.pdf?arnumber=6778209
29/01/2018,Simulation of Smart Environments,"Retkowitz,Daniel, Armac,Ibrahim, ",2007,IEEE - Crossref,http://xplorestaging.ieee.org/ielx5/4283874/4283875/04283934.pdf?arnumber=4283934
29/01/2018,Simulation of Smart Environments,"Retkowitz,Daniel, Armac,Ibrahim, ",2007,IEEE - Crossref,http://xplorestaging.ieee.org/ielx5/4283874/4283875/04283924.pdf?arnumber=4283924
29/01/2018,IdProF: Identity provisioning framework for smart environments,"Al-Turjman,Fadi, Elgedawy,Islam, ",2016,IEEE - Crossref,http://xplorestaging.ieee.org/ielx7/7742833/7753413/07753419.pdf?arnumber=7753419
29/01/2018,Beyond the Smart Home,"Yamazaki,Tatsuya, ",2006,IEEE - Crossref,http://xplorestaging.ieee.org/ielx5/4021046/4021174/04021238.pdf?arnumber=4021238
29/01/2018,Multimodal interface for smart home,"Rozinaj,Gregor, Drozd,Ivan, Gyurian,Norbert, ",2016,IEEE - Crossref,http://xplorestaging.ieee.org/ielx7/7636713/7731733/07731806.pdf?arnumber=7731806
29/01/2018,Necessity of a bed-sensor in a smart digital home to care for elder-people,"Gupta,G. Sen, Mukhopadhyay,S. C., Gaddam,A., ",2008,IEEE - Crossref,http://xplorestaging.ieee.org/ielx5/4703548/4716361/04716693.pdf?arnumber=4716693
29/01/2018,Social data shoes for gait monitoring of elderly people in smart home,"Kerdcharoen,Teerakiat, Nilpanapan,Thirawut, ",2017,IEEE - Crossref,http://xplorestaging.ieee.org/ielx7/7845249/7859582/07859611.pdf?arnumber=7859611
29/01/2018,Smart Home: Cognitive Interactive People-Centric Internet of Things,"Haykin,Simon, Setoodeh,Peyman, Feng,Shuo, ",2017,IEEE - Crossref,http://xplorestaging.ieee.org/ielx7/35/7841454/07841468.pdf?arnumber=7841468
29/01/2018,An Ontology-Based Hybrid Approach to Activity Modeling for Smart Homes,"Okeyo,George, Nugent,Chris, Chen,Liming, ",2014,IEEE - Crossref,http://xplorestaging.ieee.org/ielx7/6221037/6714463/06689346.pdf?arnumber=6689346
29/01/2018,Senior citizens' interaction with smart ambient environment,"Pulli,Petri, Hickey,Seamus, Metso,Antero, Pouke,Matti, Hyry,Jaakko, Yamamoto,Goshiro, ",2016,IEEE - Crossref,http://xplorestaging.ieee.org/ielx7/7476982/7476983/07477027.pdf?arnumber=7477027
29/01/2018,An Algorithmic Method of Calculating Neighborhood Radius for Clustering In-home Activities within Smart Home Environment,"Nguyen,Son, Le,Tien, Nguyen,Duy, ",2017,IEEE - Crossref,http://xplorestaging.ieee.org/ielx7/7875353/7877167/07877186.pdf?arnumber=7877186
29/01/2018,An Annotation Technique for In-Home Smart Monitoring Environments,"Rahman,Sk Md Mizanur, Alnusair,A., Hossain,M. Shamim, Samarah,S., Rawashdeh,M., Zamil,M GH. AL, ",2017,IEEE - Crossref,http://xplorestaging.ieee.org/ielx7/6287639/6514899/08125664.pdf?arnumber=8125664
29/01/2018,Improving failure prediction accuracy in smart environments,"Lukkien,Johan J., Ozcelebi,Tanir, Warriach,Ehsan Ullah, Guclu,Sila Ozen, ",2016,IEEE - Crossref,http://xplorestaging.ieee.org/ielx7/7424905/7430494/7430627.pdf?arnumber=7430627
29/01/2018,Clustering methods for occupancy prediction in smart home control,"Kastner,Wolfgang, Vazquez,Felix Iglesias, ",2011,IEEE - Crossref,http://xplorestaging.ieee.org/ielx5/5976319/5984066/05984350.pdf?arnumber=5984350
29/01/2018,On hourly home peak load prediction,"Lizotte,Daniel J., Gao,Peter Xiang, Singh,Rayman Preet, ",2013,IEEE - Crossref,http://xplorestaging.ieee.org/ielx7/6479749/6485945/06485977.pdf?arnumber=6485977
29/01/2018,Identifying patterns for human activities of daily living in smart homes,"Nascu,Ioan, Prodan,Radu, ",2014,IEEE - Crossref,http://xplorestaging.ieee.org/ielx7/6850266/6857810/06857882.pdf?arnumber=6857882
29/01/2018,Optimized Support Vector Regression models for short term solar radiation forecasting in smart environment,"Bhakar,Rohit, Sharma,Kailash Chand, Sreekumar,Sreenu, ",2017,IEEE - Crossref,http://xplorestaging.ieee.org/ielx7/7838019/7847944/07848358.pdf?arnumber=7848358
29/01/2018,Electricity market price forecasting in a price-responsive smart grid environment,"Rosehart,W D, Zareipour,H, Motamedi,A, ",2010,IEEE - Crossref,http://xplorestaging.ieee.org/ielx5/5577387/5588047/05589334.pdf?arnumber=5589334
29/01/2018,Impact of demand response contracts on load forecasting in a smart grid environment,Not available,2012,IEEE - Crossref,http://xplorestaging.ieee.org/ielx5/6330648/6343905/06345079.pdf?arnumber=6345079
29/01/2018,Short-term price forecasting under high penetration of wind generation units in smart grid environment,"Aghaebrahimi,Mohammad Reza, Taherian,Hossein, Nazer Kakhki,Iman, ",2014,IEEE - Crossref,http://xplorestaging.ieee.org/ielx7/6678914/6682797/06682809.pdf?arnumber=6682809
29/01/2018,Ambient sensing-based incentives for behavior modification in demand response,Not available,2014,IEEE - Crossref,http://xplorestaging.ieee.org/ielx7/6678912/6687920/06687956.pdf?arnumber=6687956
29/01/2018,Dynamic Constraint Reasoning in Smart Environments,"Lazovik,Alexander, Degeler,Viktoriya, ",2014,IEEE - Crossref,http://xplorestaging.ieee.org/ielx7/6734837/6735210/06735245.pdf?arnumber=6735245
29/01/2018,Project based e-learning: A new education technique for distance learning in smart sensors systems,"Yurish,Sergey, ",2009,IEEE - Crossref,http://xplorestaging.ieee.org/ielx5/5234370/5270809/05270822.pdf?arnumber=5270822
29/01/2018,Ecological Terminal Design of Smart Home,"Fu,Jiuqiang, Yao,Jian, Yang,Xin, Jiang,Bing, ",2017,IEEE - Crossref,http://xplorestaging.ieee.org/ielx7/7823889/7829654/07830308.pdf?arnumber=7830308
29/01/2018,Building intelligence — Home operating system for smart monitoring and control,"Kansala,Klaus, Tanner,Hannu, Rehu,Jari, Maatta,Kalle, ",2017,IEEE - Crossref,http://xplorestaging.ieee.org/ielx7/8039355/8053318/08053363.pdf?arnumber=8053363
29/01/2018,Implementation of pervasive computing based high-secure smart home system,"Raj,S. Ventylees, ",2013,IEEE - Crossref,http://xplorestaging.ieee.org/ielx7/6504613/6510164/06510231.pdf?arnumber=6510231
29/01/2018,A hybrid sensor network in the application design of smart home,Not available,2010,IEEE - Crossref,http://xplorestaging.ieee.org/ielx5/5573998/5585103/05585196.pdf?arnumber=5585196
29/01/2018,A Smart and Contemporary Home Security System using 802.15.4 standard,"Chandra,Nidhi, Sabeel,Ulya, ",2013,IEEE - Crossref,http://xplorestaging.ieee.org/ielx7/6657460/6657931/06658018.pdf?arnumber=6658018
29/01/2018,Smart Home System for Patients with Mild Cognitive Impairment,"Caban-Holt,Allison, Thapliyal,Himanshu, Maynard,Shane Robert, ",2016,IEEE - Crossref,http://xplorestaging.ieee.org/ielx7/7420813/7424045/07424187.pdf?arnumber=7424187
29/01/2018,Design of a Key Establishment Protocol for Smart Home Energy Management System,"Li,Yue, ",2013,IEEE - Crossref,http://xplorestaging.ieee.org/ielx7/6569033/6571321/06571348.pdf?arnumber=6571348
29/01/2018,Study of Smart Home System Based on Cloud Computing and the Key Technologies,"Yuan,Lin, ",2016,IEEE - Crossref,http://xplorestaging.ieee.org/ielx7/7542779/7546033/07546240.pdf?arnumber=7546240
29/01/2018,Artificial neural network for load forecasting in smart grid,"Zhou,Long, Xu,Fang-Yuan, Zhang,Hao-Tian, ",2010,IEEE - Crossref,http://xplorestaging.ieee.org/ielx5/5570011/5580670/05580713.pdf?arnumber=5580713
29/01/2018,Forecasting of ozone concentration in smart city using deep learning,Not available,2017,IEEE - Crossref,http://xplorestaging.ieee.org/ielx7/8119306/8125802/08126024.pdf?arnumber=8126024
29/01/2018,Forecasting of photovoltaic power using extreme learning machine,"Woo,W. L., Logenthiran,T., Teo,T. T., ",2016,IEEE - Crossref,http://xplorestaging.ieee.org/ielx7/7364573/7386954/07387113.pdf?arnumber=7387113
29/01/2018,Ensuring safe prevention and reaction in smart home systems dedicated to people becoming disabled,"Bouzouane,Abdenour, Bouchard,Bruno, Guillet,Sebastien, ",2015,IEEE - Crossref,http://xplorestaging.ieee.org/ielx7/6999034/7013220/07013250.pdf?arnumber=7013250
29/01/2018,Bridging the Gap between Real and Simulated Environments: A Hybrid Agent-Based Smart Home Simulator Architecture for Complex Systems,"Borges,Cruz E., Alonso-Vicario,Ainhoa, Martin,Cristina, Macarulla-Arenaza,Ana M., Iriarte-Lopez,Xabiar, Castillo-Calzadilla,Tony, Pijoan,Ander, Sorrosal,Gorka, Kamara-Esteban,Oihane, ",2017,IEEE - Crossref,http://xplorestaging.ieee.org/ielx7/7814735/7816796/07816848.pdf?arnumber=7816848
29/01/2018,Smart Intrusion Detection Method Using Negative Selection Algorithm Based on Maximum Entropy Model,"Jia,Hui-bo, Geng,Li-zhong, ",2010,IEEE - Crossref,http://xplorestaging.ieee.org/ielx5/5375738/5375971/05376219.pdf?arnumber=5376219
29/01/2018,Towards Dementia-Friendly Smart Homes,"Bouchachia,Abdelhamid, Amiribesheli,Mohsen, ",2016,IEEE - Crossref,http://xplorestaging.ieee.org/ielx7/7551592/7551973/07552084.pdf?arnumber=7552084
29/01/2018,WSN Middleware for Existing Smart Homes,"Vanhala,Jukka, Pensas,Harri, ",2010,IEEE - Crossref,http://xplorestaging.ieee.org/ielx5/5557895/5558025/05558029.pdf?arnumber=5558029
29/01/2018,A convergence service oriented architecture in smart homes,"Ma,Sining, Li,Weiliang, Wang,Juan, ",2011,IEEE - Crossref,http://xplorestaging.ieee.org/ielx5/6069691/6082527/06082597.pdf?arnumber=6082597
29/01/2018,A knowledge base for energy-efficient smart homes,"Kastner,Wolfgang, Kofler,Mario J., ",2011,IEEE - Crossref,http://xplorestaging.ieee.org/ielx5/5765872/5771653/05771803.pdf?arnumber=5771803
29/01/2018,Nomadic mobility between smart homes,"Andersson,Karl, Kolbe,Hans-Joerg, Schmidt,Mischa, Islam,Raihan Ul, ",2013,IEEE - Crossref,http://xplorestaging.ieee.org/ielx7/6470041/6477486/06477725.pdf?arnumber=6477725
29/01/2018,Smart homes in Poland: Challenges and opportunities,"Loparo,K. A., Zielinski,B., Maslak,W., Sajadi,A., ",2014,IEEE - Crossref,http://xplorestaging.ieee.org/ielx7/6811234/6816367/06816490.pdf?arnumber=6816490
29/01/2018,Performance of zero energy homes in smart village skarpnes,"Imenes,Anne Gerd, ",2016,IEEE - Crossref,http://xplorestaging.ieee.org/ielx7/7701171/7749395/07750247.pdf?arnumber=7750247
29/01/2018,Privacy Preserving Data Analytics for Smart Homes,Not available,2013,IEEE - Crossref,http://xplorestaging.ieee.org/ielx7/6564486/6565207/06565224.pdf?arnumber=6565224
29/01/2018,Crowdsourced electricity demand forecast,"Yu,Jia Yuan, Humphreys,Kenneth, ",2016,IEEE - Crossref,http://xplorestaging.ieee.org/ielx7/7573871/7580726/07580784.pdf?arnumber=7580784
29/01/2018,Teat detection mechanism using machine learning based vision for smart Automatic Milking Systems,"Ryuh,Beom Sahng, Joung,Kim Man, Pal,Abhishesh, Rastogi,Akanksha, ",2017,IEEE - Crossref,http://xplorestaging.ieee.org/ielx7/7983000/7992653/07992872.pdf?arnumber=7992872
29/01/2018,People Smart,"Chou,Wushow ""Bill"", ",2009,IEEE - Crossref,http://xplorestaging.ieee.org/ielx5/6294/4983387/04983407.pdf?arnumber=4983407
29/01/2018,The smart cane utilizing a smart phone for the visually impaired person,"Rhee,Kang Hyeon, Kim,Sanghag, Chung,Il Yong, ",2015,IEEE - Crossref,http://xplorestaging.ieee.org/ielx7/7020225/7031081/07031333.pdf?arnumber=7031333
29/01/2018,Smart Surface: RFID-Based Gesture Recognition Using k-Means Algorithm,"Pous,Rafael, Melia-Segui,Joan, Nur,Kamruddin, Parada,Raul, ",2016,IEEE - Crossref,http://xplorestaging.ieee.org/ielx7/7717031/7723453/07723478.pdf?arnumber=7723478
29/01/2018,Architecture to Enable Dual Reality for Smart Environments,"Burckert,Christian, Kahl,Gerrit, ",2012,IEEE - Crossref,http://xplorestaging.ieee.org/ielx5/6257545/6258493/06258501.pdf?arnumber=6258501
29/01/2018,Designing Lightweight Software Architectures for Smart Environments,"Cook,Diane J., Kusznir,James, ",2010,IEEE - Crossref,http://xplorestaging.ieee.org/ielx5/5672649/5673536/05673803.pdf?arnumber=5673803
29/01/2018,Context-aware scheduling algorithm in smart home system,"Jingxiao,Wang, Li,Pan, Hong,Zheng, ",2013,IEEE - Crossref,http://xplorestaging.ieee.org/ielx7/6245522/6674198/06674219.pdf?arnumber=6674219
29/01/2018,Assemble Algorithm Based on User Behaviors in the Smart Home,"Wan,Jinlin, Liu,Hao, He,Jing, ",2013,IEEE - Crossref,http://xplorestaging.ieee.org/ielx7/6642226/6642914/06643423.pdf?arnumber=6643423
