searched,title,authors,published,database,source
12/02/2018,Automatic ship detection in sar images using aegir,"Hannevik,Tonje Nanette, ",2010,IEEE - Crossref,http://xplorestaging.ieee.org/ielx5/5639672/5648802/05652021.pdf?arnumber=5652021
12/02/2018,Progressive change detection in time series of SAR images,"Mercier,Gregoire, ",2010,IEEE - Crossref,http://xplorestaging.ieee.org/ielx5/5639672/5648802/05652452.pdf?arnumber=5652452
12/02/2018,Ground penetrating radar for tunnel detection,"Chen,Chi-Chih, Kuloglu,Mustafa, ",2010,IEEE - Crossref,http://xplorestaging.ieee.org/ielx5/5639672/5648802/05649832.pdf?arnumber=5649832
12/02/2018,Hyperspectral remote sensing subpixel object detection performance,"Kerekes,John P., ",2012,IEEE - Crossref,http://xplorestaging.ieee.org/ielx5/6171060/6176336/06176366.pdf?arnumber=6176366
12/02/2018,Map-based change detection (MBCD) in urban traffic scenes,"Meysel,Frederik, ",2011,IEEE - Crossref,http://xplorestaging.ieee.org/ielx5/5757210/5764698/05764704.pdf?arnumber=5764704
12/02/2018,Classification based building detection from GeoEye-1 images,"Fras,Mojca Kosmatin, Grigillo,Dejan, ",2011,IEEE - Crossref,http://xplorestaging.ieee.org/ielx5/5757210/5764698/05764799.pdf?arnumber=5764799
12/02/2018,Iterative detection for compressive sensing: Turbo CS,"Reed,Mark C., Movahed,Amin, ",2014,IEEE - Crossref,http://xplorestaging.ieee.org/ielx7/6878057/6883277/06884033.pdf?arnumber=6884033
12/02/2018,Detection performance of Compressive Sensing applied to radar,"Hoogeboom,Peter, Otten,Matern, Anitori,Laura, ",2011,IEEE - Crossref,http://xplorestaging.ieee.org/ielx5/5941184/5960475/05960528.pdf?arnumber=5960528
12/02/2018,Graph based SAR images change detection,"Yu,Tiantian, Gou,Shuiping, ",2012,IEEE - Crossref,http://xplorestaging.ieee.org/ielx5/6334512/6350328/06351077.pdf?arnumber=6351077
12/02/2018,New method for ship detection,"Gao,Wei, Yang,Jian, ",2012,IEEE - Crossref,http://xplorestaging.ieee.org/ielx5/6334512/6350328/06351623.pdf?arnumber=6351623
12/02/2018,Mobile sensing for agriculture activities detection,"Jagyasi,Bhushan, Raval,Jabal, Sharma,Somya, ",2014,IEEE - Crossref,http://xplorestaging.ieee.org/ielx7/6708222/6713632/06713707.pdf?arnumber=6713707
12/02/2018,Sift-ELM approach for unsupervised change detection in VHR images,"Alhichri,Haikel, ",2014,IEEE - Crossref,http://xplorestaging.ieee.org/ielx7/6919813/6946328/06947542.pdf?arnumber=6947542
12/02/2018,Front detection in MODIS imagery of the Black Sea,"Karimova,Svetlana, ",2014,IEEE - Crossref,http://xplorestaging.ieee.org/ielx7/6919813/6946328/06947467.pdf?arnumber=6947467
12/02/2018,Activity detection in SAR CCD,"Phillips,Rhonda D., ",2014,IEEE - Crossref,http://xplorestaging.ieee.org/ielx7/6704876/6721065/06723456.pdf?arnumber=6723456
12/02/2018,Interactive satellite image change detection,"Sahbi,Hichem, ",2014,IEEE - Crossref,http://xplorestaging.ieee.org/ielx7/6704876/6721065/06723576.pdf?arnumber=6723576
12/02/2018,Hyperspectral target detection with sparseness constraint,"Du,Qian, Ma,Ben, ",2014,IEEE - Crossref,http://xplorestaging.ieee.org/ielx7/6704876/6721065/06721346.pdf?arnumber=6721346
12/02/2018,Detection of Misbehavior in Cooperative Spectrum Sensing,"Naraghi-Pour,Mort, Soltanmohammadi,Erfan, ",2014,IEEE - Crossref,http://xplorestaging.ieee.org/ielx7/6717175/6735577/06735744.pdf?arnumber=6735744
12/02/2018,Multiple scatterers detection in CS-based SAR tomography,"Schirinzi,Gilda, Budillon,Alessandra, ",2014,IEEE - Crossref,http://xplorestaging.ieee.org/ielx7/6919813/6946328/06946671.pdf?arnumber=6946671
12/02/2018,Sensing technology for foodborne pathogen detection,"Lorenzelli,Leandro, Adami,Andrea, Mortari,Alessia, ",2015,IEEE - Crossref,http://xplorestaging.ieee.org/ielx7/7061817/7066758/07066795.pdf?arnumber=7066795
12/02/2018,Object-based change detection of informal settlements,"Bekkarnayeva,Gulnaz, Hofmann,Peter, ",2017,IEEE - Crossref,http://xplorestaging.ieee.org/ielx7/7919506/7924526/07924588.pdf?arnumber=7924588
12/02/2018,Ensemble classifiers for building damage detection,"Lepage,Richard, Dubois,David, ",2015,IEEE - Crossref,http://xplorestaging.ieee.org/ielx7/7303999/7325670/07326374.pdf?arnumber=7326374
12/02/2018,Kalman filter estimation with edge detection-based hybrid sensing,"Oldham,K. R., Chen,Y., ",2016,IEEE - Crossref,http://xplorestaging.ieee.org/ielx7/7518121/7524873/07526065.pdf?arnumber=7526065
12/02/2018,Detection of Single Event Transients Based on Compressed Sensing,"Li,Huiyun, Shao,Cuiping, ",2017,IEEE - Crossref,http://xplorestaging.ieee.org/ielx7/8027145/8029385/08029426.pdf?arnumber=8029426
12/02/2018,Robust hyperspectral detection with algorithm fusion,"Confort,Patrick, Adler-Golden,Steven, ",2010,IEEE - Crossref,http://xplorestaging.ieee.org/ielx5/5639672/5648802/05654197.pdf?arnumber=5654197
12/02/2018,Multi-channel and multi-polarisation ship detection,"Hannevik,Tonje Nanette Arnesen, ",2012,IEEE - Crossref,http://xplorestaging.ieee.org/ielx5/6334512/6350328/06352451.pdf?arnumber=6352451
12/02/2018,Sensing sail luffing by detection of sail shape,"Ruvolo,Paul, Morrow,Alexander, Jordan,Rebecca, ",2017,IEEE - Crossref,http://xplorestaging.ieee.org/ielx7/8067435/8084562/08084810.pdf?arnumber=8084810
12/02/2018,Satellite SAR and Human Settlement Detection,"Trianni,Giovanna, Dell'Acqua,Fabio, Gamba,Paolo, ",2007,IEEE - Crossref,http://xplorestaging.ieee.org/ielx5/4234358/4234359/04234471.pdf?arnumber=4234471
12/02/2018,Building detection using directional spatial constraints,"Aksoy,Selim, Akcay,H. Gokhan, ",2010,IEEE - Crossref,http://xplorestaging.ieee.org/ielx5/5639672/5648802/05652842.pdf?arnumber=5652842
12/02/2018,Intelligent Stolen Vehicle Detection using Video Sensing,"Challa,Subhash, Al-Hmouz,Rami, ",2007,IEEE - Crossref,http://xplorestaging.ieee.org/ielx5/4252449/4252450/04252519.pdf?arnumber=4252519
12/02/2018,"Spectrum Sensing Measurements of Pilot, Energy, and Collaborative Detection","Brodersen,Robert, Tkachenko,Artem, Cabric,Danijela, ",2007,IEEE - Crossref,http://xplorestaging.ieee.org/ielx5/4086332/4043248/04086424.pdf?arnumber=4086424
12/02/2018,Variable target detection using Simplex ACE,"Theiler,James, Ziemann,Amanda, ",2017,IEEE - Crossref,http://xplorestaging.ieee.org/ielx7/8118204/8126808/08127211.pdf?arnumber=8127211
12/02/2018,Evaluating hyperspectral imaging change detection methods,"Shalev,Hanoch, Rotman,Stanley, ",2017,IEEE - Crossref,http://xplorestaging.ieee.org/ielx7/8118204/8126808/08127360.pdf?arnumber=8127360
12/02/2018,Cloud detection with SVM technique,"Dejean,Ph., Panem,Ch, Latry,Ch., ",2008,IEEE - Crossref,http://xplorestaging.ieee.org/ielx5/4422707/4422708/04422827.pdf?arnumber=4422827
12/02/2018,Reconfigurable acceleration for hyperspectral target detection,Not available,2008,IEEE - Crossref,http://xplorestaging.ieee.org/ielx5/4422707/4422708/04423532.pdf?arnumber=4423532
12/02/2018,Change Detection with Misregistration Errors,"Inglada,Jordi, Mercier,Gregoire, ",2009,IEEE - Crossref,http://xplorestaging.ieee.org/ielx5/4757194/4779256/04779306.pdf?arnumber=4779306
12/02/2018,Urban area detection and segmentation using OTB,"Inglada,J., May,S., ",2010,IEEE - Crossref,http://xplorestaging.ieee.org/ielx5/5403226/5417310/05417530.pdf?arnumber=5417530
12/02/2018,Operational approach for ship detection and classification,"Mallorqui,J., Margarit,G., ",2010,IEEE - Crossref,http://xplorestaging.ieee.org/ielx5/5403226/5417310/05417542.pdf?arnumber=5417542
12/02/2018,Detecting Usability Problems and Offering Lines of Solutions: An Instrument' Proposal for Measuring Usability in Online Services,"Rodriguez Pena,Nelson, Lavin,Claudio, Garrido,Marcelo, ",2014,IEEE - Crossref,http://xplorestaging.ieee.org/ielx7/9907/6716484/06716486.pdf?arnumber=6716486
12/02/2018,A Method for Detecting and Measuring Architectural Layering Violations in Source Code,"R,Shubha, Rama,Girish Maskeri, Sarkar,Santonu, ",2007,IEEE - Crossref,http://xplorestaging.ieee.org/ielx5/4137386/4137387/04137415.pdf?arnumber=4137415
12/02/2018,"Design of Integrated Detecting the Pipeline Based on Smart Meter, Terminals, Concentrator",Not available,2013,IEEE - Crossref,http://xplorestaging.ieee.org/ielx7/6490493/6493645/06493763.pdf?arnumber=6493763
12/02/2018,Photoelectric Detecting System for measuring the Number density of Ship Optical-wakes' Bubbles,"Donghua,Zhu, Xiaohui,Zhang, ChunshengP,Sun, ",2007,IEEE - Crossref,http://xplorestaging.ieee.org/ielx5/4350396/4350397/04350845.pdf?arnumber=4350845
12/02/2018,Method for measuring torques of induction motors for the slip ranging from 0 to 2 by detecting twists of stator,"Nanko,H., Takano,H., ",2008,IEEE - Crossref,http://xplorestaging.ieee.org/ielx5/11048/34861/01665538.pdf?arnumber=1665538
12/02/2018,An Algorithm for Detecting and Measuring Jagged Elliptical Regions from a Binary Image; Region Identification,"Tsouros,Constantine, Liambas,Christos, ",2008,IEEE - Crossref,http://xplorestaging.ieee.org/ielx5/4520396/4529902/04530083.pdf?arnumber=4530083
12/02/2018,Design of Light Addressable Potentiometric Sensors' Detecting System,"Xing,Keli, Wang,Tao, Tian,Hongli, Zhang,Fuhai, Shang,Jiabin, Liu,Huigang, Ren,Liru, Guo,Ziyu, Jia,Yunfang, Nie,Lili, ",2010,IEEE - Crossref,http://xplorestaging.ieee.org/ielx5/5458391/5458485/05459628.pdf?arnumber=5459628
12/02/2018,Detecting and measuring interconnection reflectance in fiber optic cable assemblies with a video microscope,"Stone,Donald, Woodward,William R., ",2008,IEEE - Crossref,http://xplorestaging.ieee.org/ielx5/4640960/4653141/04653188.pdf?arnumber=4653188
12/02/2018,A Digital and Non-contact Method for Detecting Moving Beam Eccentricity in Forging Hydraulic Press Based on Machine Vision,"Quan,Lingyun, Peng,Yufeng, Tan,Jianping, Chen,Hui, ",2010,IEEE - Crossref,http://xplorestaging.ieee.org/ielx5/5458391/5458485/05459003.pdf?arnumber=5459003
12/02/2018,A New Automatic Detecting and Sorting Instrument Applied to Automobile Engine Piston Ring,Not available,2013,IEEE - Crossref,http://xplorestaging.ieee.org/ielx7/6490493/6493645/06493666.pdf?arnumber=6493666
12/02/2018,Acoustic Tomography for Detecting a Hot Spot in Grain Bulk,"Qi,Yue, Liu,Li Jun, Cui,Ke Xin, Yan,Hua, ",2009,IEEE - Crossref,http://xplorestaging.ieee.org/ielx5/5202889/5202890/05202940.pdf?arnumber=5202940
12/02/2018,Design of Intelligent Dissolved Oxygen Detecting System Based on CAN Bus and Embedded USB Host,"Zhang,Hailian, Gong,Xiaoxia, Liu,Yang, Liu,Xingqiao, ",2009,IEEE - Crossref,http://xplorestaging.ieee.org/ielx5/5202889/5202890/05202919.pdf?arnumber=5202919
12/02/2018,A Digital Method for Detecting Hydraulic Press Column Stress Based on Profibus-dp Fieldbus,"Gong,Jinli, Tan,Jianping, Chen,Hui, ",2009,IEEE - Crossref,http://xplorestaging.ieee.org/ielx5/5202889/5202890/05202935.pdf?arnumber=5202935
12/02/2018,An Algorithms for the Image Detecting about the Center of Orbicular Based on Digital Image,"YuHui,Wang, XiuRong,Fang, ",2011,IEEE - Crossref,http://xplorestaging.ieee.org/ielx5/5720445/5720685/05720796.pdf?arnumber=5720796
12/02/2018,Improved method for detecting currents with harmonics and reactive power in the injection active power filter,Not available,2011,IEEE - Crossref,http://xplorestaging.ieee.org/ielx5/5720445/5721001/05721199.pdf?arnumber=5721199
12/02/2018,Lung tissue evaluation detecting and measuring morphological characteristics of cell regions,"Shrestha,Suman, Giakos,George, Petrakis,Euripides G.M., Zervakis,Michalis, Antonakakis,Marios, Moirogiorgou,Konstantia, Livanos,George, ",2015,IEEE - Crossref,http://xplorestaging.ieee.org/ielx7/7284460/7294454/07294525.pdf?arnumber=7294525
12/02/2018,Online Optical Tomography System for Detecting and Measuring the Diameters of Solid and Transparent Objects,"Abdul Rahim,Ruzairi, Jamaludin,Juliza, ",2016,IEEE - Crossref,http://xplorestaging.ieee.org/ielx7/7361/7515126/07490401.pdf?arnumber=7490401
12/02/2018,A Method of Traffic Sign Detecting Based on Color Similarity,"Baozhong,Ke, Menghe,Li, Fan,Zhang, Shenghui,Pan, Chuan,Lin, ",2011,IEEE - Crossref,http://xplorestaging.ieee.org/ielx5/5720445/5720685/05720737.pdf?arnumber=5720737
12/02/2018,Study on Improving Time-domain Resolution on Detecting Concrete Structures,"Aimin,Dong, Qiong,Wu, Min,Zhao, Yin,Liao, Qiufeng,Li, ",2011,IEEE - Crossref,http://xplorestaging.ieee.org/ielx5/5720445/5721408/05721529.pdf?arnumber=5721529
12/02/2018,Measuring flow as concept for detecting game fun in the Pac-Man game,"Wessing,Simon, Stiller,Klaus, Preuss,Mike, Naujoks,Boris, Eichhorn,Christian, Danielsiek,Holger, Beume,Nicola, ",2008,IEEE - Crossref,http://xplorestaging.ieee.org/ielx5/4625778/4630767/04631264.pdf?arnumber=4631264
12/02/2018,Detecting complexity abnormalities in dyslexia measuring approximate entropy of electroencephalographic signals,"Nikita,K.S., Papageorgiou,C., Giannakakis,G.A., Andreadis,I.I., ",2009,IEEE - Crossref,http://xplorestaging.ieee.org/ielx5/5307844/5332379/05332798.pdf?arnumber=5332798
12/02/2018,Iris Recognition: Measuring Feature's Quality for the Feature Selection in Unconstrained Image Capture Environments,"Alexandre,Luis, Proenca,Hugo, ",2007,IEEE - Crossref,http://xplorestaging.ieee.org/ielx5/4106198/4106199/04106219.pdf?arnumber=4106219
12/02/2018,A Rough Set Classifilcation Based Approach to Detect Hotspots in NOAA/AVHRR Images,"Mittal,A., Singh,D., Gautam,R.S., ",2007,IEEE - Crossref,http://xplorestaging.ieee.org/ielx5/4286037/4286038/04286076.pdf?arnumber=4286076
12/02/2018,Multiresolution Compressive Sensing algorithm to detect off-grid direction of arrival,"Chen,Zhuo, Hedley,Mark, Goratti,Leonardo, Reisenfeld,Sam, Biswas,Audri, ",2017,IEEE - Crossref,http://xplorestaging.ieee.org/ielx7/7829189/7843289/07843314.pdf?arnumber=7843314
12/02/2018,An Efficient Method to Detect Defective Detectors of SPOT 4 SWIR Band Using Iterative High-pass Filtering,"Won,J.-S., Kim,M.-K., Jung,H.-S., ",2007,IEEE - Crossref,http://xplorestaging.ieee.org/ielx5/4087812/4241146/04241764.pdf?arnumber=4241764
12/02/2018,Coal Mine Detect and Rescue Robot Design and Research,"boyu,Wei, jianguo,Zhu, wei,Zhu, xueshan,Gao, junyao,Gao, ",2008,IEEE - Crossref,http://xplorestaging.ieee.org/ielx5/4489617/4525150/04525321.pdf?arnumber=4525321
12/02/2018,Use of MODIS enhanced vegetation index to detect seasonal patterns of leaf phenology in central Amazon v&#x00E1;rzea forest,"Melack,John, Potter,Chris, Huete,Alfredo, Ratana,Piyachat, Hess,Laura, ",2010,IEEE - Crossref,http://xplorestaging.ieee.org/ielx5/5403226/5417310/05417550.pdf?arnumber=5417550
12/02/2018,Using permanent scatterer InSAR to detect land subsidence and ground fissures: A case study in Xi'an city,"Guo,Xiaofang, Zhang,Ling, Wang,Yan, Ge,Daqing, ",2010,IEEE - Crossref,http://xplorestaging.ieee.org/ielx5/5403226/5417981/05418088.pdf?arnumber=5418088
12/02/2018,Utilization of spectral measurements and phenological observations to detect grassland-habitats with a RapidEye intra-annual time-series,"Kleinschmit,Birgit, Frick,Annett, Forster,Michael, ",2011,IEEE - Crossref,http://xplorestaging.ieee.org/ielx5/5983499/6005026/06005099.pdf?arnumber=6005099
12/02/2018,A new approach to detect radio jamming attacks in wireless networks,"Zhou,Mengchu, Kosinski,John, Su,Wei, Yu,Ming, ",2010,IEEE - Crossref,http://xplorestaging.ieee.org/ielx5/5456078/5461482/05461570.pdf?arnumber=5461570
12/02/2018,Development of Sensing Device to Detect Persons Hiding in a Car,"Watanabe,Kajiro, Kurihara,Yosuke, ",2010,IEEE - Crossref,http://xplorestaging.ieee.org/ielx5/7361/5961208/05669325.pdf?arnumber=5669325
12/02/2018,Application of GNSS networks to detect and analyze atmospheric-induced ionospheric disturbances coincident with earthquakes and tsunamis,"Lee,See-Chen, Garrison,James L., Yang,Yu-Ming, ",2011,IEEE - Crossref,http://xplorestaging.ieee.org/ielx5/6034618/6048881/06049396.pdf?arnumber=6049396
12/02/2018,A new method to detect zero drift and sensitivity of a Coriolis Mass Flow Meter (CMFM) by using phasor control,"Koschmieder,F., Rock,H., ",2009,IEEE - Crossref,http://xplorestaging.ieee.org/ielx5/4745894/4757055/04757160.pdf?arnumber=4757160
12/02/2018,Research for brushless motor controller using winding back-EMF to detect rotor position,Not available,2009,IEEE - Crossref,http://xplorestaging.ieee.org/ielx5/4745894/4757055/04757143.pdf?arnumber=4757143
12/02/2018,Use of passive microwave signatures to detect and monitor flooding events in Sundarban Delta,"Ferrazzoli,Paolo, Rahmoune,Rachid, Chakraborty,Raja, ",2011,IEEE - Crossref,http://xplorestaging.ieee.org/ielx5/6034618/6048881/06049865.pdf?arnumber=6049865
12/02/2018,Improving change vector analysis in Multi-temporal space to detect land cover changes by using cross-correlogram spectral matching algorithm,"He,Chunyang, Zhao,Yuanyuan, ",2011,IEEE - Crossref,http://xplorestaging.ieee.org/ielx5/6034618/6048881/06048960.pdf?arnumber=6048960
12/02/2018,Spatial filtering analysis for quick drought assessment using MODIS images to detect drought affected areas,"Chu,Tzu-How, Shiu,Yi-Shiang, Chen,Cheng-Wu, Wang,Qiubing, Sun,Fujun, Lin,Meng-Lung, ",2011,IEEE - Crossref,http://xplorestaging.ieee.org/ielx5/6034618/6048881/06049243.pdf?arnumber=6049243
12/02/2018,Applying Smoothing Curves to AVHRR and MODIS Satellite Imagery to Detect the Onset of Spring in the Midwest and Northeast United States,"Hanes,Jonathan, ",2009,IEEE - Crossref,http://xplorestaging.ieee.org/ielx5/4757194/4779256/04779347.pdf?arnumber=4779347
12/02/2018,Development of the device to detect human's bio-signals by easy sensing,"Magatani,Kazushige, Kanaeda,Yoshiaki, Asaoka,Takahiro, ",2009,IEEE - Crossref,http://xplorestaging.ieee.org/ielx5/4636107/4649055/04649206.pdf?arnumber=4649206
12/02/2018,Combining satellite-derived chlorophyll-a data and high-resolution dubaisat-1 data to detect and monitor red tide outbreaks in the Arabian Gulf,"Shaheen,Ali, Ghedira,Hosni, Muhairi,Ammar Al, ",2010,IEEE - Crossref,http://xplorestaging.ieee.org/ielx5/5639672/5648802/05651944.pdf?arnumber=5651944
12/02/2018,"Using landsat data to detect long-term morphodynamic behavior of estuaries: A case study in the Xiaoqing River estuary, China","Yan,Jun, Huang,Haijun, Liu,Yanxia, ",2010,IEEE - Crossref,http://xplorestaging.ieee.org/ielx5/5639672/5648802/05652457.pdf?arnumber=5652457
12/02/2018,A study on using linear microphone array-based acoustic sensing to detect approaching vehicles,"Yasukawa,Hiroshi, Itai,Akitoshi, Shimada,Naoto, ",2010,IEEE - Crossref,http://xplorestaging.ieee.org/ielx5/5647048/5664831/05664832.pdf?arnumber=5664832
12/02/2018,Optimization of immunochemistry for sensing techniques to detect pesticide residues in water,"Jorgensen,Claus, Aamand,Jens, Kiersgaard,Spire M., Jakobsen,Mogens Havsteen, Kostesha,Natalie, Uthuppu,Basil, ",2011,IEEE - Crossref,http://xplorestaging.ieee.org/ielx5/5733273/5739764/05739792.pdf?arnumber=5739792
12/02/2018,Mathematical morphology approach to detect farmland conditions from ALOS/PALSAR data after the 2011 off the pacific coast of Tohoku Japan earthquake and Tsunami,"Yamada,Yasuharu, ",2012,IEEE - Crossref,http://xplorestaging.ieee.org/ielx5/6334512/6350328/06352210.pdf?arnumber=6352210
12/02/2018,Development of a method to detect coral bleaching using airborne hyperspectral sensor,"Matsunaga,Tsuneo, Kashimura,Osamu, Kakuta,Satomi, Takeda,Tomomi, ",2012,IEEE - Crossref,http://xplorestaging.ieee.org/ielx5/6334512/6350328/06351864.pdf?arnumber=6351864
12/02/2018,Gas-sensing simulation of single-walled carbon nanotubes applied to detect gas decomposition products of SF<inf>6</inf> in PD,"Li,Jian, Wang,Zhen, Meng,Fansheng, Zhang,Xiaoxing, ",2011,IEEE - Crossref,http://xplorestaging.ieee.org/ielx5/5983456/5996097/05996132.pdf?arnumber=5996132
12/02/2018,Classifying landsat thermal data to detect patterns of urban sprawl with the multilayer level set approach,"Peng,Chih-Ping, Huang,Yishuo, ",2014,IEEE - Crossref,http://xplorestaging.ieee.org/ielx7/6917166/6927831/06927844.pdf?arnumber=6927844
12/02/2018,A Low Cost Sensing Device to Detect Cardiac Timing and Function,"Quarrie,David Mac, Neary,Patrick, Ko,Seokbum, Dinh,Anh, ",2012,IEEE - Crossref,http://xplorestaging.ieee.org/ielx5/6298711/6298712/06298725.pdf?arnumber=6298725
12/02/2018,Using the butterfly effect in a deterministic non-linear system to detect Land cover change,"Wessels,K. J., Kleynhans,W., Olivier,J. C., Salmon,B. P., ",2014,IEEE - Crossref,http://xplorestaging.ieee.org/ielx7/6919813/6946328/06947420.pdf?arnumber=6947420
12/02/2018,Validation of an automatic system to detect oil spills in X- and L-band SAR images,"Loreggia,D., Di Matteo,L., Cavagnero,M., Biamino,W., Trivero,P., ",2014,IEEE - Crossref,http://xplorestaging.ieee.org/ielx7/6919813/6946328/06946485.pdf?arnumber=6946485
12/02/2018,Optimization of image processing techniques to detect and reconstruct the image of concealed blade for MMW imaging system,"Singh,K P, Singh,Dharmendra, Upadhyay,Rohit, Sharma,Prabhat, Kumar,Bambam, ",2016,IEEE - Crossref,http://xplorestaging.ieee.org/ielx7/7592514/7728980/07729010.pdf?arnumber=7729010
12/02/2018,Exploiting location information to detect light pole in mobile LiDAR point clouds,"Li,Jonathon, Zhang,Shanxin, Zai,Dawei, Chen,Ziyi, Wang,Hanyun, Wang,Cheng, Luo,Huan, ",2016,IEEE - Crossref,http://xplorestaging.ieee.org/ielx7/7592514/7728980/07729112.pdf?arnumber=7729112
12/02/2018,Using layered object representation to detect partially visible airplanes in remote sensing images,"Fan,Yaxiang, Wen,Gongjian, Qiu,Shaohua, ",2017,IEEE - Crossref,http://xplorestaging.ieee.org/ielx7/7939108/7949455/07949486.pdf?arnumber=7949486
12/02/2018,Transforming the autocorrelation function of a time series to detect land cover change,"Schwegmann,C.P., Olivier,J.C., Kleynhans,W., Salmon,B.P., ",2016,IEEE - Crossref,http://xplorestaging.ieee.org/ielx7/7592514/7728980/07730350.pdf?arnumber=7730350
12/02/2018,An innovative approach to detect anomalies on earthen levees using unsupervised classification of polarimetric SAR imagery,"Younan,Nicolas H., Aanstoos,James V., Marapareddy,Ramakalavathi, ",2015,IEEE - Crossref,http://xplorestaging.ieee.org/ielx7/7303999/7325670/07325780.pdf?arnumber=7325780
12/02/2018,Supervised classification using polarimetric SAR decomposition parameters to detect anomalies on earthen levees,"Bruce,Lori M., Younan,Nicolas H., Aanstoos,James V., Marapareddy,Ramakalavathi, ",2016,IEEE - Crossref,http://xplorestaging.ieee.org/ielx7/7592514/7728980/07729249.pdf?arnumber=7729249
12/02/2018,Three-layer Bayesian model based spectrum sensing to detect malicious attacks in cognitive radio networks,"Sun,Ruijin, Lin,Wenxuan, Wang,Ying, Huo,Yongjia, ",2015,IEEE - Crossref,http://xplorestaging.ieee.org/ielx7/7226899/7247062/07247415.pdf?arnumber=7247415
12/02/2018,weSport: Utilising wrist-band sensing to detect player activities in basketball games,"Ang,Chee Siang, Efstratiou,Christos, Bai,Lu, ",2016,IEEE - Crossref,http://xplorestaging.ieee.org/ielx7/7452853/7457013/7457167.pdf?arnumber=7457167
12/02/2018,A deep information based transfer learning method to detect annual urban dynamics of Beijing and Newyork from 1984–2016,"Lu,Hui, Lyu,Haobo, ",2017,IEEE - Crossref,http://xplorestaging.ieee.org/ielx7/8118204/8126808/08127363.pdf?arnumber=8127363
12/02/2018,A wearable low-cost device based upon Force-Sensing Resistors to detect single-finger forces,"Ravindra,Vikram, Castellini,Claudio, ",2014,IEEE - Crossref,http://xplorestaging.ieee.org/ielx7/6903648/6913735/06913776.pdf?arnumber=6913776
12/02/2018,A Method Using Numerical Simulation and Support Vector Machine to Detect Faults in Bearings,"Xiang,Jiawei, Song,Wenlei, ",2017,IEEE - Crossref,http://xplorestaging.ieee.org/ielx7/8170482/8181528/08186574.pdf?arnumber=8186574
12/02/2018,Developing a small UAV platform to detect sheath blight of rice,"Zhao,Jinling, Huang,Linsheng, Zhang,Jian, Zhou,Xingen, Zhang,Dongyan, ",2017,IEEE - Crossref,http://xplorestaging.ieee.org/ielx7/8118204/8126808/08127675.pdf?arnumber=8127675
12/02/2018,Development of a broad landscape monitoring system using hyperspectral imagery to detect pest infestation,"Mueller,S., Copenhaver,K., Casas,J., Glaser,J., ",2009,IEEE - Crossref,http://xplorestaging.ieee.org/ielx5/5281779/5288971/05289005.pdf?arnumber=5289005
12/02/2018,Use of Formosat-2 Satellite Imagery to Detect Near Real Time Deforestation in Amazonia,"Ghislain,Gonzales, Carlos,Souza, Florence,Baillarin, ",2009,IEEE - Crossref,http://xplorestaging.ieee.org/ielx5/4757194/4779256/04779481.pdf?arnumber=4779481
12/02/2018,A similarity measure for outlier detection in timestamped temporal databases,"Aljawarneh,Shadi, Janaki,Vinjamuri, Kumar,Puligadda Veereswara, Radhakrishna,Vangipuram, ",2016,IEEE - Crossref,http://xplorestaging.ieee.org/ielx7/7725027/7745290/07745347.pdf?arnumber=7745347
12/02/2018,Landslide Detection Using a Local Similarity Measure,"Ganas,Athanassios, Petrou,Maria, Khairunniza-Bejo,Siti, ",2007,IEEE - Crossref,http://xplorestaging.ieee.org/ielx5/4052198/4052199/04052257.pdf?arnumber=4052257
12/02/2018,Ent-Boost: Boosting Using Entropy Measure for Robust Object Detection,Not available,2006,IEEE - Crossref,http://xplorestaging.ieee.org/ielx5/11159/35818/01699277.pdf?arnumber=1699277
12/02/2018,Fragile Watermark for Tamper Detection using Structural Distortion Measure,"Kumaran,T., Thangavel,P., ",2007,IEEE - Crossref,http://xplorestaging.ieee.org/ielx5/4374554/4374555/04374871.pdf?arnumber=4374871
12/02/2018,False Positive Analysis of Correlation Ratio Watermark Detection Measure,"Baum,Peter G., Bloom,Jeffrey A., Tian,Jun, ",2007,IEEE - Crossref,http://xplorestaging.ieee.org/ielx5/4284552/4284553/04284726.pdf?arnumber=4284726
12/02/2018,Data Fusion and Confidence Measure in Image Feature Detection,"Huang,Sujuan, Zhu,Qiuyu, ",2006,IEEE - Crossref,http://xplorestaging.ieee.org/ielx5/4020651/4020652/04020734.pdf?arnumber=4020734
