searched,title,authors,published,database,source
12/02/2018,Spectral image utility prediction,"Kerekes,John P., Stefanou,Marcus S., ",2008,IEEE - Crossref,http://xplorestaging.ieee.org/ielx5/4422707/4422708/04423424.pdf?arnumber=4423424
12/02/2018,Traffic Prediction from Wireless Environment Sensing,"Sayrac,Berna, Gueguen,Lionel, ",2009,IEEE - Crossref,http://xplorestaging.ieee.org/ielx5/4917480/4917481/04917998.pdf?arnumber=4917998
12/02/2018,Cloud images capturing system for solar power level prediction,"Ranasinghe,R. A. R. A., Priyanka,V. G. C., Priyadharshana,H. M. S., Perera,K. H. E., Rodrigo,Asanka S., ",2015,IEEE - Crossref,http://xplorestaging.ieee.org/ielx7/7105793/7112293/07112363.pdf?arnumber=7112363
12/02/2018,A Prediction and Motion-Planning Scheme for Visually Guided Robotic Capturing of Free-Floating Tumbling Objects With Uncertain Dynamics,"Aghili,Farhad, ",2012,IEEE - Crossref,http://xplorestaging.ieee.org/ielx5/8860/6210446/06123215.pdf?arnumber=6123215
12/02/2018,Detecting selfish carrier-sense behavior in WiFi networks by passive monitoring,"Maheshwari,Ritesh, Das,Samir R., Paul,Utpal, ",2010,IEEE - Crossref,http://xplorestaging.ieee.org/ielx5/5532324/5544245/05544261.pdf?arnumber=5544261
12/02/2018,Detecting sense of presence changes in EEG spectrum during perception of immersive audiovisual content,"Serackis,Arturas, Gedminas,Aurimas, Abromavicius,Vytautas, ",2017,IEEE - Crossref,http://xplorestaging.ieee.org/ielx7/7944116/7950294/07950309.pdf?arnumber=7950309
12/02/2018,Performance Modeling of 802.11 Ad Hoc Networks with Time-Varying Carrier Sense Range and Physical Capture Capability,"Vastola,Kenneth S., Sheng,Jin, ",2010,IEEE - Crossref,http://xplorestaging.ieee.org/ielx5/4697774/4697775/04697845.pdf?arnumber=4697845
12/02/2018,Glacier Velocity Estimation by Means of a Polarimetric Similarity Measure,"Erten,Esra, ",2013,IEEE - Crossref,http://xplorestaging.ieee.org/ielx5/36/6516939/06410023.pdf?arnumber=6410023
12/02/2018,The Use of the Hopfield Neural Network to Measure Sea-Surface Velocities From Satellite Images,"Tatnall,Adrian R. L., Cote,StÉphane, ",2007,IEEE - Crossref,http://xplorestaging.ieee.org/ielx5/8859/4317516/04317525.pdf?arnumber=4317525
12/02/2018,An adaptive similarity measure for classification of hyperspectral signatures,"Merenyi,E., Bue,B. D., ",2012,IEEE - Crossref,http://xplorestaging.ieee.org/ielx5/8859/6336843/06265360.pdf?arnumber=6265360
12/02/2018,Nonlocal Means Filter for Polarimetric SAR Data Despeckling Based on Discriminative Similarity Measure,"Zhong,Hua, Liu,Ganchao, ",2013,IEEE - Crossref,http://xplorestaging.ieee.org/ielx7/8859/6675034/06562747.pdf?arnumber=6562747
12/02/2018,Remote sensing measure of severity on the Zhalong wetlands and consequent ecological effects,Not available,2014,IEEE - Crossref,http://xplorestaging.ieee.org/ielx7/6917166/6927831/06927917.pdf?arnumber=6927917
12/02/2018,A New Coherent Similarity Measure for Temporal Multichannel Scene Characterization,"Hellwich,Olaf, Ferro-Famil,Laurent, Reigber,Andreas, Erten,Esra, ",2011,IEEE - Crossref,http://xplorestaging.ieee.org/ielx5/36/6222028/06104388.pdf?arnumber=6104388
12/02/2018,"Statistical, Structural, Hybrid, and Graph Theoretical Features to Measure Land Development","Unsalan,Cem, ",2008,IEEE - Crossref,http://xplorestaging.ieee.org/ielx5/8859/4747356/04694137.pdf?arnumber=4694137
12/02/2018,Neutron detection by measuring capture gammas in a calorimetric approach,Not available,2011,IEEE - Crossref,http://xplorestaging.ieee.org/ielx5/5779755/5873695/05874091.pdf?arnumber=5874091
12/02/2018,Predict Protein-Protein Interaction using Heuristic Approaches,"Joshi,R.C., Mittal,A., Agrawal,R.K., ",2006,IEEE - Crossref,http://xplorestaging.ieee.org/ielx5/10772/33937/01619418.pdf?arnumber=1619418
12/02/2018,A Multivariable Pattern Recognition Technique to Predict Extratropical Transition of Tropical Cyclones,"Ritchie,E., Tyo,J., Demirci,O., ",2007,IEEE - Crossref,http://xplorestaging.ieee.org/ielx5/4087812/4241146/04242199.pdf?arnumber=4242199
12/02/2018,A Neural Network Model to Predict Initial Return of Chinese SMEs Stock Market Initial Public Offerings,"Meng,Dan, ",2008,IEEE - Crossref,http://xplorestaging.ieee.org/ielx5/4489617/4525150/04525247.pdf?arnumber=4525247
12/02/2018,Ray tracing to predict insolation in urban environment,"Capriotti,Leo, Degli-Esposti,Vittorio, Vitucci,Enrico M., ",2012,IEEE - Crossref,http://xplorestaging.ieee.org/ielx5/6334512/6350328/06352279.pdf?arnumber=6352279
12/02/2018,The use of environmental variables to predict cholera hazard,"Zheng,Sheng, Cao,Chunxiang, Xu,Min, ",2014,IEEE - Crossref,http://xplorestaging.ieee.org/ielx7/6704876/6721065/06721083.pdf?arnumber=6721083
12/02/2018,Predicting flow state in daily work through continuous sensing of motion rhythm,"Hayakawa,Miki, Yano,Kazuo, Moriwaki,Norihiko, Horry,Youichi, Ohkubo,Norio, Wakisaka,Yoshihiro, Tsuji,Satomi, Sato,Nobuo, Ara,Koji, ",2010,IEEE - Crossref,http://xplorestaging.ieee.org/ielx5/5401171/5409903/05409930.pdf?arnumber=5409930
12/02/2018,Predicting backscatter-biomass and height-biomass trends using a macroecology model,"Woodhouse,I.H., ",2006,IEEE - Crossref,http://xplorestaging.ieee.org/ielx5/36/33829/01610823.pdf?arnumber=1610823
12/02/2018,"Session TA8b1: Sampling, sensing and detection",Not available,2016,IEEE - Crossref,http://xplorestaging.ieee.org/ielx7/7405775/7421038/07421267.pdf?arnumber=7421267
12/02/2018,Capturing the effect of the nanoshell aspect ratio on the resonance wavelength and quality factor in sensing applications using an impedance-based model,"Massoud,Yehia, Smaili,Sami, ",2010,IEEE - Crossref,http://xplorestaging.ieee.org/ielx5/5638584/5649572/05652422.pdf?arnumber=5652422
12/02/2018,Temporal resolution enhancement of image sequences capturing evolving weather phenomena,"Lambrigtsen,Bjorn, Yanovsky,Igor, ",2016,IEEE - Crossref,http://xplorestaging.ieee.org/ielx7/7518745/7530484/07530525.pdf?arnumber=7530525
12/02/2018,Method to detect and measure potential market power on electricity markets using the concept of monopolistic energy,"Axehill,Daniel, Nordstrom,Lars, Gecer,Daniel, Elfstadius,Martin, ",2009,IEEE - Crossref,http://xplorestaging.ieee.org/ielx5/4815087/4839920/04840248.pdf?arnumber=4840248
12/02/2018,Scatter measure for trajectory estimation of periodic signals using track-before-detect approach,"Mazurek,Przemyslaw, ",2016,IEEE - Crossref,http://xplorestaging.ieee.org/ielx7/7568600/7575076/07575320.pdf?arnumber=7575320
12/02/2018,Distribution Entropy (DistEn): A complexity measure to detect arrhythmia from short length RR interval time series,"Palaniswami,Marimuthu, Udhayakumar,Radhagayathri K., Karmakar,Chandan, ",2015,IEEE - Crossref,http://xplorestaging.ieee.org/ielx7/7302811/7318236/07319565.pdf?arnumber=7319565
12/02/2018,Study of a palladium coated Bragg grating sensor to detect and measure low hydrogen concentrations,"Gutierrez-Monreal,J., Horrillo,M.C., Sayago,I., Hernanz,M.L., Corredera,P., Aleixandre,M., ",2007,IEEE - Crossref,http://xplorestaging.ieee.org/ielx5/4271145/4271146/04271210.pdf?arnumber=4271210
12/02/2018,Web Page Prediction by Clustering and Integrated Distance Measure,"Raghavendra,P. S., Poornalatha,G., ",2013,IEEE - Crossref,http://xplorestaging.ieee.org/ielx5/6423126/6425553/06425570.pdf?arnumber=6425570
12/02/2018,Stock Market Prediction Accuracy Analysis Using Kappa Measure,"Singh,S., Garg,N., Gupta,R., ",2013,IEEE - Crossref,http://xplorestaging.ieee.org/ielx7/6524211/6524335/06524479.pdf?arnumber=6524479
12/02/2018,A Measure of Credibility of Solar Power Prediction,Not available,2012,IEEE - Crossref,http://xplorestaging.ieee.org/ielx5/6146696/6147038/06147689.pdf?arnumber=6147689
12/02/2018,Modeling risk prediction of diabetes &#x2014; A preventive measure,"Agarwal,Sonali, Prasad,Bakshi Rohit, ",2015,IEEE - Crossref,http://xplorestaging.ieee.org/ielx7/7020227/7036459/07036646.pdf?arnumber=7036646
12/02/2018,Paired Spectral Content Measure for Gene and Exon Prediction in Eukaryotes,"Ambikairajah,Eliathamby, Epps,Julien, Akhtar,Mahmood, ",2007,IEEE - Crossref,http://xplorestaging.ieee.org/ielx5/4381299/4381300/04381323.pdf?arnumber=4381323
12/02/2018,Detection of seals in remote sensing images using features extracted from deep convolutional neural networks,"Salberg,Arnt-Borre, ",2015,IEEE - Crossref,http://xplorestaging.ieee.org/ielx7/7303999/7325670/07326163.pdf?arnumber=7326163
12/02/2018,Earthquake damage detection using remote sensing data,Not available,2008,IEEE - Crossref,http://xplorestaging.ieee.org/ielx5/4422707/4422708/04423473.pdf?arnumber=4423473
12/02/2018,A probabilistic generative model for unsupervised invariant change detection in remote sensing images,"Perez Nava,Alejandro, Perez Nava,Fernando, ",2008,IEEE - Crossref,http://xplorestaging.ieee.org/ielx5/4422707/4422708/04423316.pdf?arnumber=4423316
12/02/2018,Optimizing remote sensing of native grasslands for monitoring and change detection,"Smith,Anne M., Buckley,Joseph R., ",2016,IEEE - Crossref,http://xplorestaging.ieee.org/ielx7/7592514/7728980/07729032.pdf?arnumber=7729032
12/02/2018,Stochastic Scheme to Street Detection in Remote Sensing Images,"Moctezuma,M., Lopez,L., ",2007,IEEE - Crossref,http://xplorestaging.ieee.org/ielx5/4087812/4241146/04242101.pdf?arnumber=4242101
12/02/2018,A variational level-set method for unsupervised change detection in remote sensing images,"Melgani,Farid, Bazi,Yakoub, ",2010,IEEE - Crossref,http://xplorestaging.ieee.org/ielx5/5403226/5417981/05418266.pdf?arnumber=5418266
12/02/2018,Focus pre-processing chain for object detection in high resolution remote sensing images,"Inglada,J., Valladeau,C., Michel,J., ",2010,IEEE - Crossref,http://xplorestaging.ieee.org/ielx5/5403226/5417981/05418020.pdf?arnumber=5418020
12/02/2018,Visual attention based model for target detection in high resolution remote sensing images,Not available,2013,IEEE - Crossref,http://xplorestaging.ieee.org/ielx5/6410226/6421218/06421238.pdf?arnumber=6421238
12/02/2018,Local patches for change detection in very high resolution remote sensing images,"Corpetti,Thomas, Gong,Xing, ",2011,IEEE - Crossref,http://xplorestaging.ieee.org/ielx5/6034618/6048881/06048936.pdf?arnumber=6048936
12/02/2018,Gravimetric Detection by Compressed Sensing,"Yurtsever,Ulvi, Marzban,Caren, Meila,Marina, ",2009,IEEE - Crossref,http://xplorestaging.ieee.org/ielx5/4757194/4778902/04778960.pdf?arnumber=4778960
12/02/2018,"C9. A New Wideband Spectrum Sensing Technique based on Compressive Sensing, Wavelet Edge Detection and Parallel Processing",Not available,2013,IEEE - Crossref,http://xplorestaging.ieee.org/ielx7/6530795/6587897/06587945.pdf?arnumber=6587945
12/02/2018,Detection of chlorophyll-a in urban water body by remote sensing,Not available,2010,IEEE - Crossref,http://xplorestaging.ieee.org/ielx5/5587676/5602583/05602990.pdf?arnumber=5602990
12/02/2018,A conceptual framework for change detection in very high resolution remote sensing images,"Bovolo,Francesca, Bruzzone,Lorenzo, ",2010,IEEE - Crossref,http://xplorestaging.ieee.org/ielx5/5639672/5648802/05653930.pdf?arnumber=5653930
12/02/2018,Underwater target detection with hyperspectral remote-sensing imagery,"Guillaume,Mireille, Jay,Sylvain, ",2010,IEEE - Crossref,http://xplorestaging.ieee.org/ielx5/5639672/5648802/05650257.pdf?arnumber=5650257
12/02/2018,Automatic detection of moving wild animals in airborne remote sensing images,"Matsunaga,Tsuneo, Oishi,Yu, ",2010,IEEE - Crossref,http://xplorestaging.ieee.org/ielx5/5639672/5648802/05654227.pdf?arnumber=5654227
12/02/2018,Autonomous sensing for leakage detection in underground water pipelines,"Stefanelli,Riccardo, Trinchero,Daniele, Abu-Dayya,Adnan, Kadri,Abdullah, ",2012,IEEE - Crossref,http://xplorestaging.ieee.org/ielx5/6126166/6136939/06137061.pdf?arnumber=6137061
12/02/2018,Based on fuzzy Bayes decision rules change detection approach of remote sensing images,Not available,2009,IEEE - Crossref,http://xplorestaging.ieee.org/ielx5/5076157/5137466/05137480.pdf?arnumber=5137480
12/02/2018,Sensing overhead and average detection time mitigation for sensing scheduling algorithm,"Yang,Dacheng, Yang,Yanhui, Wei,Zaixue, Du,Hong, ",2011,IEEE - Crossref,http://xplorestaging.ieee.org/ielx5/5875053/5898895/05898922.pdf?arnumber=5898922
12/02/2018,New Unsupervised change detection algorithm based on the MRF in remote sensing image,"Li,Pingxiang, Zhang,Liangpei, Zhong,Yanfei, Wei,Lifei, ",2011,IEEE - Crossref,http://xplorestaging.ieee.org/ielx5/5757210/5764698/05764785.pdf?arnumber=5764785
12/02/2018,Interactive change detection techniques in multitemporal multispectral remote sensing images,"Ahamad,Sayed M., Alajlan,Naif, Bazi,Yakoub, Alhichri,Haikel, ",2012,IEEE - Crossref,http://xplorestaging.ieee.org/ielx5/6334512/6350328/06352666.pdf?arnumber=6352666
12/02/2018,Coastline change detection of the Bohai Bay using satellite remote sensing,"Zuo,Liqin, Lu,Yongjun, Ji,Rongyao, ",2011,IEEE - Crossref,http://xplorestaging.ieee.org/ielx5/5954011/5963913/05964242.pdf?arnumber=5964242
12/02/2018,Wet snow detection in the south of China by passive microwave remote sensing,"Zhang,Lixin, Jiang,Lingmei, Pan,Jinmei, ",2012,IEEE - Crossref,http://xplorestaging.ieee.org/ielx5/6334512/6350328/06352523.pdf?arnumber=6352523
12/02/2018,Trainspotting: Combining fast features to enable detection on resource-constrained sensing devices,"Van Laerhoven,Kristof, Berlin,Eugen, ",2012,IEEE - Crossref,http://xplorestaging.ieee.org/ielx5/6233864/6240517/06240520.pdf?arnumber=6240520
12/02/2018,Detection of oil pollution in the arabian gulf using optical remote sensing imagery,Not available,2014,IEEE - Crossref,http://xplorestaging.ieee.org/ielx7/6919813/6946328/06946710.pdf?arnumber=6946710
12/02/2018,Improving leak detection sensing in pipelines: A multidimensional approach with FDM,"Vergallo,P., Griffo,G., Lay-Ekuakille,A., ",2014,IEEE - Crossref,http://xplorestaging.ieee.org/ielx7/6698448/6727602/06727746.pdf?arnumber=6727746
12/02/2018,Geological disaster detection from remote sensing image based on experts' knowledge and image features,"Liu,Yalan, Ren,Yuhuan, ",2016,IEEE - Crossref,http://xplorestaging.ieee.org/ielx7/7592514/7728980/07729170.pdf?arnumber=7729170
12/02/2018,Remote sensing big data utilization for paddy growth stages detection,"Fanany,M. Ivan, Mulyono,S., ",2016,IEEE - Crossref,http://xplorestaging.ieee.org/ielx7/7429454/7429813/07429821.pdf?arnumber=7429821
12/02/2018,A cascade structure of aircraft detection in high resolution remote sensing images,"Bai,Jun, Cui,Xiaoguang, Li,Bangyu, ",2016,IEEE - Crossref,http://xplorestaging.ieee.org/ielx7/7592514/7728980/07729164.pdf?arnumber=7729164
12/02/2018,Airplane detection in remote sensing images based on Object Proposal,"Shi,Zhenwei, Luo,Qinhan, ",2016,IEEE - Crossref,http://xplorestaging.ieee.org/ielx7/7592514/7728980/07729355.pdf?arnumber=7729355
12/02/2018,Cloud detection of remote sensing images by deep learning,"Yin,Jihao, Zi,Yue, Xie,Fengying, Shi,Mengyun, ",2016,IEEE - Crossref,http://xplorestaging.ieee.org/ielx7/7592514/7728980/07729176.pdf?arnumber=7729176
12/02/2018,Voltammetric ion selective electrode-based two-electrode ion sensing system for pH detection,"Wang,Xiaoping, Li,Yazhuo, ",2016,IEEE - Crossref,http://xplorestaging.ieee.org/ielx7/7786450/7796213/07796280.pdf?arnumber=7796280
12/02/2018,Salient region detection in remote sensing images based on color information content,"Li,Xuewei, Wang,Shuang, Zhang,Libao, ",2015,IEEE - Crossref,http://xplorestaging.ieee.org/ielx7/7303999/7325670/07326159.pdf?arnumber=7326159
12/02/2018,Shadow detection in remote sensing images based on weighted edge gradient ratio,Not available,2014,IEEE - Crossref,http://xplorestaging.ieee.org/ielx7/6919813/6946328/06946470.pdf?arnumber=6946470
12/02/2018,SAR and optical remote sensing for urban damage detection and mapping: case studies,"Chini,M., Pierdicca,N., Bignami,C., Stramondo,S., ",2007,IEEE - Crossref,http://xplorestaging.ieee.org/ielx5/4234358/4234359/04234465.pdf?arnumber=4234465
12/02/2018,On-board detection and matching of remotely sensing imagery,"Zhang,Rongting, Zhou,Guoqing, Huang,Jingjin, ",2017,IEEE - Crossref,http://xplorestaging.ieee.org/ielx7/8118204/8126808/08127761.pdf?arnumber=8127761
12/02/2018,Efficient object proposals extraction for target detection in VHR remote sensing images,"Jia,Xiuping, Hu,Jiankun, Farooq,Adnan, ",2017,IEEE - Crossref,http://xplorestaging.ieee.org/ielx7/8118204/8126808/08127712.pdf?arnumber=8127712
12/02/2018,Automatic landslide detection from remote sensing images using supervised classification methods,"Havenith,Hans-Balder, Pirard,Eric, Danneels,Gaelle, ",2008,IEEE - Crossref,http://xplorestaging.ieee.org/ielx5/4422707/4422708/04423479.pdf?arnumber=4423479
12/02/2018,Multichannel InSAR Building Edge Detection,"Ferraioli,G., ",2009,IEEE - Crossref,http://xplorestaging.ieee.org/ielx5/36/5416606/05290065.pdf?arnumber=5290065
12/02/2018,Detection of Traffic Congestion in Optical Remote Sensing Imagery,"Reinartz,Peter, Kurz,Franz, Palubinskas,Gintautas, ",2009,IEEE - Crossref,http://xplorestaging.ieee.org/ielx5/4757194/4778902/04779019.pdf?arnumber=4779019
12/02/2018,Crater Detection by a Boosting Approach,Not available,2008,IEEE - Crossref,http://xplorestaging.ieee.org/ielx5/8859/4747356/04717240.pdf?arnumber=4717240
12/02/2018,Requirements on spectral resolution of remote sensing data for crop stress detection,"Menz,G., Mewes,T., Franke,J., ",2010,IEEE - Crossref,http://xplorestaging.ieee.org/ielx5/5403226/5416731/05416884.pdf?arnumber=5416884
12/02/2018,ICA and kernel ICA for change detection in multispectral remote sensing images,"Bruzzone,Lorenzo, Marchesi,Silvia, ",2010,IEEE - Crossref,http://xplorestaging.ieee.org/ielx5/5403226/5417981/05418265.pdf?arnumber=5418265
12/02/2018,Predicting Medical Provider Specialties to Detect Anomalous Insurance Claims,"Herland,Matthew, Richter,Aaron, Khoshgoftaar,Taghi M., Bauder,Richard A., ",2017,IEEE - Crossref,http://xplorestaging.ieee.org/ielx7/7811909/7814561/07814683.pdf?arnumber=7814683
12/02/2018,Development of a Short-term Prediction Model for Predicting Photochemical Oxidants in a Local Area,"Tamura,Hiroyuki, Fujita,Shinichi, ",2007,IEEE - Crossref,http://xplorestaging.ieee.org/ielx5/4108013/4108014/04109050.pdf?arnumber=4109050
12/02/2018,Extension Cluster Prediction Model Used in Predicting Wastewater Emissions,"Shangfang,Lin, Yongquan,Yu, Tao,Zeng, Liangfang,Lin, ",2009,IEEE - Crossref,http://xplorestaging.ieee.org/ielx5/4731351/4731352/04731377.pdf?arnumber=4731377
12/02/2018,Risk prediction model using fuzzy regression method for predicting unplanned hospital admissions,"Chaussalet,T., Rathi,M., ",2013,IEEE - Crossref,http://xplorestaging.ieee.org/ielx7/6542295/6549844/06549943.pdf?arnumber=6549943
12/02/2018,Short-term solar photovoltaic irradiation predicting using a nonlinear prediction method,"Li,Jian, Huang,Qi, Xie,Ting, Cai,Dongsheng, ",2014,IEEE - Crossref,http://xplorestaging.ieee.org/ielx7/6916492/6938773/06939406.pdf?arnumber=6939406
12/02/2018,Predicting the risk of newborns based on fuzzy clustering method with prediction risk assessment,"Kulanthaivel,G., Thomas,Jyothi, ",2015,IEEE - Crossref,http://xplorestaging.ieee.org/ielx7/7005967/7019573/07019584.pdf?arnumber=7019584
12/02/2018,A Unified Prediction Method for Predicting Program Behavior,"Buyuktosunoglu,Alper, Sarikaya,Ruhi, ",2009,IEEE - Crossref,http://xplorestaging.ieee.org/ielx5/12/5372162/05184824.pdf?arnumber=5184824
12/02/2018,Predicting Web Server Crashes: A Case Study in Comparing Prediction Algorithms,"Gavaldà,Ricard, Torres,Jordi, Alonso,Javier, ",2009,IEEE - Crossref,http://xplorestaging.ieee.org/ielx5/4976562/4976563/04976614.pdf?arnumber=4976614
12/02/2018,Extension Classified Prediction Used in Predicting Monthly Average Temperature of Cities,"Yongquan,Yu, Tao,Zeng, Yuanyuan,Yang, ",2009,IEEE - Crossref,http://xplorestaging.ieee.org/ielx5/4740925/4740926/04741069.pdf?arnumber=4741069
12/02/2018,Does Detecting more Defects Contribute to Better Estimation? An Empirical Investigation to the Capture-Recapture Method,"Shao,Dong, Zhang,He, Rong,Guoping, ",2015,IEEE - Crossref,http://xplorestaging.ieee.org/ielx7/7364551/7365773/07365812.pdf?arnumber=7365812
12/02/2018,Method for detecting interest points in images using angular signatures,"Verly,Jacques G., Boutaayamou,Mohamed, Grogna,David, ",2016,IEEE - Crossref,http://xplorestaging.ieee.org/ielx7/7547443/7548877/07548890.pdf?arnumber=7548890
12/02/2018,Detecting walkable plane areas by using RGB-D camera and accelerometer for visually impaired people,"Kameda,Yoshinari, Kitahara,Itaru, Imai,Kenta, ",2018,IEEE - Crossref,http://xplorestaging.ieee.org/ielx7/8268897/8280393/08280422.pdf?arnumber=8280422
12/02/2018,Sense-and-predict: Opportunistic MAC based on spatial interference correlation for cognitive radio networks,"Kim,Seong-Lyun, Cha,Han, Ko,Seung-Woo, Kim,Jeemin, ",2017,IEEE - Crossref,http://xplorestaging.ieee.org/ielx7/7916889/7920740/07920787.pdf?arnumber=7920787
12/02/2018,Measuring video quality degradation using face detection,"Krishnakumar,A. S., Karacali,Bengi, ",2012,IEEE - Crossref,http://xplorestaging.ieee.org/ielx5/6218073/6222708/06222742.pdf?arnumber=6222742
12/02/2018,Intelligent Intrusion Detection Based on Soft Computing,"Yan,Chen, ",2015,IEEE - Crossref,http://xplorestaging.ieee.org/ielx7/7263329/7263490/07263639.pdf?arnumber=7263639
12/02/2018,Improved Adaboost Face Detection,"Du,Tiancang, Ma,Songyan, ",2010,IEEE - Crossref,http://xplorestaging.ieee.org/ielx5/5458391/5458494/05458605.pdf?arnumber=5458605
12/02/2018,A Neural Network Blind Multi-user Detection Algorithm,"Li,He, ",2009,IEEE - Crossref,http://xplorestaging.ieee.org/ielx5/5202889/5203355/05203473.pdf?arnumber=5203473
12/02/2018,Simulation for RFID-Based Red Light Violation Detection: Violation Detection and Flow Prediction,Not available,2010,IEEE - Crossref,http://xplorestaging.ieee.org/ielx5/5487987/5489106/05489511.pdf?arnumber=5489511
12/02/2018,UWB Radar Sensor Networks for Sense-Through-Foliage Target Detection,"Cheng,X., Samn,S. W., Liang,Q., ",2008,IEEE - Crossref,http://xplorestaging.ieee.org/ielx5/4533035/4533036/04533461.pdf?arnumber=4533461
12/02/2018,Moving target detection for sense and avoid using regional phase correlation,"Krouglicof,Nicholas, May,Kaaren, ",2013,IEEE - Crossref,http://xplorestaging.ieee.org/ielx7/6615630/6630547/06631256.pdf?arnumber=6631256
12/02/2018,Burr wear detection based on vibration sense during surgical milling,"Zhou,Lu, Zhang,Jianxun, Xue,Yuan, Dai,Yu, ",2016,IEEE - Crossref,http://xplorestaging.ieee.org/ielx7/7547213/7553055/07554347.pdf?arnumber=7554347
12/02/2018,Adaptive detection threshold selection for vision-based sense and avoid,"Mejias,Luis, Ford,Jason J., Molloy,Timothy L., ",2017,IEEE - Crossref,http://xplorestaging.ieee.org/ielx7/7982995/7991298/07991313.pdf?arnumber=7991313
12/02/2018,Superpixel-based statistical anomaly detection for sense and avoid,"Bull,David R., Achim,Alin M., Pappas,Odysseas A., ",2015,IEEE - Crossref,http://xplorestaging.ieee.org/ielx7/7328364/7350743/07351197.pdf?arnumber=7351197
12/02/2018,Effective support of taste sense with intra-oral interface by drinking action detection,"Yamaguchi,Tomoyuki, Tsukamoto,Kazuki, ",2018,IEEE - Crossref,http://xplorestaging.ieee.org/ielx7/8267901/8279179/08279282.pdf?arnumber=8279282
12/02/2018,MCBDist: A Novel Markov-Chain-Based Measure of Distance among Webpages,"Wu,Guangguan, Xiong,Zhi, ",2008,IEEE - Crossref,http://xplorestaging.ieee.org/ielx5/4489617/4525150/04525472.pdf?arnumber=4525472
12/02/2018,A signal conditioning circuit to measure human biopotentials,"Ghosh,R., Goswami,B., Basu,D., Mandal,N., Bhattacharya,A., ",2013,IEEE - Crossref,http://xplorestaging.ieee.org/ielx5/6428838/6461638/06461786.pdf?arnumber=6461786
12/02/2018,Adaptive SAR Despeckling using a Proximity Measure to Boundary,"Lee,Sang-Hoon, ",2009,IEEE - Crossref,http://xplorestaging.ieee.org/ielx5/4757194/4779630/04779974.pdf?arnumber=4779974
12/02/2018,A multimodal Matching Pursuits Dissimilarity Measure applied to landmine/clutter discrimination,"Ho,K.C., Wilson,Joseph N., Glenn,Taylor C., ",2010,IEEE - Crossref,http://xplorestaging.ieee.org/ielx5/5639672/5648802/05650732.pdf?arnumber=5650732
12/02/2018,IMU based Onboard-Unit to measure the driveability of transport buses,"Reindl,Leonard M., Ojha,Abhishek, Hoeflinger,Fabian, ",2012,IEEE - Crossref,http://xplorestaging.ieee.org/ielx5/6126166/6136939/06137006.pdf?arnumber=6137006
12/02/2018,A CW-SSIM distance measure-based affinity propagation for hyperspectral band selection,"Deng,Lin, Jia,Sen, ",2014,IEEE - Crossref,http://xplorestaging.ieee.org/ielx7/6704876/6721065/06721181.pdf?arnumber=6721181
12/02/2018,Glacier surface velocity measure based on polarimetric tracking,"Ferro-Famil,Laurent, Reigber,Andreas, Hajnsek,Irena, Chesnokova,Olga, Erten,Esra, ",2012,IEEE - Crossref,http://xplorestaging.ieee.org/ielx5/6334512/6350328/06350763.pdf?arnumber=6350763
12/02/2018,Traffic calming measure and its enlightenment on Chinese road traffic safety,Not available,2011,IEEE - Crossref,http://xplorestaging.ieee.org/ielx5/5954011/5963913/05964657.pdf?arnumber=5964657
12/02/2018,Novel spectral similarity measure for high resolution urban scenes,"Cahill,Nathan D., Vodacek,Anthony, Chen,Bin, ",2012,IEEE - Crossref,http://xplorestaging.ieee.org/ielx5/6334512/6350328/06352077.pdf?arnumber=6352077
12/02/2018,Similarity measure for spatial-spectral registration in hyperspectral era,"Miyamura,Norihide, Ito,Yuki, Arai,Takeshi, Yokoya,Naoto, Iwasaki,Akira, ",2012,IEEE - Crossref,http://xplorestaging.ieee.org/ielx5/6334512/6350328/06351176.pdf?arnumber=6351176
