searched,title,authors,published,database,source
29/01/2018,Human behavior prediction for smart homes using deep learning,Not available,2013,IEEE - Crossref,http://xplorestaging.ieee.org/ielx7/6604421/6628390/06628440.pdf?arnumber=6628440
29/01/2018,Bayesian Networks Structure Learning for Activity Prediction in Smart Homes,"Cook,Diane J., Nazerfard,Ehsan, ",2012,IEEE - Crossref,http://xplorestaging.ieee.org/ielx5/6257545/6258493/06258502.pdf?arnumber=6258502
29/01/2018,PhD Forum: Human Activity Recognition in Smart Environments,"Bayliff,Alec, ",2017,IEEE - Crossref,http://xplorestaging.ieee.org/ielx7/7943263/7946954/07947013.pdf?arnumber=7947013
29/01/2018,Smart Homes Design for People with Dementia,"Bouchachia,Abdelhamid, Amiribesheli,Mohsen, ",2015,IEEE - Crossref,http://xplorestaging.ieee.org/ielx7/7194253/7194254/07194288.pdf?arnumber=7194288
29/01/2018,Recognizing human activity in smart home using deep learning algorithm,"Hu,Chen, Fang,Hongqing, ",2014,IEEE - Crossref,http://xplorestaging.ieee.org/ielx7/6882077/6895198/06895735.pdf?arnumber=6895735
29/01/2018,A Fast Technique for Smart Home Management: ADP with Temporal Difference Learning,"Chapman,Archie C., Verbic,Gregor, Keerthisinghe,Chanaka, ",2016,IEEE - Crossref,http://xplorestaging.ieee.org/ielx7/5165411/5446437/07745930.pdf?arnumber=7745930
29/01/2018,Detecting Smart Plug Configuration Changes in Smart Homes,"Rogozina,A., Konchalenkov,D., Ziekow,H., Leonardi,A., ",2015,IEEE - Crossref,http://xplorestaging.ieee.org/ielx7/7154058/7155750/07156016.pdf?arnumber=7156016
29/01/2018,Learning Algorithm for Human Activity Detection in Smart Environments,"Lozano-Tello,Adolfo, Boton-Fern´ndez,Vicente, ",2011,IEEE - Crossref,http://xplorestaging.ieee.org/ielx5/6036126/6036728/06040701.pdf?arnumber=6040701
29/01/2018,Smart homes. A solution for a smart lighting system,"Popa,M., Gambutan,A. T., ",2009,IEEE - Crossref,http://xplorestaging.ieee.org/ielx5/5089334/5136205/05136242.pdf?arnumber=5136242
29/01/2018,Resource allocation in smart homes based on Banker's algorithm,"Bogdan,S., Virag,A., ",2012,IEEE - Crossref,http://xplorestaging.ieee.org/ielx5/6151917/6162607/06162794.pdf?arnumber=6162794
29/01/2018,Person identification by smart cameras,"Rothkrantz,Leon, ",2017,IEEE - Crossref,http://xplorestaging.ieee.org/ielx7/7963867/7973339/07973347.pdf?arnumber=7973347
29/01/2018,Energy storage management in smart homes based on resident activity of daily life recognition,"Liang,Hao, Zhuang,Peng, ",2016,IEEE - Crossref,http://xplorestaging.ieee.org/ielx7/7426159/7436263/07436373.pdf?arnumber=7436373
29/01/2018,Measuring learning outcomes effectively in smart learning environments,"Sicilia,Miguel-Angel, Kadry,Seifedine, Yassine,Sahar, ",2016,IEEE - Crossref,http://xplorestaging.ieee.org/ielx7/7442953/7447873/7447877.pdf?arnumber=7447877
29/01/2018,Acoustic smart sensors based integrated system for smart homes,"Fonseca,Jose, Ferreira,Joaquim, Alam,Muhammad, Fernandes,Hugo, ",2017,IEEE - Crossref,http://xplorestaging.ieee.org/ielx7/8064441/8090780/08090869.pdf?arnumber=8090869
29/01/2018,Optimal smart gateway deployment for the Internet of Things in smart home environments,"Lin,Po-Chiang, ",2016,IEEE - Crossref,http://xplorestaging.ieee.org/ielx7/7378181/7398473/07398715.pdf?arnumber=7398715
29/01/2018,Intelligent Energy Optimization for User Intelligible Goals in Smart Home Environments,"Razzak,Faisal, Corno,Fulvio, ",2012,IEEE - Crossref,http://xplorestaging.ieee.org/ielx5/5165411/6397636/06319377.pdf?arnumber=6319377
29/01/2018,Fast forecasting uncontrolled network separation in smart grid environment,"Kong,Weicong, Zhang,Chunxue, Xu,Zhao, Jia,Youwei, ",2016,IEEE - Crossref,http://xplorestaging.ieee.org/ielx7/7764633/7778724/07778850.pdf?arnumber=7778850
29/01/2018,Modelling human behaviour in smart home energy management systems via machine learning techniques,"Pipaliya,Bhautik, Gariba,Devanshi, ",2017,IEEE - Crossref,http://xplorestaging.ieee.org/ielx7/7959774/7973873/07973883.pdf?arnumber=7973883
29/01/2018,Electricity Demand Forecasting by Multi-Task Learning,"Dinuzzo,Francesco, Fiot,Jean-Baptiste, ",2016,IEEE - Crossref,http://xplorestaging.ieee.org/ielx7/5165411/5446437/07467578.pdf?arnumber=7467578
29/01/2018,A Home Energy Management System for Energy-Efficient Smart Homes,"Lee,Il-Woo, Park,Wan-Ki, Lee,Hyunjeong, ",2014,IEEE - Crossref,http://xplorestaging.ieee.org/ielx7/6820887/6822285/06822319.pdf?arnumber=6822319
29/01/2018,Smart living in smart homes and buildings,"Leibbrandt,Wouter, ",2011,IEEE - Crossref,http://xplorestaging.ieee.org/ielx5/5992667/6005147/06005182.pdf?arnumber=6005182
29/01/2018,Intervention of non-inhabitant activities detection in smart home environment,"Supangkat,Suhono Harso, Nugraha,I. G. B. Baskara, Adipradhana,Mirza, ",2013,IEEE - Crossref,http://xplorestaging.ieee.org/ielx7/6578013/6588046/06588116.pdf?arnumber=6588116
29/01/2018,A smart air conditioner in smart home,"Aybar,Aydin, Ozkan,Hanife Apaydin, ",2016,IEEE - Crossref,http://xplorestaging.ieee.org/ielx7/7547194/7555399/07555599.pdf?arnumber=7555599
29/01/2018,Guest Editorial Special Section on Intelligent Buildings and Home Energy Management in a Smart Grid Environment,"Dounis,Anastasios, Kusiak,Andrew, Wang,Lingfeng, ",2012,IEEE - Crossref,http://xplorestaging.ieee.org/ielx5/5165411/6397636/06384864.pdf?arnumber=6384864
29/01/2018,Hypothesis Transfer Learning for Efficient Data Computing in Smart Cities Environments,"Conti,Marco, Passarella,Andrea, Valerio,Lorenzo, ",2016,IEEE - Crossref,http://xplorestaging.ieee.org/ielx7/7499653/7501656/07501696.pdf?arnumber=7501696
29/01/2018,Reinforcement learning aided smart-home decision-making in an interactive smart grid,"Jayaweera,Sudharman K., Li,Ding, ",2015,IEEE - Crossref,http://xplorestaging.ieee.org/ielx7/7002486/7018627/07018632.pdf?arnumber=7018632
29/01/2018,Human Activity Detection in Smart Home Environment with Self-Adaptive Neural Networks,"Black,Norman, Wang,Haiying, Zheng,Huiru, ",2008,IEEE - Crossref,http://xplorestaging.ieee.org/ielx5/4489617/4525150/04525459.pdf?arnumber=4525459
29/01/2018,Smart RAS (Remedial Action Scheme),Not available,2010,IEEE - Crossref,http://xplorestaging.ieee.org/ielx5/5428221/5434721/05434735.pdf?arnumber=5434735
29/01/2018,Computational intelligence in smart systems,Not available,2016,IEEE - Crossref,http://xplorestaging.ieee.org/ielx7/7761917/7765608/07765653.pdf?arnumber=7765653
29/01/2018,Computational intelligence in smart systems,Not available,2017,IEEE - Crossref,http://xplorestaging.ieee.org/ielx7/8167962/8188595/08188695.pdf?arnumber=8188695
29/01/2018,DCTP: Data collecting based on trajectory prediction in Smart Environment,"Song,Wen-Zhan, Peng,Yayun, De,Debraj, Wang,Chengliang, ",2015,IEEE - Crossref,http://xplorestaging.ieee.org/ielx7/7031554/7046663/07046673.pdf?arnumber=7046673
29/01/2018,SENAmI 2013: 5th international workshop on smart environments and ambient intelligence 2013 - Program,Not available,2013,IEEE - Crossref,http://xplorestaging.ieee.org/ielx7/6523359/6529412/06529444.pdf?arnumber=6529444
29/01/2018,SENAmI 2013: 5th international workshop on smart environments and ambient intelligence 2013 - Committees and welcome,Not available,2013,IEEE - Crossref,http://xplorestaging.ieee.org/ielx7/6523359/6529412/06529445.pdf?arnumber=6529445
29/01/2018,A Smarter Smart Home: Case Studies of Ambient Intelligence,"Popowich,Fred, Bartram,Lyn, Makonin,Stephen, ",2012,IEEE - Crossref,http://xplorestaging.ieee.org/ielx5/7756/6415926/06287502.pdf?arnumber=6287502
29/01/2018,Activity Recognition Based on Streaming Sensor Data for Assisted Living in Smart Homes,"Cao,Fengming, Fan,Zhong, Chen,Beichen, ",2015,IEEE - Crossref,http://xplorestaging.ieee.org/ielx7/7194253/7194254/07194280.pdf?arnumber=7194280
29/01/2018,"Observe, Learn, and Adapt (OLA)—An Algorithm for Energy Management in Smart Homes Using Wireless Sensors and Artificial Intelligence","Mouftah,Hussein T., Qela,Blerim, ",2012,IEEE - Crossref,http://xplorestaging.ieee.org/ielx5/5165411/6397636/06295694.pdf?arnumber=6295694
29/01/2018,An efficient method of human behavior recognition in smart environments,Not available,2010,IEEE - Crossref,http://xplorestaging.ieee.org/ielx5/5602791/5622106/05622464.pdf?arnumber=5622464
29/01/2018,An Online Learning Algorithm for Demand Response in Smart Grid,"Huang,Jianwei, Wong,Vincent W.S., Bahrami,Shahab, ",2017,IEEE - Crossref,http://xplorestaging.ieee.org/ielx7/5165411/5446437/07849144.pdf?arnumber=7849144
29/01/2018,User behavior prediction for energy management in smart homes,"Schmeck,Hartmut, Allerding,Florian, Bao,Kaibin, ",2011,IEEE - Crossref,http://xplorestaging.ieee.org/ielx5/6012258/6019624/06019758.pdf?arnumber=6019758
29/01/2018,Cloud-based recognition of complex activities for ambient assisted living in smart homes with non-invasive sensors,"Trajkovik,Vladimir, Zdravevski,Eftim, Lameski,Petre, Dimitrievski,Ace, Zdravevska,Aleksandra, ",2017,IEEE - Crossref,http://xplorestaging.ieee.org/ielx7/8004574/8011054/08011214.pdf?arnumber=8011214
29/01/2018,Smart distribution system Volt/VAR control using the intelligence of smart transformer,"Sayed,Khairy, Gabbar,Hossam A., ",2016,IEEE - Crossref,http://xplorestaging.ieee.org/ielx7/7580920/7589184/07589499.pdf?arnumber=7589499
29/01/2018,Optimal electricity purchasing model for smart homes using genetic algorithm,"Nicolae,Dan, Malatji,Esrom Mahlatsi, ",2016,IEEE - Crossref,http://xplorestaging.ieee.org/ielx7/7547194/7555399/07555482.pdf?arnumber=7555482
29/01/2018,Database-driven quality prediction for mobile wireless networks in smart home environments,"Lin,Po-Chiang, ",2016,IEEE - Crossref,http://xplorestaging.ieee.org/ielx7/7378181/7398473/07398680.pdf?arnumber=7398680
29/01/2018,Smart learning environment for the development of Smart City applications,"Kadar,Manuella, ",2016,IEEE - Crossref,http://xplorestaging.ieee.org/ielx7/7600987/7737379/07737500.pdf?arnumber=7737500
29/01/2018,Powering Smart Home Intelligence Using Existing Entertainment Systems,"Scholz,Gerhard H., Schmidtke,Hedda R., Flehmig,Gesine, Scholz,Markus, ",2011,IEEE - Crossref,http://xplorestaging.ieee.org/ielx5/6062619/6063345/06063390.pdf?arnumber=6063390
29/01/2018,Smart Homes (Conceptual Views),"Ramaswamy,R., Madakam,Somayya, ",2015,IEEE - Crossref,http://xplorestaging.ieee.org/ielx7/7111681/7119513/07119535.pdf?arnumber=7119535
29/01/2018,"Control method for multi-microgrid systems in smart grid environment&#x2014;Stability, optimization and smart demand participation","King,Roger, Sofla,Mohammadhassan A., ",2012,IEEE - Crossref,http://xplorestaging.ieee.org/ielx5/6170475/6175527/06175789.pdf?arnumber=6175789
29/01/2018,Real-Time Activity Prediction and Recognition in Smart Homes by Formal Concept Analysis,"Gaboury,Sebastien, Bouzouane,Abdenour, Bouchard,Bruno, Hao,Jianguo, ",2016,IEEE - Crossref,http://xplorestaging.ieee.org/ielx7/7717031/7723453/07723477.pdf?arnumber=7723477
29/01/2018,Smart city service platform associated with smart home,Not available,2017,IEEE - Crossref,http://xplorestaging.ieee.org/ielx7/7893448/7899442/07899557.pdf?arnumber=7899557
29/01/2018,Petri net modelling of smart home appliances,"Apaydin-Ozkan,Hanife, ",2017,IEEE - Crossref,http://xplorestaging.ieee.org/ielx7/8167962/8188595/08188664.pdf?arnumber=8188664
29/01/2018,Consumer-oriented integration of smart homes and smart grids: A case for multicast-enabled Home Gateways?,"Schmidt,Thomas C., Duge,Moritz, Steinbach,Till, Meiling,Sebastian, ",2014,IEEE - Crossref,http://xplorestaging.ieee.org/ielx7/6697948/6697949/06698009.pdf?arnumber=6698009
29/01/2018,"Building automation by an intelligent embedded infrastructure: Combining medical, smart energy, smart environment and heating","Diekmann,Stephan, Schwartze,Jonas, Schrom,Harald, ",2017,IEEE - Crossref,http://xplorestaging.ieee.org/ielx7/8064441/8090780/08090802.pdf?arnumber=8090802
29/01/2018,Demand side management in a smart grid environment,"Kaur,Sandeep, Khanna,Rintu, Mehta,Nishtha, Gaur,Gaurav, ",2017,IEEE - Crossref,http://xplorestaging.ieee.org/ielx7/8027285/8038534/08038581.pdf?arnumber=8038581
29/01/2018,Smart community for the smart governance of the urban environment,"Russo,Laura, Natale,Alfredo, Gargiulo,Carmela, ",2015,IEEE - Crossref,http://xplorestaging.ieee.org/ielx7/7347908/7366145/07366174.pdf?arnumber=7366174
29/01/2018,Behavior prediction using an improved Hidden Markov Model to support people with disabilities in smart homes,"Gu,Ning, Gu,Hansu, Lu,Tun, Zhang,Peng, Wu,Eying, ",2016,IEEE - Crossref,http://xplorestaging.ieee.org/ielx7/7561991/7565943/07566051.pdf?arnumber=7566051
29/01/2018,Predicting user comfort level using machine learning for Smart Grid environments,Not available,2011,IEEE - Crossref,http://xplorestaging.ieee.org/ielx5/5752642/5759123/05759178.pdf?arnumber=5759178
29/01/2018,An Improved Position Prediction Algorithm Based on Active LeZi in Smart Home,"Ruan,Jinjin, Fang,Hongqing, ",2013,IEEE - Crossref,http://xplorestaging.ieee.org/ielx5/6392590/6394246/06394752.pdf?arnumber=6394752
29/01/2018,An efficient kernel machine technique for short-term load forecasting under smart grid environment,"Kurata,E., Mori,H., ",2012,IEEE - Crossref,http://xplorestaging.ieee.org/ielx5/6330648/6343905/06345687.pdf?arnumber=6345687
29/01/2018,SmartCase: A Smart Home Environment in a Suitcase,"Stahl,Christoph, Reithinger,Norbert, Gholamsaghaee,Ehsan, Alexandersson,Jan, Bergweiler,Simon, Frey,Jochen, ",2011,IEEE - Crossref,http://xplorestaging.ieee.org/ielx5/6062619/6063345/06063420.pdf?arnumber=6063420
29/01/2018,Short-Term Load Forecast of Microgrids by a New Bilevel Prediction Strategy,"Zareipour,Hamidreza, Keynia,Farshid, Amjady,Nima, ",2010,IEEE - Crossref,http://xplorestaging.ieee.org/ielx5/5165411/5629465/05613970.pdf?arnumber=5613970
29/01/2018,A multiple-transfer framework for learning context models for dynamic smart-home environments,"Chiang,Yi-Ting, Lu,Ching-Hu, ",2014,IEEE - Crossref,http://xplorestaging.ieee.org/ielx7/6894724/6903991/06904067.pdf?arnumber=6904067
29/01/2018,Prediction diagnostic for smart cities systems,"Votruba,Zdenek, Svitek,Miroslav, Novak,Mirko, ",2015,IEEE - Crossref,http://xplorestaging.ieee.org/ielx7/7172789/7181533/07181546.pdf?arnumber=7181546
29/01/2018,Variable selection for prediction of time series from smart city,"Macas,Martin, ",2015,IEEE - Crossref,http://xplorestaging.ieee.org/ielx7/7172789/7181533/07181554.pdf?arnumber=7181554
29/01/2018,Smart reconfiguration in smart distribution grids by using of the new optimization method: big bang-big crunch,"Farajzadeh,Mehran, Meyabadi,Vavid Maleki, ",2015,IEEE - Crossref,http://xplorestaging.ieee.org/ielx7/7081792/7090833/07150701.pdf?arnumber=7150701
29/01/2018,Bridging between universAAL and ECHONET for smart home environment,"Tan,Yasuo, Li,Cheng, Dat Nguyen,Minh, Lim,Sin Yee, Lim,Yuto, ",2017,IEEE - Crossref,http://xplorestaging.ieee.org/ielx7/7983000/7992653/07992884.pdf?arnumber=7992884
29/01/2018,Efficient and Autonomous Energy Management Techniques for the Future Smart Homes,"Gao,Feifei, Mahmood,Anzar, Sidhu,Guftaar Ahmad Sardar, Basit,Abdul, ",2015,IEEE - Crossref,http://xplorestaging.ieee.org/ielx7/5165411/5446437/7352370.pdf?arnumber=7352370
29/01/2018,On-Chip Activity Recognition in a Smart Home,"Konig,Matthias, Sprute,Dennis, ",2016,IEEE - Crossref,http://xplorestaging.ieee.org/ielx7/7717031/7723453/07723476.pdf?arnumber=7723476
29/01/2018,Human computing: A new smart technology for learning and life,"Russ,Steve, ",2016,IEEE - Crossref,http://xplorestaging.ieee.org/ielx7/7435826/7440466/7440472.pdf?arnumber=7440472
29/01/2018,Smart cevices for smart environments: Device-free passive detection in real environments,"Youssef,Moustafa, Moussa,May, ",2009,IEEE - Crossref,http://xplorestaging.ieee.org/ielx5/4906860/4912739/04912826.pdf?arnumber=4912826
29/01/2018,The Method of Location Error Detection and Correcting in Smart Home Environments,"Chung,Kwangsue, Youn,Hee, Song,Byunghun, Lee,Hyung, ",2006,IEEE - Crossref,http://xplorestaging.ieee.org/ielx5/4021046/4021174/04021248.pdf?arnumber=4021248
29/01/2018,User interaction interface for Energy Management in Smart Homes,"Schmeck,Hartmut, Kellerer,Anna, Becker,Birger, ",2012,IEEE - Crossref,http://xplorestaging.ieee.org/ielx5/6170475/6175527/06175616.pdf?arnumber=6175616
29/01/2018,Smart Meter with non-intrusive load monitoring for use in Smart Homes,"Bier,Thomas, Klein,Philipp, Benyoucef,Dirk, ",2011,IEEE - Crossref,http://xplorestaging.ieee.org/ielx5/5765872/5771653/05771810.pdf?arnumber=5771810
29/01/2018,Smart Expense Management Model for Smart Homes,"Tripathi,Jyoti, Malhotra,Richa, Yadav,Sumit, ",2016,IEEE - Crossref,http://xplorestaging.ieee.org/ielx7/7505515/7514538/07514640.pdf?arnumber=7514640
29/01/2018,Smart cities and smart homes: From realization to reality,"Dhande,Rashi, Mehrotra,Siddharth, ",2016,IEEE - Crossref,http://xplorestaging.ieee.org/ielx7/7370053/7380415/07380652.pdf?arnumber=7380652
29/01/2018,Review of communication technologies for smart homes/building applications,"Rahman,S., Pipattanasomporn,M., Kuzlu,M., ",2016,IEEE - Crossref,http://xplorestaging.ieee.org/ielx7/7364573/7386954/07437036.pdf?arnumber=7437036
29/01/2018,The potential of smart home sensors in forecasting household electricity demand,"Jacobsen,Hans-Arno, Struker,Jens, Goebel,Christoph, Ziekow,Holger, ",2014,IEEE - Crossref,http://xplorestaging.ieee.org/ielx7/6678912/6687920/06687962.pdf?arnumber=6687962
29/01/2018,Weather forecast based scheduling for demand response optimization in smart grids,"Druzbikova,Katerina, Herman,Jan, Tomsik,Jan, Buhnova,Barbora, Kadlec,Miroslav, ",2017,IEEE - Crossref,http://xplorestaging.ieee.org/ielx7/7963867/7973339/07973867.pdf?arnumber=7973867
29/01/2018,Surveillance Issues in a Smart Home Environment,"Bourbakis,N., Patrick,R., Tsitsoulis,A., ",2013,IEEE - Crossref,http://xplorestaging.ieee.org/ielx7/6493540/6495612/06495628.pdf?arnumber=6495628
29/01/2018,Feature Space Analysis for Human Activity Recognition in Smart Environments,"Cohn,Anthony G., Hogg,David C., Chinellato,Eris, ",2016,IEEE - Crossref,http://xplorestaging.ieee.org/ielx7/7717031/7723453/07723496.pdf?arnumber=7723496
29/01/2018,A human-system interaction framework and algorithm for UbiComp-based smart home,"Fu,Li-Chen, Wu,Chao-Lin, ",2008,IEEE - Crossref,http://xplorestaging.ieee.org/ielx5/4569859/4581395/04581444.pdf?arnumber=4581444
29/01/2018,Smart home user's behavior prediction,"Platonov,Ivan, Melezhik,Alexey, Vavilov,Dmitry, ",2014,IEEE - Crossref,http://xplorestaging.ieee.org/ielx7/6697948/6697949/06697984.pdf?arnumber=6697984
29/01/2018,Healthcare application of Smart Home user's behavior prediction,"Platonov,Ivan, Melezhik,Alexey, Vavilov,Dmitry, ",2014,IEEE - Crossref,http://xplorestaging.ieee.org/ielx7/6761345/6775879/06776025.pdf?arnumber=6776025
29/01/2018,User behavior prediction in the “offline” smart home solutions,"Anisimov,Alexander, Platonov,Ivan, Vavilov,Dmitry, Milykh,Valery, ",2016,IEEE - Crossref,http://xplorestaging.ieee.org/ielx7/7505573/7513633/07513646.pdf?arnumber=7513646
29/01/2018,A nimble decompression algorithm for ZigBee firmware update in smart home environment,"Yang,Kun, Feng,Tuo, ",2017,IEEE - Crossref,http://xplorestaging.ieee.org/ielx7/7976073/7983067/07983199.pdf?arnumber=7983199
29/01/2018,Fuzzy logic based algorithm for Context Awareness in IoT for Smart home environment,"Champaneria,Tushar A., Patel,Arpit, ",2017,IEEE - Crossref,http://xplorestaging.ieee.org/ielx7/7838019/7847944/07848168.pdf?arnumber=7848168
29/01/2018,Human activity recognition in pervasive single resident smart homes: State of art,"Feham,Mohamed, Bouchachia,Abdelhamid, Benmansour,Asma, ",2015,IEEE - Crossref,http://xplorestaging.ieee.org/ielx7/7226732/7244951/07244997.pdf?arnumber=7244997
29/01/2018,Interaction Design Issues in Smart Home Environments,"Fujinami,Kaori, ",2010,IEEE - Crossref,http://xplorestaging.ieee.org/ielx5/5482537/5482630/05482711.pdf?arnumber=5482711
29/01/2018,Energy saving in smart homes based on consumer behavior: A case study,"Rodriguez,Miguel, Zanatta,Danilo, Witschel,Hans-Friedrich, Wache,Holger, Zehnder,Michael, ",2015,IEEE - Crossref,http://xplorestaging.ieee.org/ielx7/7347908/7366145/07366231.pdf?arnumber=7366231
29/01/2018,SMART WINDORO V1.0: Smart window cleaning robot,Not available,2013,IEEE - Crossref,http://xplorestaging.ieee.org/ielx7/6449390/6462915/06462948.pdf?arnumber=6462948
29/01/2018,Short-term load forecasting model based on smart metering data: Daily energy prediction using physically based component model structure,"Koponen,Pekka, ",2013,IEEE - Crossref,http://xplorestaging.ieee.org/ielx7/6624147/6642357/06642386.pdf?arnumber=6642386
29/01/2018,Load Forecasting via Diversified State Prediction in Multi-Area Power Networks,"Tajer,Ali, ",2016,IEEE - Crossref,http://xplorestaging.ieee.org/ielx7/5165411/8075182/07432050.pdf?arnumber=7432050
29/01/2018,SOnAr: Smart Ontology activity recognition framework to fulfill semantic web in smart homes,"Keyvanpour,Mohammad Reza, Zall,Raziyeh, Zolfaghari,Samaneh, ",2016,IEEE - Crossref,http://xplorestaging.ieee.org/ielx7/7495194/7498435/07498458.pdf?arnumber=7498458
29/01/2018,Resident activity recognition in smart homes by using artificial neural networks,"Cetin,Aydin, Polat,Huseyin, Mehr,Homay Danaei, ",2016,IEEE - Crossref,http://xplorestaging.ieee.org/ielx7/7491917/7492414/07492428.pdf?arnumber=7492428
29/01/2018,Using distance protection in smart grid environment,"Kauhaniemi,Kimmo, Voima,Sampo, ",2015,IEEE - Crossref,http://xplorestaging.ieee.org/ielx7/7001799/7028730/07028904.pdf?arnumber=7028904
29/01/2018,From smart grids to smart city,"Curiale,Mauro, ",2015,IEEE - Crossref,http://xplorestaging.ieee.org/ielx7/7259600/7274273/07274280.pdf?arnumber=7274280
29/01/2018,Guest Editorial: Special Section on Analytics for Energy Forecasting with Applications to Smart Grid,"Fan,Shu, Hong,Tao, ",2014,IEEE - Crossref,http://xplorestaging.ieee.org/ielx7/5165411/6693741/06693792.pdf?arnumber=6693792
29/01/2018,A Sparse Coding Approach to Household Electricity Demand Forecasting in Smart Grids,"Ho,Tin Kam, Mirowski,Piotr, Yu,Chun-Nam, ",2016,IEEE - Crossref,http://xplorestaging.ieee.org/ielx7/5165411/5446437/7390295.pdf?arnumber=7390295
29/01/2018,Electricity Price and Demand Forecasting in Smart Grids,"Rosehart,William D., Zareipour,Hamidreza, Motamedi,Amir, ",2012,IEEE - Crossref,http://xplorestaging.ieee.org/ielx5/5165411/6204228/06204245.pdf?arnumber=6204245
29/01/2018,Toward a Smart Home Environment for Elder People Based on Situation Analysis,"Yu,Zhiwen, Wang,Haipeng, Zhang,Xing, ",2010,IEEE - Crossref,http://xplorestaging.ieee.org/ielx5/5666992/5667097/05667099.pdf?arnumber=5667099
29/01/2018,Probabilistic framework for person tracking on embedded distributed smart cameras,"Bobda,Christophe, Zarezadeh,Ali Akbar, ",2011,IEEE - Crossref,http://xplorestaging.ieee.org/ielx5/6030109/6042896/06042934.pdf?arnumber=6042934
29/01/2018,Smart backpack for visually impaired person,"Shin,Byeong-Seok, Lee,Sang-Chul, Kim,Kyeongyul, Lee,Jin-hee, ",2013,IEEE - Crossref,http://xplorestaging.ieee.org/ielx7/6578013/6588046/06588057.pdf?arnumber=6588057
29/01/2018,Towards behaviour inference in smart environments,"Aguiar,Rui, Gomes,Diogo, Antunes,Mario, ",2013,IEEE - Crossref,http://xplorestaging.ieee.org/ielx7/6560498/6566313/06566324.pdf?arnumber=6566324
29/01/2018,Intelligent Mobile Cloud Education: Smart Anytime-Anywhere Learning for the Next Generation Campus Environment,"Ng,Jason W.P., Wang,Minjuan, ",2012,IEEE - Crossref,http://xplorestaging.ieee.org/ielx5/6257545/6258493/06258516.pdf?arnumber=6258516
29/01/2018,Smart Home Technologies: Uses and Abuses,"Tercero,Ricardo, Sanchez,Antonio, ",2011,IEEE - Crossref,http://xplorestaging.ieee.org/ielx5/5696800/5699151/05699177.pdf?arnumber=5699177
29/01/2018,Knowledge lifecycle and smart cities learning position paper for DUBAI 2020: Smart city learning,"Salerno,Saverio, ",2015,IEEE - Crossref,http://xplorestaging.ieee.org/ielx7/7000014/7009187/07009227.pdf?arnumber=7009227
29/01/2018,Innovative electromagnetic dynamic fault current limiter operating at ambient temperature for smart grids,"Shah,Tushar Pritamlal, Deo,Prafulla Rajabhau, ",2010,IEEE - Crossref,http://xplorestaging.ieee.org/ielx5/5428221/5434721/05434734.pdf?arnumber=5434734
29/01/2018,An Activity-Embedding Approach for Next-Activity Prediction in a Multi-User Smart Space,"Lee,Younghee, Lee,Minseok, An,Jihoon, Kim,Younggi, ",2017,IEEE - Crossref,http://xplorestaging.ieee.org/ielx7/7943263/7946954/07946985.pdf?arnumber=7946985
29/01/2018,Infrastructure and forecasting models for integrating Natural Gas Grid within smart grids,"Ayoub,Nasser M., Gabbar,Hossam A., ",2013,IEEE - Crossref,http://xplorestaging.ieee.org/ielx7/6450792/6463951/06463972.pdf?arnumber=6463972
29/01/2018,Component decomposition to improve precision of short-term wind speed forecasting,"Li,Hui, ",2017,IEEE - Crossref,http://xplorestaging.ieee.org/ielx7/8027285/8038534/08038563.pdf?arnumber=8038563
29/01/2018,Temperature Scenario Generation for Probabilistic Load Forecasting,"Hong,Tao, Xie,Jingrui, ",2016,IEEE - Crossref,http://xplorestaging.ieee.org/ielx7/5165411/5446437/07529083.pdf?arnumber=7529083
29/01/2018,Optimal Residential Load Control With Price Prediction in Real-Time Electricity Pricing Environments,"Leon-Garcia,Alberto, Mohsenian-Rad,Amir-Hamed, ",2010,IEEE - Crossref,http://xplorestaging.ieee.org/ielx5/5165411/5552162/05540263.pdf?arnumber=5540263
29/01/2018,Thermal behaviour of low voltage cables in smart grid &#x2014; Related environments,"Poutre,Han La, Bloemhof,Gabriel, De Jong,Erik, Honing,Nicolas, ",2015,IEEE - Crossref,http://xplorestaging.ieee.org/ielx7/7001799/7028730/07028736.pdf?arnumber=7028736
