searched,title,authors,published,database,source
12/02/2018,The DIsgust-RelaTed-Images (DIRTI) database: Validation of a novel standardized set of disgust pictures.,Haberkamp A,2017,PubMed,https://www.ncbi.nlm.nih.gov/pubmed/27914317
12/02/2018,"The contribution of response conflict, multisensory integration, and body-mediated attention to the crossmodal congruency effect.",Marini F,2017,PubMed,https://www.ncbi.nlm.nih.gov/pubmed/27913817
12/02/2018,Influence of attention alternation on movement-related cortical potentials in healthy individuals and stroke patients.,Aliakbaryhosseinabadi S,2017,PubMed,https://www.ncbi.nlm.nih.gov/pubmed/27912170
12/02/2018,The effect of a third party observer and trait anxiety on neuropsychological performance: the Attentional Control Theory (ACT) perspective.,Rezaei F,2017,PubMed,https://www.ncbi.nlm.nih.gov/pubmed/27911221
12/02/2018,Infant Attention Is Dynamically Modulated With Changing Arousal Levels.,de Barbaro K,2017,PubMed,https://www.ncbi.nlm.nih.gov/pubmed/27910994
12/02/2018,Beyond eye gaze: What else can eyetracking reveal about cognition and cognitive development?,Eckstein MK,2017,PubMed,https://www.ncbi.nlm.nih.gov/pubmed/27908561
12/02/2018,Do Elite and Amateur Soccer Players Outperform Non-Athletes on Neurocognitive Functioning? A Study Among 8-12 Year Old Children.,Verburgh L,2016,PubMed,https://www.ncbi.nlm.nih.gov/pubmed/27906965
12/02/2018,Pavlovian reward learning underlies value driven attentional capture.,Bucker B,2017,PubMed,https://www.ncbi.nlm.nih.gov/pubmed/27905069
12/02/2018,"Predicting ""When"" in Discourse Engages the Human Dorsal Auditory Stream: An fMRI Study Using Naturalistic Stories.",Kandylaki KD,2016,PubMed,https://www.ncbi.nlm.nih.gov/pubmed/27903727
12/02/2018,Hippocampal Damage Increases Deontological Responses during Moral Decision Making.,McCormick C,2016,PubMed,https://www.ncbi.nlm.nih.gov/pubmed/27903725
12/02/2018,Association of Irritability and Anxiety With the Neural Mechanisms of Implicit Face Emotion Processing in Youths With Psychopathology.,Stoddard J,2017,PubMed,https://www.ncbi.nlm.nih.gov/pubmed/27902832
12/02/2018,Spontaneous eyeblinks during breaking continuous flash suppression are associated with increased detection times.,Van Opstal F,2016,PubMed,https://www.ncbi.nlm.nih.gov/pubmed/27902828
12/02/2018,Working Memory Capacity and Fluid Intelligence: Maintenance and Disengagement.,Shipstead Z,2016,PubMed,https://www.ncbi.nlm.nih.gov/pubmed/27899724
12/02/2018,Electrophysiological evidence for attentional capture by irrelevant angry facial expressions: Naturalistic faces.,Burra N,2017,PubMed,https://www.ncbi.nlm.nih.gov/pubmed/27899310
12/02/2018,Training the elderly in pedestrian safety: Transfer effect between two virtual reality simulation devices.,Maillot P,2017,PubMed,https://www.ncbi.nlm.nih.gov/pubmed/27898369
12/02/2018,Detection costs and contingent attentional capture.,Schönhammer JG,2017,PubMed,https://www.ncbi.nlm.nih.gov/pubmed/27896707
12/02/2018,Association Between Poorer Cognitive Function and Reduced Objectively Monitored Medication Adherence in Patients With Heart Failure.,Dolansky MA,2016,PubMed,https://www.ncbi.nlm.nih.gov/pubmed/27895069
12/02/2018,Functional neurological symptoms modulate processing of emotionally salient stimuli.,Fiess J,2016,PubMed,https://www.ncbi.nlm.nih.gov/pubmed/27894464
12/02/2018,An attention and interpretation bias for illness-specific information in chronic fatigue syndrome.,Hughes AM,2017,PubMed,https://www.ncbi.nlm.nih.gov/pubmed/27894380
12/02/2018,Using a divided-attention stepping accuracy task to improve balance and functional outcomes in an individual with incomplete spinal cord injury: A case report.,Leach SJ,2017,PubMed,https://www.ncbi.nlm.nih.gov/pubmed/27892796
12/02/2018,Primary or secondary tasks? Dual-task interference between cyclist hazard perception and cadence control using cross-modal sensory aids with rider assistance bike computers.,Yang CY,2017,PubMed,https://www.ncbi.nlm.nih.gov/pubmed/27890161
12/02/2018,Assessment of serum level of corticotropin-releasing factor in primary nocturnal enuresis.,Motawie AA,2017,PubMed,https://www.ncbi.nlm.nih.gov/pubmed/27887910
12/02/2018,Complex regional pain syndrome associated with hyperattention rather than neglect for the healthy side: A comprehensive case study.,Christophe L,2016,PubMed,https://www.ncbi.nlm.nih.gov/pubmed/27887906
12/02/2018,Quantifying the dynamic of OSA brain using multifractal formalism: A novel measure for sleep fragmentation.,Raiesdana S,2017,PubMed,https://www.ncbi.nlm.nih.gov/pubmed/27886023
12/02/2018,Attentive Motion Discrimination Recruits an Area in Inferotemporal Cortex.,Stemmann H,2016,PubMed,https://www.ncbi.nlm.nih.gov/pubmed/27881778
12/02/2018,Visual attention is available at a task-relevant location rapidly after a saccade.,Yao T,2016,PubMed,https://www.ncbi.nlm.nih.gov/pubmed/27879201
12/02/2018,Capturing Dynamics of Biased Attention: Are New Attention Variability Measures the Way Forward?,Kruijt AW,2016,PubMed,https://www.ncbi.nlm.nih.gov/pubmed/27875536
12/02/2018,"Hypoactive Sexual Desire Disorder: A Review of Epidemiology, Biopsychology, Diagnosis, and Treatment.",Parish SJ,2016,PubMed,https://www.ncbi.nlm.nih.gov/pubmed/27872021
12/02/2018,"An experimental study of adolescent sleep restriction during a simulated school week: changes in phase, sleep staging, performance and sleepiness.",Agostini A,2017,PubMed,https://www.ncbi.nlm.nih.gov/pubmed/27868260
12/02/2018,Berlyne Revisited: Evidence for the Multifaceted Nature of Hedonic Tone in the Appreciation of Paintings and Music.,Marin MM,2016,PubMed,https://www.ncbi.nlm.nih.gov/pubmed/27867350
12/02/2018,Attentional Differences in a Driving Hazard Perception Task in Adults with Autism Spectrum Disorders.,Sheppard E,2017,PubMed,https://www.ncbi.nlm.nih.gov/pubmed/27866348
12/02/2018,Attention capture without awareness in a non-spatial selection task.,Oriet C,2017,PubMed,https://www.ncbi.nlm.nih.gov/pubmed/27866004
12/02/2018,Attention to Physical Activity-Equivalent Calorie Information on Nutrition Facts Labels: An Eye-Tracking Investigation.,Wolfson JA,2017,PubMed,https://www.ncbi.nlm.nih.gov/pubmed/27865642
12/02/2018,Apnea-hypopnea index prediction through an assessment of autonomic influence on heart rate in wakefulness.,Jung DW,2017,PubMed,https://www.ncbi.nlm.nih.gov/pubmed/27864041
12/02/2018,"Reductions in cortical alpha activity, enhancements in neural responses and impaired gap detection caused by sodium salicylate in awake guinea pigs.",Berger JI,2017,PubMed,https://www.ncbi.nlm.nih.gov/pubmed/27862478
12/02/2018,Acute exercise has a general facilitative effect on cognitive function: A combined ERP temporal dynamics and BDNF study.,Chang YK,2017,PubMed,https://www.ncbi.nlm.nih.gov/pubmed/27861961
12/02/2018,Neural correlates of explicit and implicit emotion processing in relation to treatment response in pediatric anxiety.,Burkhouse KL,2017,PubMed,https://www.ncbi.nlm.nih.gov/pubmed/27861879
12/02/2018,Saving mental effort to maintain physical effort: a shift of activity within the prefrontal cortex in anticipation of prolonged exercise.,Radel R,2017,PubMed,https://www.ncbi.nlm.nih.gov/pubmed/27858329
12/02/2018,How I do it: Awake craniotomy.,Hill CS,2017,PubMed,https://www.ncbi.nlm.nih.gov/pubmed/27858231
12/02/2018,Who Are Gynandromorphophilic Men? An Internet Survey of Men with Sexual Interest in Transgender Women.,Rosenthal AM,2017,PubMed,https://www.ncbi.nlm.nih.gov/pubmed/27858199
12/02/2018,Mechanisms of Diminished Attention to Eyes in Autism.,Moriuchi JM,2017,PubMed,https://www.ncbi.nlm.nih.gov/pubmed/27855484
12/02/2018,Reappraisal and Distraction Emotion Regulation Strategies Are Associated with Distinct Patterns of Visual Attention and Differing Levels of Cognitive Demand.,Strauss GP,2016,PubMed,https://www.ncbi.nlm.nih.gov/pubmed/27855175
12/02/2018,Parental management of peers and autonomic nervous system reactivity in predicting adolescent peer relationships.,Tu KM,2017,PubMed,https://www.ncbi.nlm.nih.gov/pubmed/27854467
12/02/2018,The capacity to detect synchronous audiovisual events is severely limited: Evidence from mixture modeling.,Olivers CN,2016,PubMed,https://www.ncbi.nlm.nih.gov/pubmed/27854458
12/02/2018,Stimulus recognition occurs under high perceptual load: Evidence from correlated flankers.,Cosman JD,2016,PubMed,https://www.ncbi.nlm.nih.gov/pubmed/27854456
12/02/2018,Much ado about nothing: Capturing attention toward locations without new perceptual events.,Hilchey MD,2016,PubMed,https://www.ncbi.nlm.nih.gov/pubmed/27854455
12/02/2018,Goal Directed Worry Rules Are Associated with Distinct Patterns of Amygdala Functional Connectivity and Vagal Modulation during Perseverative Cognition.,Meeten F,2016,PubMed,https://www.ncbi.nlm.nih.gov/pubmed/27853428
12/02/2018,The Emergence of Selective Attention through Probabilistic Associations between Stimuli and Actions.,Simione L,2016,PubMed,https://www.ncbi.nlm.nih.gov/pubmed/27846301
12/02/2018,Age-related differences in brain network activation and co-activation during multiple object tracking.,Dørum ES,2016,PubMed,https://www.ncbi.nlm.nih.gov/pubmed/27843692
12/02/2018,Toward a More Evidence-Based Nosology and Nomenclature for Female Sexual Dysfunctions-Part II.,Parish SJ,2016,PubMed,https://www.ncbi.nlm.nih.gov/pubmed/27843072
12/02/2018,The functional consequences of social distraction: Attention and memory for complex scenes.,Doherty BR,2017,PubMed,https://www.ncbi.nlm.nih.gov/pubmed/27842274
12/02/2018,Dependent measure and time constraints modulate the competition between conflicting feature-based and rule-based generalization processes.,Cobos PL,2017,PubMed,https://www.ncbi.nlm.nih.gov/pubmed/27841447
12/02/2018,Food color is in the eye of the beholder: the role of human trichromatic vision in food evaluation.,Foroni F,2016,PubMed,https://www.ncbi.nlm.nih.gov/pubmed/27841327
12/02/2018,Towards psychologically adaptive brain-computer interfaces.,Myrden A,2016,PubMed,https://www.ncbi.nlm.nih.gov/pubmed/27841163
12/02/2018,Modifiable Arousal in Attention-Deficit/Hyperactivity Disorder and Its Etiological Association With Fluctuating Reaction Times.,James SN,2016,PubMed,https://www.ncbi.nlm.nih.gov/pubmed/27840854
12/02/2018,A Brief Period of Postnatal Visual Deprivation Alters the Balance between Auditory and Visual Attention.,de Heering A,2016,PubMed,https://www.ncbi.nlm.nih.gov/pubmed/27839972
12/02/2018,Individual differences in structural and functional connectivity predict speed of emotion discrimination.,Marstaller L,2016,PubMed,https://www.ncbi.nlm.nih.gov/pubmed/27838543
12/02/2018,The effects of adaptive working memory training and mindfulness meditation training on processing efficiency and worry in high worriers.,Course-Choi J,2017,PubMed,https://www.ncbi.nlm.nih.gov/pubmed/27838273
12/02/2018,The effect of an acute bout of exercise on executive function among individuals with schizophrenia.,Subramaniapillai M,2016,PubMed,https://www.ncbi.nlm.nih.gov/pubmed/27838019
12/02/2018,"QRFP-Deficient Mice Are Hypophagic, Lean, Hypoactive and Exhibit Increased Anxiety-Like Behavior.",Okamoto K,2016,PubMed,https://www.ncbi.nlm.nih.gov/pubmed/27835635
12/02/2018,Postural threat influences vestibular-evoked muscular responses.,Lim SB,2017,PubMed,https://www.ncbi.nlm.nih.gov/pubmed/27832609
12/02/2018,Visual search for object categories is predicted by the representational architecture of high-level visual cortex.,Cohen MA,2017,PubMed,https://www.ncbi.nlm.nih.gov/pubmed/27832600
12/02/2018,Behavioral inhibition and activation systems in traumatic brain injury.,Wong CG,2016,PubMed,https://www.ncbi.nlm.nih.gov/pubmed/27831731
12/02/2018,"Body posture differentially impacts on visual attention towards tool, graspable, and non-graspable objects.",Ambrosini E,2017,PubMed,https://www.ncbi.nlm.nih.gov/pubmed/27831721
12/02/2018,Altered Brain Activity in Unipolar Depression Revisited: Meta-analyses of Neuroimaging Studies.,Müller VI,2017,PubMed,https://www.ncbi.nlm.nih.gov/pubmed/27829086
12/02/2018,Kinesthetic motor imagery training modulates frontal midline theta during imagination of a dart throw.,Weber E,2016,PubMed,https://www.ncbi.nlm.nih.gov/pubmed/27825901
12/02/2018,Evaluating Varied Label Designs for Use with Medical Devices: Optimized Labels Outperform Existing Labels in the Correct Selection of Devices and Time to Select.,Bix L,2016,PubMed,https://www.ncbi.nlm.nih.gov/pubmed/27824873
12/02/2018,Effect of mental fatigue on nonattention: a visual mismatch negativity study.,Li J,2016,PubMed,https://www.ncbi.nlm.nih.gov/pubmed/27824729
12/02/2018,Exercise versus Nonexercise Activity: E-diaries Unravel Distinct Effects on Mood.,Reichert M,2017,PubMed,https://www.ncbi.nlm.nih.gov/pubmed/27824691
12/02/2018,Longitudinal relationships of periodic limb movements during sleep and incident atrial fibrillation.,May AM,2016,PubMed,https://www.ncbi.nlm.nih.gov/pubmed/27823721
12/02/2018,A Review of Hallucinogen Persisting Perception Disorder (HPPD) and an Exploratory Study of Subjects Claiming Symptoms of HPPD.,Halpern JH,2016,PubMed,https://www.ncbi.nlm.nih.gov/pubmed/27822679
12/02/2018,Cross-Modal Attention Effects in the Vestibular Cortex during Attentive Tracking of Moving Objects.,Frank SM,2016,PubMed,https://www.ncbi.nlm.nih.gov/pubmed/27821579
12/02/2018,An attentional bias for thin bodies and its relation to body dissatisfaction.,Joseph C,2016,PubMed,https://www.ncbi.nlm.nih.gov/pubmed/27821295
12/02/2018,Light Effects on Behavioural Performance Depend on the Individual State of Vigilance.,Correa Á,2016,PubMed,https://www.ncbi.nlm.nih.gov/pubmed/27820822
12/02/2018,Neuropsychological test validity in Veterans presenting with subjective complaints of 'very severe' cognitive symptoms following mild traumatic brain injury.,Spencer RJ,2017,PubMed,https://www.ncbi.nlm.nih.gov/pubmed/27819490
12/02/2018,Information foraging for perceptual decisions.,Ludwig CJ,2017,PubMed,https://www.ncbi.nlm.nih.gov/pubmed/27819455
12/02/2018,Visual perceptual load reduces auditory detection in typically developing individuals but not in individuals with autism spectrum disorders.,Tillmann J,2017,PubMed,https://www.ncbi.nlm.nih.gov/pubmed/27819451
12/02/2018,Brief mindfulness meditation training reduces mind wandering: The critical role of acceptance.,Rahl HA,2017,PubMed,https://www.ncbi.nlm.nih.gov/pubmed/27819445
12/02/2018,Was that a threat? Attentional biases by signals of threat.,Preciado D,2017,PubMed,https://www.ncbi.nlm.nih.gov/pubmed/27819442
12/02/2018,Rank Determination of Mental Functions by 1D Wavelets and Partial Correlation.,Karaca Y,2017,PubMed,https://www.ncbi.nlm.nih.gov/pubmed/27817130
12/02/2018,Pupillary response indexes the metrical hierarchy of unattended rhythmic violations.,Damsma A,2017,PubMed,https://www.ncbi.nlm.nih.gov/pubmed/27816784
12/02/2018,Default mode network activation and Transcendental Meditation practice: Focused Attention or Automatic Self-transcending?,Travis F,2017,PubMed,https://www.ncbi.nlm.nih.gov/pubmed/27816783
12/02/2018,Impairment of the executive attention network in premenopausal women with hormone receptor-positive breast cancer treated with tamoxifen.,Chen X,2017,PubMed,https://www.ncbi.nlm.nih.gov/pubmed/27815995
12/02/2018,"Phenotypes in obstructive sleep apnea: A definition, examples and evolution of approaches.",Zinchuk AV,2017,PubMed,https://www.ncbi.nlm.nih.gov/pubmed/27815038
12/02/2018,Mapping preserved real-world cognition in severely brain-injured patients.,Sinai L,2017,PubMed,https://www.ncbi.nlm.nih.gov/pubmed/27814648
12/02/2018,Is semantic activation from print capacity limited? Evidence from the psychological refractory period paradigm.,Besner D,2017,PubMed,https://www.ncbi.nlm.nih.gov/pubmed/27812959
12/02/2018,Deconstructing the sensation of pain: The influence of cognitive processes on pain perception.,Wiech K,2016,PubMed,https://www.ncbi.nlm.nih.gov/pubmed/27811269
12/02/2018,The psychophysiological mechanisms of alexithymia in autism spectrum disorder.,Gaigg SB,2016,PubMed,https://www.ncbi.nlm.nih.gov/pubmed/27811193
12/02/2018,Visual Prediction Error Spreads Across Object Features in Human Visual Cortex.,Jiang J,2016,PubMed,https://www.ncbi.nlm.nih.gov/pubmed/27810936
12/02/2018,Predictors of older drivers' involvement in rapid deceleration events.,Chevalier A,2017,PubMed,https://www.ncbi.nlm.nih.gov/pubmed/27810673
12/02/2018,Effects of secondary tasks on auditory detection and crossing thresholds in relation to approaching vehicle noises.,Davis SJ,2017,PubMed,https://www.ncbi.nlm.nih.gov/pubmed/27810670
12/02/2018,"Impact of sodium oxybate, modafinil, and combination treatment on excessive daytime sleepiness in patients who have narcolepsy with or without cataplexy.",Black J,2016,PubMed,https://www.ncbi.nlm.nih.gov/pubmed/27810187
12/02/2018,Altered sleep-wake patterns in blindness: a combined actigraphy and psychometric study.,Aubin S,2016,PubMed,https://www.ncbi.nlm.nih.gov/pubmed/27810175
12/02/2018,Playful activity post-learning improves training performance in Labrador Retriever dogs (Canis lupus familiaris).,Affenzeller N,2017,PubMed,https://www.ncbi.nlm.nih.gov/pubmed/27777045
12/02/2018,Influence of initial fixation position in scene viewing.,Rothkegel LO,2016,PubMed,https://www.ncbi.nlm.nih.gov/pubmed/27771330
12/02/2018,"Benefits of a hungry mind: When hungry, exposure to food facilitates proactive interference resolution.",Maran T,2017,PubMed,https://www.ncbi.nlm.nih.gov/pubmed/27769647
12/02/2018,Discrete states of attention during active visual fixation revealed by Markovian analysis of the time series of intrusive saccades.,Korda AI,2016,PubMed,https://www.ncbi.nlm.nih.gov/pubmed/27751962
12/02/2018,The role of test-retest reliability in measuring individual and group differences in executive functioning.,Paap KR,2016,PubMed,https://www.ncbi.nlm.nih.gov/pubmed/27720867
12/02/2018,Do disinhibited eaters pay increased attention to food cues?,Seage CH,2017,PubMed,https://www.ncbi.nlm.nih.gov/pubmed/27693488
12/02/2018,Efficacy of the attention control training program on reducing attentional bias in obese and overweight dieters.,Bazzaz MM,2017,PubMed,https://www.ncbi.nlm.nih.gov/pubmed/27570184
12/02/2018,A novel indirect method for capturing involuntary musical imagery under varying cognitive load.,Floridou GA,2017,PubMed,https://www.ncbi.nlm.nih.gov/pubmed/27557154
12/02/2018,"Combined Oral Contraceptives and Sexual Function in Women-a Double-Blind, Randomized, Placebo-Controlled Trial.",Zethraeus N,2016,PubMed,https://www.ncbi.nlm.nih.gov/pubmed/27525531
12/02/2018,A bait we cannot avoid: Food-induced motor distractibility.,Foroni F,2016,PubMed,https://www.ncbi.nlm.nih.gov/pubmed/26786416
12/02/2018,"Goal-directed attentional selection: Limitations from input variables, not imprecision.",Wyland HC,2017,PubMed,https://www.ncbi.nlm.nih.gov/pubmed/27808546
12/02/2018,Why do stimulants not work in typical depression?,Hegerl U,2017,PubMed,https://www.ncbi.nlm.nih.gov/pubmed/27807011
12/02/2018,Object selection costs in visual working memory: A diffusion model analysis of the focus of attention.,Sewell DK,2016,PubMed,https://www.ncbi.nlm.nih.gov/pubmed/27031324
12/02/2018,Protocol Design Challenges in the Detection of Awareness in Aware Subjects Using EEG Signals.,Henriques J,2016,PubMed,https://www.ncbi.nlm.nih.gov/pubmed/25488924
12/02/2018,Suppression of overt attentional capture by salient-but-irrelevant color singletons.,Gaspelin N,2017,PubMed,https://www.ncbi.nlm.nih.gov/pubmed/27804032
12/02/2018,Brain connectivity and neurological disorders after stroke.,Baldassarre A,2016,PubMed,https://www.ncbi.nlm.nih.gov/pubmed/27749394
12/02/2018,Social Pavlovian conditioning: Short- and long-term effects and the role of anxiety and depressive symptoms.,Wiggert N,2017,PubMed,https://www.ncbi.nlm.nih.gov/pubmed/27614767
12/02/2018,Towards an exposure-dependent model of post-traumatic stress: longitudinal course of post-traumatic stress symptomatology and functional impairment after the 2011 Oslo bombing.,Solberg Ø,2016,PubMed,https://www.ncbi.nlm.nih.gov/pubmed/27609412
12/02/2018,"Attentive processes, blood lactate and CrossFit&lt;sup&gt;®&lt;/sup&gt;.",Perciavalle V,2016,PubMed,https://www.ncbi.nlm.nih.gov/pubmed/27556548
12/02/2018,Influence of light zones on drivers' visual fixation characteristics and traffic safety in extra-long tunnels.,Yan Y,2017,PubMed,https://www.ncbi.nlm.nih.gov/pubmed/27294892
12/02/2018,Interstimulus Intervals and Sensory Modality Modulate the Impact of a Cognitive Task on Postural Control.,Polskaia N,2016,PubMed,https://www.ncbi.nlm.nih.gov/pubmed/27253424
12/02/2018,Pediatric Cancer Patients' Treatment-Related Distress and Longer-Term Anxiety: An Individual Differences Perspective.,Trentacosta CJ,2016,PubMed,https://www.ncbi.nlm.nih.gov/pubmed/27802258
12/02/2018,Children's Intrinsic Motivation to Provide Help Themselves After Accidentally Harming Others.,Hepach R,2017,PubMed,https://www.ncbi.nlm.nih.gov/pubmed/27800601
12/02/2018,Association of Dystrobrevin-Binding Protein 1 Polymorphisms with Sustained Attention and Set-Shifting in Schizophrenia Patients.,Bakanidze G,2016,PubMed,https://www.ncbi.nlm.nih.gov/pubmed/27798936
12/02/2018,Emergence Delirium in Pediatric Anesthesia.,Moore AD,2017,PubMed,https://www.ncbi.nlm.nih.gov/pubmed/27798810
12/02/2018,Prefrontal Activity and Connectivity with the Basal Ganglia during Performance of Complex Cognitive Tasks Is Associated with Apathy in Healthy Subjects.,Fazio L,2016,PubMed,https://www.ncbi.nlm.nih.gov/pubmed/27798669
12/02/2018,Age and Improved Attention Predict Work Attainment in Combined Compensatory Cognitive Training and Supported Employment for People With Severe Mental Illness.,Puig O,2016,PubMed,https://www.ncbi.nlm.nih.gov/pubmed/27798543
12/02/2018,"Cognitive predictors of a common multitasking ability: Contributions from working memory, attention control, and fluid intelligence.",Redick TS,2016,PubMed,https://www.ncbi.nlm.nih.gov/pubmed/27797557
12/02/2018,The influence of object similarity and orientation on object-based cueing.,Hein E,2017,PubMed,https://www.ncbi.nlm.nih.gov/pubmed/27797008
12/02/2018,Figural properties are prioritized for search under conditions of uncertainty: Setting boundary conditions on claims that figures automatically attract attention.,Peterson MA,2017,PubMed,https://www.ncbi.nlm.nih.gov/pubmed/27797006
12/02/2018,Reward processing in the value-driven attention network: reward signals tracking cue identity and location.,Anderson BA,2017,PubMed,https://www.ncbi.nlm.nih.gov/pubmed/27677944
12/02/2018,"Cognitive deficits after aneurysmal and angiographically negative subarachnoid hemorrhage: Memory, attention, executive functioning, and emotion recognition.",Buunk AM,2016,PubMed,https://www.ncbi.nlm.nih.gov/pubmed/27195987
12/02/2018,Testing the attentional scope model of rumination: An eye-tracking study using the moving window paradigm.,Fang L,2017,PubMed,https://www.ncbi.nlm.nih.gov/pubmed/27794448
12/02/2018,Resting-state brain networks revealed by granger causal connectivity in frogs.,Xue F,2016,PubMed,https://www.ncbi.nlm.nih.gov/pubmed/27530699
12/02/2018,Influence of Cartoon Media Characters on Children's Attention to and Preference for Food and Beverage Products.,Ogle AD,2017,PubMed,https://www.ncbi.nlm.nih.gov/pubmed/27793520
12/02/2018,Active suppression of salient-but-irrelevant stimuli does not underlie resistance to visual interference.,Barras C,2016,PubMed,https://www.ncbi.nlm.nih.gov/pubmed/27756581
12/02/2018,Direct gaze facilitates rapid orienting to faces: Evidence from express saccades and saccadic potentials.,Mares I,2016,PubMed,https://www.ncbi.nlm.nih.gov/pubmed/27756579
12/02/2018,Frontal EEG theta/beta ratio as an electrophysiological marker for attentional control and its test-retest reliability.,Angelidis A,2016,PubMed,https://www.ncbi.nlm.nih.gov/pubmed/27697551
12/02/2018,Random Item Generation Is Affected by Age.,Multani N,2016,PubMed,https://www.ncbi.nlm.nih.gov/pubmed/27681687
12/02/2018,Pain in the body. Altered interoception in chronic pain conditions: A systematic review.,Di Lernia D,2016,PubMed,https://www.ncbi.nlm.nih.gov/pubmed/27654341
12/02/2018,Modelling ADHD: A review of ADHD theories through their predictions for computational models of decision-making and reinforcement learning.,Ziegler S,2016,PubMed,https://www.ncbi.nlm.nih.gov/pubmed/27608958
12/02/2018,"Subjective memory complaints in patients with epilepsy: The role of depression, psychological distress, and attentional functions.",Grewe P,2016,PubMed,https://www.ncbi.nlm.nih.gov/pubmed/27568227
12/02/2018,"Proactive, but Not Reactive, Distractor Filtering Relies on Local Modulation of Alpha Oscillatory Activity.",Vissers ME,2016,PubMed,https://www.ncbi.nlm.nih.gov/pubmed/27458747
12/02/2018,Differential association of default mode network connectivity and rumination in healthy individuals and remitted MDD patients.,Lois G,2016,PubMed,https://www.ncbi.nlm.nih.gov/pubmed/27405616
12/02/2018,Is fear perception special? Evidence at the level of decision-making and subjective confidence.,Koizumi A,2016,PubMed,https://www.ncbi.nlm.nih.gov/pubmed/27405614
12/02/2018,How does reward compete with goal-directed and stimulus-driven shifts of attention?,Bourgeois A,2017,PubMed,https://www.ncbi.nlm.nih.gov/pubmed/26403682
12/02/2018,Differential impact of emotional task relevance on three indices of prioritised processing for fearful and angry facial expressions.,Engen HG,2017,PubMed,https://www.ncbi.nlm.nih.gov/pubmed/26371881
