searched,title,authors,published,database,source
12/02/2018,Hierarchical affective content analysis in arousal and valence dimensions,"Rui,Yong, Luo,Suhuai, Jin,Jesse S., He,Xiangjian, Xu,Changsheng, Xu,Min, ",2013,ScienceDirect,https://api.elsevier.com/content/article/pii/S0165168412002186
12/02/2018,Intensified emotion perception in depression: Differences in physiological arousal and subjective perceptions,"Oertel-Knöchel,Viola, Reif,Andreas, van Dick,Rolf, Trettin,Marco, Huthmacher,Ann-Caitlin, Ghirmai,Naddy, Hilke,Marietheres, Tarvainen,Mika P., Hagen,Marleen, Wenzler,Sofia, ",2017,ScienceDirect,https://api.elsevier.com/content/article/pii/S0165178116314779
12/02/2018,Opinion Paper: On the Diagnosis/Classification of Sexual Arousal Concerns in Women,"Stanton,Amelia M., Kilimnik,Chelsea D., Handy,Ariel B., Perelman,Michael A., Meston,Cindy M., Althof,Stanley E., ",2017,ScienceDirect,https://api.elsevier.com/content/article/pii/S1743609517313942
12/02/2018,Behavioural and physiological expression of arousal during decision-making in laying hens,"Nicol,C.J., Radford,A.N., Davies,A.C., ",2014,ScienceDirect,https://api.elsevier.com/content/article/pii/S0031938413003363
12/02/2018,Emotional clouds: Showing arousal and valence through the movement and darkness of digital cartoonish clouds,"Ibáñez,Jesús, ",2013,ScienceDirect,https://api.elsevier.com/content/article/pii/S1071581913000864
12/02/2018,Emotional arousal impairs association-memory: Roles of amygdala and hippocampus,"Sommer,Tobias, Caplan,Jeremy B., Fujiwara,Esther, Madan,Christopher R., ",2017,ScienceDirect,https://api.elsevier.com/content/article/pii/S1053811917303841
12/02/2018,Driving with music: Effects on arousal and performance,"Steg,Linda, Epstude,Kai, de Waard,Dick, Ünal,Ayça Berfu, ",2013,ScienceDirect,https://api.elsevier.com/content/article/pii/S136984781300079X
12/02/2018,Instructions to Rate Genital Vasocongestion Increases Genital and Self-Reported Sexual Arousal but not Coherence Between Genital and Self-Reported Sexual Arousal,"Graham,Cynthia, Roberts,Verena, Barela,James, Prause,Nicole, ",2013,ScienceDirect,https://api.elsevier.com/content/article/pii/S1743609515304641
12/02/2018,Cognitive consequences of individual differences in arousal asymmetry,"Holtgraves,Thomas, ",2013,ScienceDirect,https://api.elsevier.com/content/article/pii/S0278262613000821
12/02/2018,Chapter 4 Sexual arousal and response — the psychosomatic circle,"Bancroft,John, ",2009,ScienceDirect,https://api.elsevier.com/content/article/pii/B9780443051616000045
12/02/2018,Remembering under stress: Different roles of autonomic arousal and glucocorticoids in memory retrieval,"Schwabe,Lars, Ackermann,Karina, Schönfeld,Pia, ",2014,ScienceDirect,https://api.elsevier.com/content/article/pii/S0306453013003399
12/02/2018,Chemoreception and asphyxia-induced arousal,"Abbott,Stephen B.G., Guyenet,Patrice G., ",2013,ScienceDirect,https://api.elsevier.com/content/article/pii/S1569904813001067
12/02/2018,Embodiment of others’ hands elicits arousal responses similar to one’s own hands,"Berti,Anna, Gindri,Patrizia, Pia,Lorenzo, Fossataro,Carlotta, Fornia,Luca, Garbarini,Francesca, ",2014,ScienceDirect,https://api.elsevier.com/content/article/pii/S0960982214008495
12/02/2018,"Measuring the drinking experience of beer in real context situations. The impact of affects, senses, and cognition","Valentin,Dominique, Escalona-Buendía,Héctor B., Chollet,Sylvie, Gómez-Corona,Carlos, ",2017,ScienceDirect,https://api.elsevier.com/content/article/pii/S0950329317300861
12/02/2018,Prior perceptual processing enhances the effect of emotional arousal on the neural correlates of memory retrieval,"Cabeza,Roberto, LaBar,Kevin S., Ritchey,Maureen, Dew,Ilana T.Z., ",2014,ScienceDirect,https://api.elsevier.com/content/article/pii/S1074742713002682
12/02/2018,Sexual Arousal in Women with Provoked Vestibulodynia: The Application of Laser Doppler Imaging to Sexual Pain,"Chamberlain,Susan M., Pukall,Caroline F., Boyer,Stéphanie C., ",2013,ScienceDirect,https://api.elsevier.com/content/article/pii/S1743609515303222
12/02/2018,Dexmedetomidine pharmacokinetic–pharmacodynamic modelling in healthy volunteers: 1. Influence of arousal on bispectral index and sedation,"Struys,M.M.R.F., Vereecke,H.E.M., Absalom,A.R., Reyntjens,K.M.E.M., Eleveld,D.J., Hannivoort,L.N., Colin,P.J., ",2017,ScienceDirect,https://api.elsevier.com/content/article/pii/S0007091217332853
