searched,title,authors,published,database,source
29/01/2018,Towards a Unified Operational Value Index of Energy Storage in Smart Grid Environment,"Xie,Le, Thatte,Anupam A., ",2012,IEEE - Crossref,http://xplorestaging.ieee.org/ielx5/5165411/6275510/06191344.pdf?arnumber=6191344
29/01/2018,Demand-Side Bidding Strategy for Residential Energy Management in a Smart Grid Environment,"Wang,Lingfeng, Adika,Christopher O., ",2014,IEEE - Crossref,http://xplorestaging.ieee.org/ielx7/5165411/6839066/06839134.pdf?arnumber=6839134
29/01/2018,Active Participation of Demand Through a Secondary Ancillary Services Market in a Smart Grid Environment,"Rudnick,H., Martinez,V. J., ",2013,IEEE - Crossref,http://xplorestaging.ieee.org/ielx7/5165411/6670123/06646275.pdf?arnumber=6646275
29/01/2018,Hedging Against Uncertainty: A Tale of Internet Data Center Operations Under Smart Grid Environment,"Pang,Zhan, Xie,Le, Liu,Xue, Rao,Lei, ",2011,IEEE - Crossref,http://xplorestaging.ieee.org/ielx5/5165411/5993785/05967925.pdf?arnumber=5967925
29/01/2018,Stochastic energy and spinning reserve market with considering smart transmission switching action,"Aflaki,Kaveh, Haghifam,Mahmoud Reza, Aazami,Rahmat, ",2012,IEEE - Crossref,http://xplorestaging.ieee.org/ielx5/6170475/6175527/06175692.pdf?arnumber=6175692
29/01/2018,Modified Original Smart Cards and Smart Card Clone Countermeasures,"Soriente,Claudio, Santis,Alfredo De, ",2008,IEEE - Crossref,http://xplorestaging.ieee.org/ielx5/4415275/4415276/04415472.pdf?arnumber=4415472
29/01/2018,A smart campus integrated with smart grid,"Kaygusuz,Asim, Cetintas,Gulten, Ozupak,Yildirim, ",2017,IEEE - Crossref,http://xplorestaging.ieee.org/ielx7/8074810/8090153/08090275.pdf?arnumber=8090275
29/01/2018,Smart city application: Android based smart parking system,"Tuncer,Taner, Kilic,Talha, ",2017,IEEE - Crossref,http://xplorestaging.ieee.org/ielx7/8074810/8090153/08090284.pdf?arnumber=8090284
29/01/2018,Artificial intelligence based smart diagnosis of alzheimer's disease and mild cognitive impairment,"Alnowami,Majdi, Awais,Muhammad, Anwar,SyedMuhammad, Farooq,Ammara, ",2017,IEEE - Crossref,http://xplorestaging.ieee.org/ielx7/8064441/8090780/08090871.pdf?arnumber=8090871
29/01/2018,Resilient hybrid overlay model for smart grid: RHM for smart grid,"Dasgupta,Dipankar, Nutt,Victor, Kher,Shubhalaxmi, ",2013,IEEE - Crossref,http://xplorestaging.ieee.org/ielx7/6588697/6597196/06597205.pdf?arnumber=6597205
29/01/2018,Modernizing power grids with distributed intelligence and smart grid-ready instrumentation,"Piacentini,Roberto, ",2012,IEEE - Crossref,http://xplorestaging.ieee.org/ielx5/6170475/6175527/06175653.pdf?arnumber=6175653
29/01/2018,Smart grid energy fraud detection using artificial neural networks,"Eberle,William, Siraj,Ambareen, Ford,Vitaly, ",2015,IEEE - Crossref,http://xplorestaging.ieee.org/ielx7/6999012/7011539/07011557.pdf?arnumber=7011557
29/01/2018,A low cost smart metering system design for smart grid applications,"Kabalci,Ersan, Kabalci,Yasin, ",2017,IEEE - Crossref,http://xplorestaging.ieee.org/ielx7/7843798/7861062/07861078.pdf?arnumber=7861078
29/01/2018,Smart key generation for smart cities,"Chandrasekaran,K, Deepak,Ankit, Shravya,K S, ",2017,IEEE - Crossref,http://xplorestaging.ieee.org/ielx7/7966625/7977256/07977278.pdf?arnumber=7977278
29/01/2018,"Home, smart home","Hansen,Ellen, ",2010,IEEE - Crossref,http://xplorestaging.ieee.org/ielx5/6/5520601/05520626.pdf?arnumber=5520626
29/01/2018,Preference model assisted activity recognition learning in a smart home environment,"Kuo,Lun-Chia, Yeh,Yu-Jung, Fu,Li-Chen, Hsu,Kuo-Chung, Lu,Ching-Hu, Chen,Yi-Han, ",2009,IEEE - Crossref,http://xplorestaging.ieee.org/ielx5/5342790/5353884/05353937.pdf?arnumber=5353937
29/01/2018,Statistical Structure Learning to Ensure Data Integrity in Smart Grid,"Jonckheere,Edmond, Sedghi,Hanie, ",2015,IEEE - Crossref,http://xplorestaging.ieee.org/ielx7/5165411/7128463/07058419.pdf?arnumber=7058419
29/01/2018,Self-Learning Load Characteristic Models for Smart Appliances,"Burt,Graeme, Galloway,Stuart, Stephen,Bruce, ",2014,IEEE - Crossref,http://xplorestaging.ieee.org/ielx7/5165411/6894249/06862927.pdf?arnumber=6862927
29/01/2018,Using smart devices for system-level management and control in the smart grid: A reinforcement learning framework,"Kar,Soummya, Krogh,Bruce, Berges,Mario, Kara,Emre Can, ",2013,IEEE - Crossref,http://xplorestaging.ieee.org/ielx7/6479749/6485945/06485964.pdf?arnumber=6485964
29/01/2018,Personalization in Smart Homes for Disabled People,"Abdulrazak,Bessam, Giroux,Sylvain, Mokhtari,Mounir, Kadouche,Rachid, ",2009,IEEE - Crossref,http://xplorestaging.ieee.org/ielx5/4734038/4734155/04734247.pdf?arnumber=4734247
29/01/2018,Behavior-Rule Based Intrusion Detection Systems for Safety Critical Smart Grid Applications,"Chen,Ing-Ray, Mitchell,Robert, ",2013,IEEE - Crossref,http://xplorestaging.ieee.org/ielx7/5165411/6584008/06510000.pdf?arnumber=6510000
29/01/2018,IRAR: Smart Intention Recognition and Action Recommendation for Cyber-Physical Industry Environments,"Hauck,Christian, Poller,Peter, Bergweiler,Simon, Haupert,Jens, ",2014,IEEE - Crossref,http://xplorestaging.ieee.org/ielx7/6909333/6910409/06910437.pdf?arnumber=6910437
29/01/2018,Transactive control: A technique for widespread coordination of responsive Smart Grid assets,"Hammerstrom,D.J., Melton,R. B., ",2012,IEEE - Crossref,http://xplorestaging.ieee.org/ielx5/6170475/6175527/06175541.pdf?arnumber=6175541
29/01/2018,Management and coordination charging of smart park and V2G strategy based on Monte Carlo algorithm,"Joorabian,Mahmood, Ostadaghaee,Elahe, Aryanezhad,Majid, ",2015,IEEE - Crossref,http://xplorestaging.ieee.org/ielx7/7081792/7090833/07090887.pdf?arnumber=7090887
29/01/2018,ROCAS: A Robust Online Algorithm for Spatial Partitioning in Distributed Smart Camera Systems,"Hahner,Jorg, Hoffmann,Martin, ",2007,IEEE - Crossref,http://xplorestaging.ieee.org/ielx5/4357490/4357491/04357533.pdf?arnumber=4357533
29/01/2018,Smart grid reconfiguration using simple genetic algorithm and NSGA-II,"Deconinck,Geert, Chittur Ramaswamy,Parvathy, ",2013,IEEE - Crossref,http://xplorestaging.ieee.org/ielx7/6450175/6465601/06465615.pdf?arnumber=6465615
29/01/2018,New multi-criteria-based algorithm for islanding detection in smart grids,"Laaksonen,H., ",2013,IEEE - Crossref,http://xplorestaging.ieee.org/ielx7/6450175/6465601/06465661.pdf?arnumber=6465661
29/01/2018,Load shedding in smart grid: A reliable efficient Ad-Hoc broadcast algorithm for smart house,"Radman,G., Abdallah,M., Hassan,R., ",2012,IEEE - Crossref,http://xplorestaging.ieee.org/ielx5/6190856/6196883/06196919.pdf?arnumber=6196919
29/01/2018,Smart meter based non-intrusive appliance detection algorithm for local real time feedback purposes,"Kulatunga,N. Athula., Kuruppu,S.S., ",2012,IEEE - Crossref,http://xplorestaging.ieee.org/ielx5/6294165/6303088/06303108.pdf?arnumber=6303108
29/01/2018,Smart charging of plug-in electric vehicle using gravitational search algorithm,"Gharehpetian,G. B., Hajilu,N., Abedi,M., Poursistani,M. R., ",2015,IEEE - Crossref,http://xplorestaging.ieee.org/ielx7/7081792/7090833/07090884.pdf?arnumber=7090884
29/01/2018,A distributed algorithm for fast optimal power flow regulation in Smart Grids,"Erseghe,Tomaso, ",2015,IEEE - Crossref,http://xplorestaging.ieee.org/ielx7/6995184/7007609/07007618.pdf?arnumber=7007618
29/01/2018,Adaptive scheduling algorithm for link recovery in smart metering mesh networks,"Jin,Yichao, Subramani,Siva, ",2015,IEEE - Crossref,http://xplorestaging.ieee.org/ielx7/7001799/7028730/07028979.pdf?arnumber=7028979
29/01/2018,Heuristic algorithm for coordinating smart houses in MicroGrid,"Zito,Michele, Grasso,Floriana, Arikiez,Mohamed, ",2016,IEEE - Crossref,http://xplorestaging.ieee.org/ielx7/7426159/7436263/07436275.pdf?arnumber=7436275
29/01/2018,A new link weight factor in backpressure scheduling algorithm for energy-efficient design of Smart Wireless Sensor Networks,"Alassery,Fawaz, ",2016,IEEE - Crossref,http://xplorestaging.ieee.org/ielx7/7580920/7589184/07589553.pdf?arnumber=7589553
29/01/2018,A Fast Algorithm for Detecting Hidden Objects by Smart Mobile Robots,"Kriheli,Boris, Levner,Eugene, Ng,C.T., Cheng,T.C.E., ",2017,IEEE - Crossref,http://xplorestaging.ieee.org/ielx7/7943263/7946954/07946978.pdf?arnumber=7946978
29/01/2018,Adaptive algorithm for microprocessor based distance relays in smart grid,"Ghosh,Prasanta, Bujanovic,Tomislav, ",2016,IEEE - Crossref,http://xplorestaging.ieee.org/ielx7/7580920/7589184/07589552.pdf?arnumber=7589552
29/01/2018,A control algorithm for a heterogeneous virtual battery storage providing FCR power,"German,Reinhard, Schlund,Jonas, ",2017,IEEE - Crossref,http://xplorestaging.ieee.org/ielx7/8027285/8038534/08038550.pdf?arnumber=8038550
29/01/2018,Topological deep learning algorithm with visual impression,"Li,Fanzhang, Yang,Mengduo, ",2017,IEEE - Crossref,http://xplorestaging.ieee.org/ielx7/8064441/8090780/08090854.pdf?arnumber=8090854
29/01/2018,Deep learning algorithm with visual impression,"Li,Fanzhang, Yang,Mengduo, He,Funan, ",2017,IEEE - Crossref,http://xplorestaging.ieee.org/ielx7/8064441/8090780/08090852.pdf?arnumber=8090852
29/01/2018,Live migration destination selecting method for disaster recovery on e-learning environment,"Kanenishi,Kazuhide, Togawa,Satoshi, ",2016,IEEE - Crossref,http://xplorestaging.ieee.org/ielx7/7422342/7425793/7425814.pdf?arnumber=7425814
29/01/2018,Using Smart Meter Data to Improve the Accuracy of Intraday Load Forecasting Considering Customer Behavior Similarities,"Szabados,Robert L., Wang,David Y., Huang,Heng, Lee,Wei-Jen, Quilumba,Franklin L., ",2014,IEEE - Crossref,http://xplorestaging.ieee.org/ielx7/5165411/7042857/06945384.pdf?arnumber=6945384
29/01/2018,On Privacy and Security Challenges in Smart Connected Homes,"Davidsson,Paul, Jacobsson,Andreas, Bugeja,Joseph, ",2017,IEEE - Crossref,http://xplorestaging.ieee.org/ielx7/7869493/7870173/07870217.pdf?arnumber=7870217
29/01/2018,Surveillance Systems for Smart Homes: A Comparative Survey,"Bourbakis,Nikolaos, Patrick,Ryan, ",2010,IEEE - Crossref,http://xplorestaging.ieee.org/ielx5/5362557/5362558/05363110.pdf?arnumber=5363110
29/01/2018,Research and Design of Smart Home System Based on Zigbee Technology,"Zhao,Li, Gao,Xiang, ",2010,IEEE - Crossref,http://xplorestaging.ieee.org/ielx5/5654674/5654689/05656492.pdf?arnumber=5656492
29/01/2018,Tracking Objects in a Smart Home,"Rosa,Paulo F.F., Fonseca,Vinicius Prado da, ",2014,IEEE - Crossref,http://xplorestaging.ieee.org/ielx7/6845413/6855809/06855910.pdf?arnumber=6855910
29/01/2018,Conflict resolution using enhanced label combination method for complex activity recognition in smart home environment,"Razali,Mohd Norhisham, Mustapha,Norwati, Sulaiman,Md. Nasir, Perumal,Thinagaran, Mohamed,Raihani, ",2017,IEEE - Crossref,http://xplorestaging.ieee.org/ielx7/8187602/8229179/08229477.pdf?arnumber=8229477
29/01/2018,A D-S Evidence Theory-based Relay Protection System Hidden Failures Detection Method in Smart Grid,"Wang,Yifei, Gong,Heteng, Jiao,Zaibin, ",2016,IEEE - Crossref,http://xplorestaging.ieee.org/ielx7/5165411/5446437/07563447.pdf?arnumber=7563447
29/01/2018,Human sensing using wearable wireless sensors for smart environments,"Sugimoto,Chika, ",2014,IEEE - Crossref,http://xplorestaging.ieee.org/ielx7/6698448/6727602/06727640.pdf?arnumber=6727640
29/01/2018,Designing New Experiences in the Smart Home: Multi-camera Person Localization Framework to Document Predefined Situations,"Moller,Sebastian, Quade,Michael, Schmiedeke,Sebastian, Engelbrecht,Klaus-Peter, ",2015,IEEE - Crossref,http://xplorestaging.ieee.org/ielx7/7194253/7194254/07194264.pdf?arnumber=7194264
29/01/2018,Cassandra smart-home system description,"Daniel Dumitrescu,Stefan, ",2017,IEEE - Crossref,http://xplorestaging.ieee.org/ielx7/7983002/7990423/07990440.pdf?arnumber=7990440
29/01/2018,An efficient technique for solving the scheduling of appliances in smart-homes,"Wolsey,Laurence A., Vankeerberghen,Guillaume, Jungers,Raphael M., Hendrickx,Julien M., ",2014,IEEE - Crossref,http://xplorestaging.ieee.org/ielx7/6849600/6858556/06858981.pdf?arnumber=6858981
29/01/2018,Intelligent appliance control algorithm for optimizing user energy demand in smart homes,"Verma,Pranjal, Srinivasan,Dipti, Mehta,Rahul, ",2017,IEEE - Crossref,http://xplorestaging.ieee.org/ielx7/7959755/7969277/07969449.pdf?arnumber=7969449
29/01/2018,Forecast of Yearly Stock Returns Based on Adaboost Integration Algorithm,"Ping,Chen, Guoying,Zhang, ",2017,IEEE - Crossref,http://xplorestaging.ieee.org/ielx7/8115602/8118402/08118452.pdf?arnumber=8118452
29/01/2018,Short-Term State Forecasting-Aided Method for Detection of Smart Grid General False Data Injection Attacks,"Wang,Jianhui, Chen,Chen, Dong,Zhao Yang, La Scala,Massimo, Zhang,Gexiang, Zhao,Junbo, ",2015,IEEE - Crossref,http://xplorestaging.ieee.org/ielx7/5165411/7953698/07313024.pdf?arnumber=7313024
29/01/2018,Context-aware activity prediction using human behavior pattern in real smart home environments,"Zeng,Yi-Chong, Fu,Li-Chen, Li,Ting-Ying, Xie,Yifei, Pradhan,Sipun Kumar, Wu,Chao-Lin, Tsai,Ming-Je, ",2016,IEEE - Crossref,http://xplorestaging.ieee.org/ielx7/7738291/7743369/07743376.pdf?arnumber=7743376
29/01/2018,Electricity price and demand forecasting under smart grid environment,"Woon,Wei Lee, Zeineldin,Hatem, Masri,Dina, ",2015,IEEE - Crossref,http://xplorestaging.ieee.org/ielx7/7155395/7165173/07165472.pdf?arnumber=7165472
29/01/2018,Intelligent temporal data driven world actuation in ambient environments: Case study: Anomaly recognition and assistance provision in smart home,"Bouchard,Bruno, Bouzouane,Abdenour, Amirjavid,Farzad, ",2013,IEEE - Crossref,http://xplorestaging.ieee.org/ielx7/6588696/6607797/06607856.pdf?arnumber=6607856
29/01/2018,An autonomous intelligent wheelchair for assisting people at need in smart homes: A case study,"Alamaniotis,Miltiadis, Tsoukalas,Lefteris, Ktistakis,Iosif Papadakis, Bourbakis,Nikolaos, ",2016,IEEE - Crossref,http://xplorestaging.ieee.org/ielx7/7376844/7387951/07388066.pdf?arnumber=7388066
29/01/2018,Demand-side behavior in the smart grid environment,"Haghbin,S., Ebrahimi,A., Yousefi,G. R., Moshari,A., ",2010,IEEE - Crossref,http://xplorestaging.ieee.org/ielx5/5621661/5638851/05638956.pdf?arnumber=5638956
29/01/2018,Towards unobtrusive ambient sound monitoring for smart and assisted environments,"Chin,Jeannette, Griffiths,Naomi, ",2017,IEEE - Crossref,http://xplorestaging.ieee.org/ielx7/7827233/7835874/07835882.pdf?arnumber=7835882
29/01/2018,Constructivist ambient intelligent agent for smart environments,"Reignier,Patrick, Najjar,Amro, ",2013,IEEE - Crossref,http://xplorestaging.ieee.org/ielx7/6523359/6529412/06529515.pdf?arnumber=6529515
29/01/2018,Ambient assisted smart home design using vibration and PIR sensors,"Cetin,A. E., Yazar,Ahmet, ",2013,IEEE - Crossref,http://xplorestaging.ieee.org/ielx7/6521474/6531159/06531531.pdf?arnumber=6531531
29/01/2018,Inferring health metrics from ambient smart home data,"Bond,Rodd, Doyle,Julie, Loane,John, Kealy,Andrea, Walsh,Lorcan, ",2015,IEEE - Crossref,http://xplorestaging.ieee.org/ielx7/6979782/6999111/06999237.pdf?arnumber=6999237
29/01/2018,Smart Home in Smart Microgrid: A Cost-Effective Energy Ecosystem With Intelligent Hierarchical Agents,"Fei,Yunsi, Jiang,Bingnan, ",2014,IEEE - Crossref,http://xplorestaging.ieee.org/ielx7/5165411/6991622/06912013.pdf?arnumber=6912013
29/01/2018,Generation dispatch in a smart grid environment,Not available,2010,IEEE - Crossref,http://xplorestaging.ieee.org/ielx5/5428221/5434721/05434781.pdf?arnumber=5434781
29/01/2018,Cyber-power system security in a smart grid environment,"Liu,Chen-Ching, Stefanov,Alexandru, ",2012,IEEE - Crossref,http://xplorestaging.ieee.org/ielx5/6170475/6175527/06175560.pdf?arnumber=6175560
29/01/2018,Photovoltaic charging station for Plug-In Hybrid Electric Vehicles in a smart grid environment,"Shireen,W., Preetham,G., ",2012,IEEE - Crossref,http://xplorestaging.ieee.org/ielx5/6170475/6175527/06175589.pdf?arnumber=6175589
29/01/2018,Smart environment technology as a possible enabler of smart cities,"Roselli,Luca, Pinho,Pedro, Carvalho,Nuno B., Goncalves,Ricardo, ",2014,IEEE - Crossref,http://xplorestaging.ieee.org/ielx7/6842514/6847849/06848676.pdf?arnumber=6848676
29/01/2018,Demand-side management-based dynamic pricing within smart grid environment,"Azmy,Ahmed M., Abaza,A., ",2014,IEEE - Crossref,http://xplorestaging.ieee.org/ielx7/6697909/6707881/06707899.pdf?arnumber=6707899
29/01/2018,Smart energy management in a smart environment using a mobile device,"Tariq,Taleb, ",2014,IEEE - Crossref,http://xplorestaging.ieee.org/ielx7/6962872/6970090/06970109.pdf?arnumber=6970109
29/01/2018,Smart mobile robot for security of low visibility environment,"Alsulaiman,Mansour, Mathkour,Hassan, Faisal,Mohammed, ",2015,IEEE - Crossref,http://xplorestaging.ieee.org/ielx7/7155754/7176382/07176432.pdf?arnumber=7176432
29/01/2018,Automated vehicles in smart urban environment: A review,"Prikryl,Jan, Pribyl,Ondrej, Anany,Hossam, Pereira,Andre Maia, ",2017,IEEE - Crossref,http://xplorestaging.ieee.org/ielx7/7963867/7973339/07973864.pdf?arnumber=7973864
29/01/2018,Smart building monitoring from structure to indoor environment,"Mrna,J., Maska,M., Vodicka,A., Vcelak,J., ",2017,IEEE - Crossref,http://xplorestaging.ieee.org/ielx7/7963867/7973339/07973859.pdf?arnumber=7973859
29/01/2018,Evaluation of traffic control impact on smart cities environment,"Ruzicka,Jiri, Tichy,Tomas, Belinova,Zuzana, Cikhardtova,Kristyna, ",2016,IEEE - Crossref,http://xplorestaging.ieee.org/ielx7/7495593/7501002/07501011.pdf?arnumber=7501011
29/01/2018,Smart sensors for interoperable Smart Ocean Environment,"Edgington,Duane, Broring,Arne, Manuel,Antoni, Headley,Kent, del Rio,Joaquin, O'Reilly,Tom, Toma,Daniel Mihai, ",2011,IEEE - Crossref,http://xplorestaging.ieee.org/ielx5/5977168/6003381/06003654.pdf?arnumber=6003654
29/01/2018,Selective scheduling: Controlling non-preemptive devices in smart grid environment,"Kalaimannan,Ezhil, Chakraborty,Nilotpal, ",2017,IEEE - Crossref,http://xplorestaging.ieee.org/ielx7/8070902/8085952/08085962.pdf?arnumber=8085962
29/01/2018,Unit commitment in achieving low carbon smart grid environment with virtual power plant,"Matthews,Peter, Sun,Hongjian, Li,Dan, Hua,Weiqi, ",2017,IEEE - Crossref,http://xplorestaging.ieee.org/ielx7/8064441/8090780/08090810.pdf?arnumber=8090810
29/01/2018,Environment-aware power generation scheduling in smart grids,"Zhu,Quanyan, Xu,Zhiheng, ",2016,IEEE - Crossref,http://xplorestaging.ieee.org/ielx7/7426159/7436263/07436309.pdf?arnumber=7436309
29/01/2018,Urban Data Games: Creating Smart Citizens for Smart Cities,"Cavero,Jose, Kortuem,Gerd, Wolff,Annika, ",2015,IEEE - Crossref,http://xplorestaging.ieee.org/ielx7/7262584/7265235/07265294.pdf?arnumber=7265294
29/01/2018,Making a video smart for smart e-learning,"Choi,Wan, Jang,Jonghyun, Park,Yoomi, Huh,Seyoung, ",2015,IEEE - Crossref,http://xplorestaging.ieee.org/ielx7/7337634/7354472/07354686.pdf?arnumber=7354686
29/01/2018,Non-intrusive human activity monitoring in a smart home environment,"Leung,Victor C.M., Nasiopoulos,Panos, Pourazad,Mahsa T., Amiri,S. Mohsen, ",2014,IEEE - Crossref,http://xplorestaging.ieee.org/ielx7/6713381/6720623/06720748.pdf?arnumber=6720748
29/01/2018,Introducing decision support for smart mobile health behavior change applications,"Finkelstein,Joseph, Jeong,In Cheol, Kukafka,Rita, ",2015,IEEE - Crossref,http://xplorestaging.ieee.org/ielx7/7062153/7072806/07072856.pdf?arnumber=7072856
29/01/2018,Characterizing evolution of extreme public transit behavior using smart card data,"Wang,Yinhai, Ke,Ruimin, Long,Ying, Cui,Zhiyong, ",2015,IEEE - Crossref,http://xplorestaging.ieee.org/ielx7/7347908/7366145/07366217.pdf?arnumber=7366217
29/01/2018,Towards an unified architecture for smart home and Ambient Assisted Living solutions: A focus on elderly people,"Karduck,Achim P., Ziganki,Sebastian, Zucker,Markus, Fabbricatore,Christian, ",2011,IEEE - Crossref,http://xplorestaging.ieee.org/ielx5/5902073/5936563/05936643.pdf?arnumber=5936643
29/01/2018,Predicting activity occurrence time in smart homes with evolving fuzzy models,"Misra,Iti Saha, Baruah,Diganta, Singh,Manish, Baruah,Rashmi Dutta, ",2017,IEEE - Crossref,http://xplorestaging.ieee.org/ielx7/8011834/8015374/08015728.pdf?arnumber=8015728
29/01/2018,Applying reinforcement learning method to optimize an Energy Hub operation in the smart grid,"Ranjbar,A. M., Sheikhi,A., Rayati,M., ",2015,IEEE - Crossref,http://xplorestaging.ieee.org/ielx7/7118474/7131775/07131906.pdf?arnumber=7131906
29/01/2018,A Machine Learning and Wavelet-Based Fault Location Method for Hybrid Transmission Lines,"Evrenosoglu,C. Yaman, Livani,Hanif, ",2013,IEEE - Crossref,http://xplorestaging.ieee.org/ielx7/5165411/6693741/06558520.pdf?arnumber=6558520
29/01/2018,Control of Flexible Smart Devices in the Smart Grid,"Koutitas,George, ",2012,IEEE - Crossref,http://xplorestaging.ieee.org/ielx5/5165411/6275510/06230623.pdf?arnumber=6230623
29/01/2018,A Hierarchical Framework for Smart Grid Anomaly Detection Using Large-Scale Smart Meter Data,"Wang,Jianhui, Moghaddass,Ramin, ",2017,IEEE - Crossref,http://xplorestaging.ieee.org/ielx7/5165411/5446437/07908945.pdf?arnumber=7908945
29/01/2018,Provable security analysis of complex or smart computer systems in the smart grid,"Mallissery,Sanoop, Madhusudhanan,Sheema, ",2017,IEEE - Crossref,http://xplorestaging.ieee.org/ielx7/8027285/8038534/08038578.pdf?arnumber=8038578
29/01/2018,"Asymptotic analysis of a new low complexity encryption approach for the Internet of Things, smart cities and smart grid","Blum,Rick S., Samudrala,Ananth Narayan, ",2017,IEEE - Crossref,http://xplorestaging.ieee.org/ielx7/8027285/8038534/08038576.pdf?arnumber=8038576
29/01/2018,A Novel Smart High-Voltage Circuit Breaker for Smart Grid Applications,"Geng,Yingsan, Ma,Zhiying, Huang,Garng M., Liu,Jun, ",2011,IEEE - Crossref,http://xplorestaging.ieee.org/ielx5/5165411/5772087/05765716.pdf?arnumber=5765716
29/01/2018,Smart “Stick-on” Sensors for the Smart Grid,"Divan,Deepak, Lambert,Frank C., Moghe,Rohit, ",2011,IEEE - Crossref,http://xplorestaging.ieee.org/ielx5/5165411/6155182/06046112.pdf?arnumber=6046112
29/01/2018,From Demand Response in Smart Grid Toward Integrated Demand Response in Smart Energy Hub,"Sheikhi,Aras, Bahrami,Shahab, ",2015,IEEE - Crossref,http://xplorestaging.ieee.org/ielx7/5165411/7410169/7206579.pdf?arnumber=7206579
29/01/2018,A Data Mining Framework for Activity Recognition in Smart Environments,"Cook,Diane J., Das,Barnan, Chen,Chao, ",2010,IEEE - Crossref,http://xplorestaging.ieee.org/ielx5/5672649/5673536/05673843.pdf?arnumber=5673843
29/01/2018,Towards a Theory of Space for Activity Recognition in Smart Environments Based on Rough Sets,"Guesgen,Hans W., ",2015,IEEE - Crossref,http://xplorestaging.ieee.org/ielx7/7194253/7194254/07194286.pdf?arnumber=7194286
29/01/2018,Location Learning for Smart Homes,"Deogun,Jitender S., Manley,Eric D., ",2010,IEEE - Crossref,http://xplorestaging.ieee.org/ielx5/4221005/4224052/04224201.pdf?arnumber=4224201
29/01/2018,Is Anybody Home? Inferring Activity From Smart Home Network Traffic,"Rowe,Jeff, Bishop,Matt, Levitt,Karl, Copos,Bogdan, ",2016,IEEE - Crossref,http://xplorestaging.ieee.org/ielx7/7517741/7527729/07527776.pdf?arnumber=7527776
29/01/2018,Activity Recognition for Smart Homes Using Dempster-Shafer Theory of Evidence Based on a Revised Lattice Structure,"Nugent,Chris, Bi,Yaxin, Liao,Jing, ",2010,IEEE - Crossref,http://xplorestaging.ieee.org/ielx5/5672649/5673536/05673770.pdf?arnumber=5673770
29/01/2018,A robust edge-based optical flow method for elderly activity classification with wearable smart cameras,"Velipasalar,Senem, Ozcan,Koray, Mahabalagiri,Anvith, ",2014,IEEE - Crossref,http://xplorestaging.ieee.org/ielx7/6766836/6778199/06778214.pdf?arnumber=6778214
29/01/2018,Applying SARIMA time series to forecast sleeping activity for wellness model of elderly monitoring in smart home,"Rayudu,R. K., Mukhopadhyay,S. C., Survadevara,N. K., ",2013,IEEE - Crossref,http://xplorestaging.ieee.org/ielx5/6428838/6461638/06461661.pdf?arnumber=6461661
29/01/2018,Practical behavior and technology challenges for smart homes,"Corsiuc,G., Gavrila,I., Ceuca,Emilian, ",2017,IEEE - Crossref,http://xplorestaging.ieee.org/ielx7/7994775/8000877/08000964.pdf?arnumber=8000964
29/01/2018,Smart sensing and smart material for smart automotive damping,"Sommella,Paolo, Paciello,Vincenzo, ",2013,IEEE - Crossref,http://xplorestaging.ieee.org/ielx7/5289/6616273/06616288.pdf?arnumber=6616288
29/01/2018,IEEE Transactions on Smart Grid publication information,Not available,2011,IEEE - Crossref,http://xplorestaging.ieee.org/ielx5/5165411/6084801/06084885.pdf?arnumber=6084885
29/01/2018,IEEE Transactions on Smart Grid publication information,Not available,2010,IEEE - Crossref,http://xplorestaging.ieee.org/ielx5/5165411/5552162/05552165.pdf?arnumber=5552165
29/01/2018,IEEE Transactions on Smart Grid publication information,Not available,2010,IEEE - Crossref,http://xplorestaging.ieee.org/ielx5/5165411/5629465/05640328.pdf?arnumber=5640328
29/01/2018,2010 Index IEEE Transactions on Smart Grid Vol. 1,Not available,2010,IEEE - Crossref,http://xplorestaging.ieee.org/ielx5/5165411/5629465/05640329.pdf?arnumber=5640329
29/01/2018,IEEE Transactions on Smart Grid publication information,Not available,2011,IEEE - Crossref,http://xplorestaging.ieee.org/ielx5/5165411/5715606/05715620.pdf?arnumber=5715620
29/01/2018,IEEE Transactions on Smart Grid publication information,Not available,2011,IEEE - Crossref,http://xplorestaging.ieee.org/ielx5/5165411/5772087/05772090.pdf?arnumber=5772090
